政治	政治	zhèngzhì	paternalism, trouble, government, policy, political relation, political science, polity, politics, political affairs, political
之前	之前	zhīqián	before, prior to, ago
之後	之后	zhīhòu	later, behind, at the back of, after
之一	之一	zhīyī	one of (sth), one out of a multitude, one (third, quarter, percent etc)
支	支	zhī	m.[general]
之間	之间	zhījiān	among, between
植物	植物	zhíwù	vegetal, flora, herb, plant, grower, vegetable, plant life, vegetation, botanical, vegetive, dwarf, vegetative
制訂	制订	zhìdìng	work/map out, formulate
指揮	指挥	zhǐhuī	conduct, direct, command
質量	质量	zhìliàng	weight, molar, mass, quantity, quality
治	治	zhì	study, research, cure, govern, treat, government, eliminate, harness, rule, manage, wipe out, management, administration, administer, control, punish, treat (disease)
治療	治疗	zhìliáo	treatment, cure
智力	智力	zhìlì	intelligence, intellect
智能	智能	zhìnéng	intelligent, able, smart (phone, system, bomb etc)
中介	中介	zhōngjiè	to act as intermediary, to link, intermediate, inter-, agency, agent
種類	种类	zhǒnglèi	kidney, description, race, form, nature, manner, variety, feather, ordering, ilk, style, class, order, stamp, type, genus, category, stripe, kind, strain, cast, shape, denomination, species, persuasion, league, classification, breed, sort
中獎	中奖	zhòng jiǎng	to win a prize, a successful gamble
種植	种植	zhòngzhí	plant, grow
種	种	zhǒng	m.[kind]
逐漸	逐渐	zhújiàn	step_by_step, by degrees, gradually
逐步	逐步	zhúbù	step by step, progressively
重量	重量	zhòngliàng	avoirdupois weight, weight, ponderousness, heaviness, loading, heft, ponderosity, avoirdupois, heftiness, massiveness, gravity, lading
主席	主席	zhǔxí	chairwoman, presiding officer, president (of organization, chair, chair (of meeting), prolocutor, chairperson, subchairman, chairmanship, state), chairman, chair/president (of organization/state), moderator, president
祝福	祝福	zhùfú	invoke blessing, wish happiness to
主題	主题	zhǔtí	motif, lemma, musical theme, theme, thesis, idea, literary argument, argument, motive, leitmotiv, matter, subject_matter, keynote, issue, subject, topic, mythos, melodic theme
著名	著名	zhùmíng	famous, noted, well-known, celebrated
抓緊	抓紧	zhuā jǐn	to grasp firmly, to pay special attention to, to rush in, to make the most of
專心	专心	zhuānxīn	occupy, immerge, pore, zoom in, concentrate, betake, dive, pay attention, concentrate effort, advert, give ear, center, rivet, concentrate one's attention, focus, hang, pay heed, devote, apply, be absorbed, be absorbed in, centre, attend
轉動	转动	zhuǎn dòng	turn (round), move
著作	著作	zhùzuò	composition, writing, composing, oeuvre, work, opus, literature, writings, book, production, bookmaking, body of work
轉告	转告	zhuǎngào	to pass on, to communicate, to transmit
轉身	转身	zhuǎn shēn	turn round, go_about, face about, turn
轉彎	转弯	zhuǎn wān	to turn, to go around a corner
裝修	装修	zhuāngxiū	repair, renovate (house/etc.), decorate, renovate (house, etc.), renovate, furnish, renovation, fit up
裝置	装置	zhuāngzhì	install, fit
轉移	转移	zhuǎnyí	shift, transfer, divert, change, transform
準時	准时	zhǔnshí	on time, punctual, on schedule
追求	追求	zhuīqiú	seek, pursue, woo, court
資料	资料	zīliào	food, source, info, means, data, information, material, datum, data point, matter
自	自	zì	from, since
資源	资源	zīyuán	resource, natural resources, mine, resources
字母	字母	zìmǔ	letter (of the alphabet), CL:個|个[ge4]
綜合	综合	zōnghé	synthetical, comprehensive, multiple, composite
自信	自信	zìxìn	self-confidence
總共	总共	zǒnggòng	in all, all told, altogether
總理	总理	zǒnglǐ	premier, prime minister
總統	总统	zǒngtǒng	president (of a republic)
總之	总之	zǒngzhī	in a word, tout ensemble, on the whole, all in all, altogether, in short
阻止	阻止	zǔzhǐ	prevent, stop, prohibit
嘴巴	嘴巴	zuǐba	jaw, cheeks, kisser, mouth
作出	作出	zuòchū	make (decision/etc.)
作為	作为	zuòwéi	regard as, look on as, take for
最初	最初	zuìchū	first, primary, initial, original, at first, initially, originally
做夢	做梦	zuò mèng	to dream, to have a dream, fig. illusion, fantasy, pipe dream