生命	生命	shēngmìng	breath, god, head, anima, days, organism, blood, life, living thing, skin, longevity, being, vital, life form
生意	生意	shēngyi	business enterprise, vocation, practice, merchant, dealing, patronage, deal, commercial enterprise, trade, biz, business, dealings, racket
生長	生长	shēngzhǎng	grow, develop
生	生	shēng	give birth to, bear, grow, get, have, cause to happen, make (a fire), exist, live
聲明	声明	shēngmíng	statement, pronouncement
勝	胜	shèng	be superior to, surpass, succeed, win victory, be victorious, get the better of, can bear, carry, excel, be successful, win
勝利	胜利	shènglì	win victory/success
石頭	石头	shítou	stony, chimney, rock, lapis, stone
石油	石油	shíyóu	crude, rock oil, crude oil, oil, coal oil, fossil_oil, fossil oil, petroleum
時	时	shí	time (when), period, hour
失去	失去	shīqù	desert, shear, outgrow, loss, lost, miss, lose
時代	时代	shídài	day, period, a period in one's life, epoch, present time, historical period, time, chapter, period in one's life, modern times, historic period, contemporary world, times, era, modern world, age
實際上	实际上	shíjìshang	in fact, in reality, as a matter of fact, in practice
實行	实行	shíxíng	put into effect, fulfil, put ... into practice, practise, practice, put into practice/effect, live, pass, obtain, prosecute, cause, phase, meet, carry_out, pull, effect, operate, carry out, actualize, use, effectuate, put ... into effect, perform, apply, put into practice, run, implement, execute, do, make, wage, implementation
實力	实力	shílì	strength, actual strength, efficiency
時刻	时刻	shíkè	moment, occasion, juncture, sand, hour, time
實驗室	实验室	shíyànshì	lab, science lab, laboratory
實驗	实验	shíyàn	experiment, test
食品	食品	shípǐn	menu, vivers, viand, chow, eatable, provisions, tuck, foodstuff, viands, nourishment, comestible, tack, nutrient, victual, food, grocery, victualage, cuisine
始終	始终	shǐzhōng	all_the_time, from beginning to end, from start to finish, always, all along, evermore, throughout
使	使	shǐ	rarefy, piss_off, germinate, drench, blow_out, leave, cut_up, refract, run, dress_up, compose, shed, frizz, put_off, trot, send, strike, send (as envoy), peal, alienate, pull_in, tone_up, bring around, astound, sublease, wither, cripple, bed_down, address, rehearse, usage, warm, smell_out, throw, inflect, get_down, skunk, capsize, congeal, bowl_over, bring_on, unseat, ensure, amalgamate, pro
世紀	世纪	shìjì	one C, centred, C, century, age, hundred, 100
世界	世界	shìjiè	mundane, creation, world, monde, orb, nature, domain
市場	市场	shìchǎng	bourse, bazar, marketplace, grocery store, agora, bazaar, securities industry, grocery, piazza, plaza, rialto, mart, pitch, market
世界杯	世界杯	shìjièbēi	World Cup
事故	事故	shìgù	circumstance, trouble, mischance, accident, mishap, affair, bad luck, natural event, happening, occurrence
事件	事件	shìjiàn	fact, event, page, incidental, go, case, job, natural event, timing, proceedings, social occasion, happening, occurrence, matter, occasion, incident, shebang, affair, chapter, concernment
事實	事实	shìshí	mood, circumstance, fact, factual, reality, verity, case, deed, sooth, troth, actuality, truth, matter, matter of fact
事實上	事实上	shìshíshang	in fact, in reality, actually, as a matter of fact, de facto, ipso facto
事業	事业	shìyè	proposition, task, pidgin, institution, undertaking, deed, facilities, life history, endeavour, endeavor, cause, career, project, action, enterprise
試驗	试验	shìyàn	test, experiment
試題	试题	shìtí	exam question, test topic
適合	适合	shìhé	qualify, conform, fit, go, befit, quadrate, will, accord, tailor, beseem, serve, comport, gee, answer, become, fit_in, service, pertain, like, accommodate, agree, belong, characterize, make, suit, match
適用	适用	shìyòng	applicable, lend oneself, apply, be applicable, suit
適應	适应	shìyìng	be accustomed to, conform, be used to, fit, humor, gear, orient, phase, adjust, accommodate, be accustomed, be inure to, get used to, adaptation, adapt, suit
收費	收费	shōu fèi	collect fees, charge
收看	收看	shōukàn	watch, tune in, watch (e.g., receive, look in, watch (e.g., TV), tune into, TV)
室	室	shì	surname Shi, room, work unit, grave, scabbard, family or clan, one of the 28 constellations of Chinese astronomy
收聽	收听	shōutīng	to listen (to), to listen (in)
手續	手续	shǒuxù	formality, procedures, formalities, procedure
收音機	收音机	shōuyīnjī	radio, CL:臺|台[tai2]
首都	首都	shǒudū	capital (of country)
手指	手指	shǒuzhǐ	finger
首先	首先	shǒuxiān	first (of all), in the first place
受傷	受伤	shòu shāng	injure, bruise, injured, be wounded, crush, hurt, sustain an injury, be injured, wounded, maimed, wound
受	受	shòu	passive signifier
輸	输	shū	lose, be defeated
書架	书架	shūjià	bookshelf, CL:個|个[ge4]
熟人	熟人	shúrén	acquaintance, friend
輸入	输入	shūrù	import, input
屬	属	shǔ	belong, be born in the year of, belong to, be subordinate to, be
束	束	shù	surname Shu, to bind, bunch, bundle, classifier for bunches, bundles, beams of light etc, to control
屬於	属于	shǔyú	fall under, be part of, pertain, appertain, belong, relegate, fall into, belong_to, fall_under, reside, belong to, attach
雙方	双方	shuāngfāng	both, the two parties, two parties, both sides
數量	数量	shùliàng	magnitude, scalar, aggregate, deal, measure, numerical quantity, measurement, sum, worth, amount, quantity, number
思想	思想	sīxiǎng	cogitation, mentation, imagery, imaging, lunatic_fringe, mental imagery, idea, thinking, imagination, ideology, thought, pensee, ideological
雙	双	shuāng	m.[general]
死	死	sǐ	die
速度	速度	sùdù	pacing, wings, rate, quickness, fastness, velocity, swiftness, lick, pace, rapidity, speed, career, tempo
隨	随	suí	v.2 right after v.1
所	所	suǒ	that which
颱	台	tái	short for Taiwan
所長	所长	suǒcháng	head of an institute/etc.
談判	谈判	tánpàn	negociate, treat, talks, negotiation, negotiate, talk terms, parley, palaver, negotiations, imparl
談話	谈话	tánhuà	talk, speech
談	谈	tán	talk, chat
湯	汤	tāng	hot/boiling water, hot springs, soup, broth
糖	糖	táng	refined sugar, carob bar, negus, sugar, candy, carbohydrate, sweets
特色	特色	tèsè	motif, a character, a characteristic, manner, trait, differentiation, flavor, colour, singularity, distinction, characteristic, hue, stripe, physiognomy, a distinguishing feature, idiom, specialty, character, difference, particular, distinguishing feature, distinguishing feature/quality, salience, coloration, distinguishing quality, specific, feature, peculiarity, artistic st
提問	提问	tíwèn	to question, to quiz, to grill
提前	提前	tíqián	counter, foresee, shift to an earlier date, set ahead, advance date, advanced, advancement, move up, anticipate, advance, forestall
體會	体会	tǐhuì	know/learn from experience, realize
體現	体现	tǐxiàn	to embody, to reflect, to incarnate
題目	题目	tímù	exam questions, head, lemma, theme, thesis, examination questions, question, text, title, ground, subject, topic, exercise problems, chapter, caption, rubric, heading
體驗	体验	tǐyàn	learn through practice/experience
天空	天空	tiānkōng	firmament, heavenly, empyrean, heavens, welkin, blue, canopy, cloud, the heavens, vault, air, sky, the sky, Aether, wild blue yonder, blue air, heaven, blue sky, space
甜	甜	tián	sweet, agreeable
跳	跳	tiào	ricochet, make omissions, sell grain, vault, hop, bounce, bound, omission, omit, palpitate, move up and down, skip over, beat, take, spring, skip, dance, hurdle, skip (over), jump, leap
跳高	跳高	tiàogāo	high jump (athletics)
跳遠	跳远	tiàoyuǎn	long jump (athletics)
調整	调整	tiáozhěng	adjust, readjust, regulate, restructure, balance
鐵	铁	tiě	shovel, smoothing iron, iron, ferrous, arms, Surname, Fe, ferrum, spade, weapon
跳舞	跳舞	tiào wǔ	hop, trip the light fantastic, trip, cakewalk, dancing, dance, saltate, hoof, step
聽眾	听众	tīngzhòng	auditor, listener, hearer, audience, auditory, gallery, listeners
聽力	听力	tīnglì	hearing, listening ability
通常	通常	tōngcháng	normal, commonly, customarily, more often than not, general, usual, on average, as a rule, ordinarily, mostly, as usual, typically, generally, normally, by and large, unremarkably, on the average, usually
通信	通信	tōngxìn	communicate by letter, correspond
鐵路	铁路	tiělù	rails, railroad track, loop-line, rail, Pullman, railway, road, couchette, chemmy, railroad
停止	停止	tíngzhǐ	cease, flunk, desist, pass, suspend, stint, pass_off, break_up, stash, cut, stay, cessation, adjourn, rain_out, give, detain, blow_over, seize, give up, balk, cheese, abstain, refrain, knock_off, rest, abandon, break, knock off, drop, go, tie_up, stop, interdict, strike, lay_off, stow, cut off, discontinue, pause, leave_off, leave off, set aside, give_out, cut_out, give_up, delay, quit, cut out
同意	同意	tóngyì	agree, consent, approve
痛苦	痛苦	tòngkǔ	be painful; pain
痛	痛	tòng	ache, pain
頭	头	tóu	head, hair (style), top/end of sth., chief
頭腦	头脑	tóunǎo	pericranium, leader, head, noggin, brain, brains, main threads, clue, nous, loaf, bean, psyche, headpiece, mind, pate, skull
突出	突出	tū chū	outstanding
圖	图	tú	picture, drawing, chart, map
突然	突然	tūrán	suddenly, presto, unexpectedly, abruptly, at once, all_at_once, all together, all of a sudden, all at once
圖畫	图画	túhuà	drawing, picture
土	土	tǔ	soil, earth, clay, land
團	团	tuán	m.[proximation]
團結	团结	tuánjié	unite, rally
團體	团体	tuántǐ	fraternity, sect, phalanx, collective, body, group, sodality, element, organisation, corporation, confession, college, establishment, brotherhood, community, organization, squad, union, administration, society, army, commonwealth, consort, company, lineup, combine, governance, clan, combination, fellowship, organizational, bloc, team, party, connection, family, brass, squadron
推動	推动	tuī dòng	push forward, promote
推廣	推广	tuīguǎng	popularize, spread, extend
推進	推进	tuījìn	to impel, to carry forward, to push on, to advance, to drive forward
推開	推开	tuīkāi	to push open (a gate etc), to push away, to reject, to decline
退	退	tuì	retreat, retire, decline, ebb
退出	退出	tuì chū	withdraw from, quit
退休	退休	tuìxiū	to retire, to go into retirement, to step down
外交	外交	wàijiāo	diplomatics, diplomatic negotiations, diplomacy, nonintervention, diplomatism, diplomatic, foreign affairs
外文	外文	wàiwén	foreign language (written)
完美	完美	wánměi	perfect, consummate
外面	外面	wàimian	surface, outward appearance, without, outside, exterior
完整	完整	wánzhěng	complete, integrated, intact
完善	完善	wánshàn	perfect, consummate
玩具	玩具	wánjù	yo-yo, bauble, plaything, toy, teether, knickknack
往往	往往	wǎngwǎng	oftentimes, ofttimes, always, more often than not, frequently, oft, often
危險	危险	wēixiǎn	dangerous, perilous
危害	危害	wēihài	to jeopardize, to harm, to endanger, harmful effect, damage, CL:個|个[ge4]
為	为	wèi	by
偉大	伟大	wěidà	great, mighty
衛生間	卫生间	wèishēngjiān	bathroom, toilet, WC, CL:間|间[jian1]
衛生	卫生	wèishēng	hygiene, health, sanitation
為了	为了	wèile	in order to, for the purpose of, so as to
溫暖	温暖	wēnnuǎn	warm
圍	围	wéi	surname Wei, to encircle, to surround, all around, to wear by wrapping around (scarf, shawl)
文化	文化	wénhuà	civilization, literacy, acculturation, Kultur, vandalism, cultural, education, schooling, culture
文明	文明	wénmíng	civilization, culture
文件	文件	wénjiàn	page, documental, archive, writ, documents, data file, paper, document, judicial writ, literature, circular, documentation, portfolio, archives, file, written document, papers
文章	文章	wénzhāng	nonsense, hidden meaning, writing, hidden, written material, article, implied meaning, essay, writings, literary works, patch, hidden/implied meaning
文學	文学	wénxué	literary, philology, letters, letter, literature
握手	握手	wò shǒu	to shake hands
屋子	屋子	wūzi	room, house
武器	武器	wǔqì	enginery, steel, arming, armament, weapons system, hardware, armored, armature, munition, weaponry, artillery, implements of war, armory, arms, ammunition, armor, weapon, arm, armoring
武術	武术	wǔshù	military skill or technique (in former times), all kinds of martial art sports (some claiming spiritual development), self-defense, tradition of choreographed fights from opera and film (recent usage), also called kungfu 功夫, CL:種|种[zhong3]
文字	文字	wénzì	writing, phraseology, writing style, language, endearment, script, written language, text, writing phraseology, writing style/phraseology, character, textual, characters, symbolic representation, version, word-sign, literal, letter, word, literalness
西部	西部	xībù	western part, West, westward, west, the west
舞臺	舞台	wǔtái	board, arena, bandstand, stage, proscenium, boards
下來	下来	xià lai	come down from a higher place
系	系	xì	be
希望	希望	xīwàng	hope, wish
下去	下去	xià qu	go on, continue, go down, descend, take_up, descent
顯然	显然	xiǎnrán	evidently, manifestly, clear, visibly, plainly, plain, distinctly, clearly, patently, apparently, obviously
先進	先进	xiānjìn	advance
顯得	显得	xiǎnde	seem, look, appear
下面	下面	xiàmian	next, lower level, underside, following, underneath, subordinate, undersurface
顯示	显示	xiǎnshì	demonstrate, argue, exhibit, prove, display, show, illustrate, manifest, demonstration, announce, stamp, unroll, witness, write, give, evince, dangle, betray, bespeak, say, profess, develop, indicate, signal, flaunt, read, register, manifestation, speak, reveal, evidence, tell, shew, proclaim, discover, stage, bear, establish, record, prognosticate, betoken, note, signalize
現場	现场	xiànchǎng	scene (of an incident), location, site, locale, scene of a crime, locality, live, scene, spot, field
現代	现代	xiàndài	modern
現金	现金	xiànjīn	quids, rhino, clink, ready, cash reserve in bank, dough, dust, ducat, kale, cash, blunt, till, ready money
現實	现实	xiànshí	reality, actuality
線	线	xiàn	thread, string, wire
相當	相当	xiāngdāng	quite, fairly, considerably
相比	相比	xiāngbǐ	liken, equate, compare, comparison
現象	现象	xiànxiàng	phenomenon, phenomenal, appearance
相互	相互	xiānghù	each other, mutually, one another, in return, reciprocally
相關	相关	xiāngguān	cognate, relational, interrelate, associated, be interrelated, relevant, related, be mutually related
相似	相似	xiāngsì	resemblance, alike, be alike, be similar/alike, match, be similar, resemble
香	香	xiāng	fragrant, scented, savory, appetizing, popular, welcome
香蕉	香蕉	xiāngjiāo	banana
消費	消费	xiāofèi	expenditure
消失	消失	xiāoshī	disappear, vanish, dissolve
消息	消息	xiāoxi	communication, witting, message, item, news, peep, info, intelligence, notice, information, advertisement, tidings, advert, word
寫作	写作	xiězuò	writing
血	血	xuè	claret, blood, hematic, lifeline, lifeblood, sap
效果	效果	xiàoguǒ	operation, execution, result, effect, background, sound effects, purpose, point, background signal, fruitage, outcome, force, punch
心	心	xīn	heart, mind, feeling, center, core
信封	信封	xìnfēng	envelope, CL:個|个[ge4]
行李	行李	xíngli	clobber, impedimenta, dunnage, luggage, baggage
信任	信任	xìnrèn	trust, have confidence in
形成	形成	xíngchéng	take shape, form
形式	形式	xíngshì	circumstance, form, kind, modality, reading, interpretation, variety, shape, embodiment, species, mode, version, sort
形象	形象	xíngxiàng	imagery, figure, form, picture, persona, image
形狀	形状	xíngzhuàng	set, figuration, physiognomy, form, appearance, shape
幸福	幸福	xìngfú	happy
幸運	幸运	xìngyùn	very fortunate, lucky
信	信	xìn	letter, mail, message
性	性	xìng	nature, character, sex, gender
性別	性别	xìngbié	sexuality, grammatical gender, sexual distinction, sex, gender
性格	性格	xìnggé	fibre, make-up, mettle, humor, nature, complexion, capacity, mentality, mould, mold, being, streak, temperament, personality, character, fiber, disposition, strain, makeup, make
修	修	xiū	embellish, decorate, repair, mend, overhaul, build, construct, trim, prune
修改	修改	xiūgǎi	revise, amend, alter
需求	需求	xūqiú	need, requisition, demand, want, desiderative, requirement, call
需要	需要	xūyào	need, want, require, demand
宣布	宣布	xuānbù	declare, proclaim, announce
宣傳	宣传	xuānchuán	propagandist, publicist
訓練	训练	xùnliàn	training
選手	选手	xuǎnshǒu	participant, basketeer, athlete selected for a sports meet, basketball player, jock, contestant, cap, cager, athlete, player, champ, performer, player selected as contestant
學費	学费	xuéfèi	entrance_fee, tuition fee, premium, schooling, tuition
壓	压	yā	weight_down, hold down, push down, compact, constrict, be getting near, suppress, squeeze, compress, risk money on, quell, bring pressure to, pull, press, keep under control, throttle, push/hold down, intimidate, scrunch, weigh down, scrouge, daunt, shelve, pigeonhole, contract, approach, keep under, push, stake, control
壓力	压力	yālì	force per unit area, P, strain, overwhelming force, pressure sensation, burdensomeness, oppressiveness, pressure, onerousness, stress, compulsion, constraint, muscle, lading
煙	烟	yān	smoke, mist, vapor
演	演	yǎn	elaborate, development, practise, practice, develop, act, performance, represent, deduction, drill, play, evolution, evolve, play the part of, perform, play the role of, mount, elaboration, deduce
眼前	眼前	yǎnqián	before one's eyes
演唱	演唱	yǎnchàng	sing in performance
演唱會	演唱会	yǎnchànghuì	vocal recital
演員	演员	yǎnyuán	actor or actress, playactor, imitator, stage manager, barnstormer, actor, performer, impersonator, cast, performing artist, dramatis personae, role player, histrionic, thespian, trouper, player, cast of characters, stager, histrion
演出	演出	yǎnchū	show, perform
羊	羊	yáng	kidney, drover, baa, trotter, argali, mutton, sheep, Surname
陽光	阳光	yángguāng	sunray, shine, sun, sunlight, sunshine, sunbeam
要是	要是	yàoshi	conj.: if, suppose, in case
一切	一切	yīqiè	det.: everything, every
衣架	衣架	yījià	clothes hanger, clothes rack
以來	以来	yǐlái	since
已	已	yǐ	already
一方面	一方面	yīfāngmiàn	conj.: on one side, on the one hand..., on the other hand..., for one thing..., for another...
藝術	艺术	yìshù	beaux-arts, aesthetical, artistic production, artistic, ars, art, academy, aesthetic, artistic creation, skill, craft, artistry, esthetic
意義	意义	yìyì	importance, significance, denotation, purport, drift, signality, emptiness, meaning, construction, bearing, substance, import, effect, insignificancy, hang, signification, sense
意外	意外	yìwài	accident, mishap
因此	因此	yīncǐ	conj.: therefore, consequently
銀牌	银牌	yínpái	silver medal, CL:枚[mei2]
印象	印象	yìnxiàng	effect, mark, impress, embossment, impressional, image, imprint, engram, sound, intuition, impression
應當	应当	yīngdāng	should
銀	银	yín	silver
迎接	迎接	yíngjiē	greet, receive, welcome, accolade, meet
營養	营养	yíngyǎng	nutrition, nourishment
影視	影视	yǐngshì	movies and television
贏	赢	yíng	lick, beat, whip, gain, capot, win
應用	应用	yìngyòng	application, use
優點	优点	yōudiǎn	strong, merit, vantage, excellency, perfection, assets, beaut, advantage, excellence, upside, strong_point, good point, virtue, desert, desirability, strong point, long_suit, beauty, strong/good point, desirableness
由	由	yóu	from, via, by, through, owing/due to
優勢	优势	yōushì	ascendence, laterality, preponderancy, vantage, ascendancy, ascendent, transcendency, dominance, predominance, draw, gree, upper_hand, prevalence, advantage, mastery, ascendency, supremacy, advantageousness, control, preeminence, dominion, jump, edge, better, deadwood, overweight, superiority, domination, sovereignty, preponderance, ascendance, transcendence, prepotency, hank, asce
郵件	邮件	yóujiàn	mail, postal items, V-mail, mailing, postal matter, post, postbag, posting
郵票	邮票	yóupiào	postage_stamp, album, label, stamp, postage, postage stamp, stickies
由於	由于	yóuyú	conj.: owing/due/thanks to
郵箱	邮箱	yóuxiāng	mailbox, post office box
遊戲	游戏	yóuxì	game, CL:場|场[chang3], to play
游	游	yóu	swim, float, travel, rove
游泳	游泳	yóuyǒng	fin, swim, bathe
有的是	有的是	yǒudeshì	have plenty of, there's no lack of
有利	有利	yǒulì	be advantageous/beneficial
有效	有效	yǒuxiào	run, stand, valid, effective, efficacious, avail, make, hold
預報	预报	yùbào	forecast
預防	预防	yùfáng	prevent, guard against
預計	预计	yùjì	estimate, view, predict, expect, calculate in advance, anticipate
員	员	yuán	m.[general]
員工	员工	yuángōng	employee, personnel, reason, force, staff, cause
願望	愿望	yuànwàng	wish, desire, pleasure, Eros, will, orexis, desirability, dream, wishfulness, mind, mirage, wistfulness, aspiration, ambition, hope
約	约	yuē	about, around
預習	预习	yùxí	to prepare a lesson
樂隊	乐队	yuèduì	orchestra, dance orchestra, dance band, band
運輸	运输	yùnshū	transport
雜誌	杂志	zázhì	journal, bulletin, mag, magazine, periodical
早已	早已	zǎoyǐ	already, since, long ago, long ago/since, long since
造成	造成	zàochéng	make_for, give rise to, create, set_up, strike, creation, cause, contribute, bring_about, procure, give, bring about, cut_out, necessitate, shape, present, bring_forth, generate, yield, make, breed
責任	责任	zérèn	need, care, encumbrance, buck, accountability, blame, obligation, turn, load, responsibleness, incumbrance, responsibility, onus, commission, burden, commitment, loading, trust, pigeon, charge, business, fault, place, liability, duty, guardianship
增加	增加	zēngjiā	increase, raise, add
造	造	zào	arrive at, training, create, go to, build, invent, construct, education, concoction, mint, invention, cook up, educate, establish, fabricate, make, concoct, train
增長	增长	zēngzhǎng	increase, grow
張	张	zhāng	m.[general]
展開	展开	zhǎnkāi	spread out, unfold, open up, launch, develop
者	者	zhě	nominal suffix, one who, -er
真實	真实	zhēnshí	true, real, authentic, factual
爭取	争取	zhēngqǔ	strive for, fight for, wrangle, work hard for, contest, go for, strive/fight for, contend, try_for, woo, try for, strive, win over, scramble, do all one can to
爭	争	zhēng	be short of, disagree, argue, duel, arguement, compete, vie, dispute, contest, fence, be wanting, contend, debate, disputation, strive
照	照	zhào	according to, in accordance with, towards
整	整	zhěng	det.: exact
整理	整理	zhěnglǐ	put in order, arrange
整個	整个	zhěnggè	whole, entire, total
整齊	整齐	zhěngqí	in good order, neat, tidy, even, regular
整天	整天	zhěngtiān	all day long, whole day
整整	整整	zhěngzhěng	fully, full, whole
整體	整体	zhěngtǐ	integrity, allness, entirety, integer, integral, monolith, entireness, ensemble, wholeness, entire, tout ensemble, whole, totality, unity
正式	正式	zhèngshì	formal (of actions/speeches/etc.)
正	正	zhèng	precisely, punctually
證	证	zhèng	certificate, proof, to prove, to demonstrate, to confirm, variant of 症[zheng4]
證據	证据	zhèngjù	support, telltale, testification, witness, case, testimonial, documentation, grounds, evidential, token, proof, earnest, testimony, cogent evidence, attestation, testament, evidence
證件	证件	zhèngjiàn	certificate, papers, credentials, document, ID
支	支	zhī	m.[general]
支持	支持	zhīchí	sustain, hold out, bear;support, back, stand by
支付	支付	zhīfù	pay (money), defray
證明	证明	zhèngmíng	prove, testify, bear out
只	只	zhǐ	only, merely
直播	直播	zhíbō	live broadcast (not recorded), direct Internet broadcasting, (agriculture) direct seeding
直	直	zhí	directly, straight, continuously, just, simply
直到	直到	zhídào	until, up to
值得	值得	zhí de	be worth, merit, pay, rate, behove, worthwhile, worth, worthy, deserve, call_for, command
值	值	zhí	be worth
職工	职工	zhígōng	workers, staff, CL:個|个[ge4]
職業	职业	zhíyè	metier, vocation, iceman, mystery, engagement, work, walk of life, employment, job, occupational group, ploy, craft, trade, avocation, employ, racket, pursuit, profession, situation, line, occupation, position, calling, walk_of_life, career, billet, duty, living, shop
只好	只好	zhǐhǎo	can only, have no choice but, have to, be forced to
只有	只有	zhǐyǒu	can only, have no choice but, to be forced to
只是	只是	zhǐshì	merely, only, just, simply be
指	指	zhǐ	refer to
指導	指导	zhǐdǎo	guide, direct
指出	指出	zhǐchū	point, point_out, catch_out, bespeak, indicate, denote, point out (that), note, show, designate, point out
至少	至少	zhìshǎo	leastwise, leastways, at (the) least, at_least, only, fully, even a little, at least, at any rate, in the least, at least, at the least
至今	至今	zhìjīn	thus_far, up_to_now, until_now, so far, to this day, up to now, to date, hitherto, erenow
志願者	志愿者	zhìyuànzhě	volunteer
