愛心	爱心	àixīn	liking, pity, love, benevolence, mercy, fondness, commitment
安排	安排	ānpái	arrange, plan, fix up, provide (meals/etc.)
安裝	安装	ānzhuāng	install, erect, fix, mount
按照	按照	ànzhào	according to, in the light of, on the basis of
按	按	àn	according to, in accordance with
把握	把握	bǎwò	grasp firmly
把	把	bǎ	indicating pre-verbal object as thing dealt with by the action
白菜	白菜	báicài	Chinese cabbage, pak choi, CL:棵[ke1], 個|个[ge4]
搬	搬	bān	copy mechanically, remove, apply indiscriminately, take away, transfer, move, move (house)
白	白	bái	white, clear, pure, plain, wrongly written/mispronounced,
班級	班级	bānjí	classes and grades in school
搬家	搬家	bān jiā	to move house, removal
辦理	办理	bànlǐ	handle, manage, attend, conduct, enact, transact, transaction
板	板	bǎn	see 老闆|老板, boss, to catch sight of in a doorway (old)
保安	保安	bǎoān	to ensure public security, to ensure safety (for workers engaged in production), public security, security guard
保持	保持	bǎochí	keep, maintain, preserve
保存	保存	bǎocún	preserve, conserve, keep
保	保	bǎo	keep, maintenance, preserve soil moisture, stand guarantor, defend, protection, ensure, stand guarantor for sb., preserve, preservation, warrant, bail, defence, protect, maintain, seek, guarantee
保留	保留	bǎoliú	continue to have, retain, hold back, reserve
保險	保险	bǎoxiǎn	insurance
保證	保证	bǎozhèng	pledge, guarantee
保護	保护	bǎohù	protect, safeguard
報到	报到	bào dào	check in, register, registration, report for duty, appear, report, check_in
背	背	bèi	learn by heart, recite from memory
報道	报道	bàodào	to report (news), report, CL:篇[pian1],份[fen4]
北部	北部	běibù	the north, the northern part of the country, northern part
報	报	bào	newspaper, periodical, bulletin, telegram
報告	报告	bàogào	report, speech, (student) term paper
背後	背后	bèihòu	rear, in the rear, behind, rearward, at the back, backside, back end
本來	本来	běnlái	originally, at first, of course
本領	本领	běnlǐng	skill, ability, capability, CL:項|项[xiang4],個|个[ge4]
被	被	bèi	by
比較	比较	bǐjiào	relatively, fairly
比例	比例	bǐlì	proportional, rate, proportionality, quotient, proportion, proportionment, scale, ratio, balance
比賽	比赛	bǐsài	match, competition
必然	必然	bìrán	surely, inevitably, pardi, certainly
被子	被子	bèizi	quilt, CL:床[chuang2]
變化	变化	biànhuà	change, transformation
本事	本事	běnshi	literary source material, know-how, proficiency, skill, prowess, this matter, ability, capability
變為	变为	biànwéi	change to, become
必要	必要	bìyào	necessary, indispensable
表達	表达	biǎodá	express, convey, voice
標準	标准	biāozhǔn	standard, criterion
標題	标题	biāotí	head, headline, title, superscription, statute title, header, headword, caption, cutline, rubric, heading
表格	表格	biǎogé	tabular array, tabulation, table, form, blank, tabular matter
表面	表面	biǎomiàn	crust, superficial, facing, show, exterior, obverse, rind, face, superficies, top, outside, appearance, facade, surface, bosom, window dressing
表明	表明	biǎomíng	argue, utter, disclose, enunciate, indicate, speak_for, make clear, indication, prove, point, express, manifest, tell, state clearly, give, denote, evince, unfold, portend, declare, kithe, make known, signalize
表演	表演	biǎoyǎn	perform, act, play, demonstrate
表現	表现	biǎoxiàn	manifestation, expression
播出	播出	bō chū	broadcast, disseminate
並且	并且	bìngqiě	conj.: and, besides, moreover
播放	播放	bōfàng	broadcast, transmit
不必	不必	bùbì	need not, not have to
并	并	bìng	to be side by side, simultaneously, and
不論	不论	bùlùn	conj.: no matter how/who/what/etc.
補	补	bǔ	mend, patch, nourish, supplementary
不斷	不断	bùduàn	unceasingly, continuously
補充	补充	bǔchōng	supply, supplement, augment, replenishment, complement, eke, fill again, accompany, add, renew, replenish, implement, stock, recruit, refill
不得不	不得不	bùdébù	cannot but, have to
不安	不安	bùān	be anxious; be uneasy; be restless
不光	不光	bùguāng	not the only one, not only
不僅	不仅	bùjǐn	conj.: not only
布	布	bù	cloth
步	步	bù	m.[activity]
部門	部门	bùmén	category, section, department, service, instrumentality, branch, realm, sector, ministry, province, divisional, classification, departmental, division
部	部	bù	m.[general]
部長	部长	bùzhǎng	commissar, manager, superintendent, cabinet minister, head of a section, minister, political commissar, ministerial, secretary, government minister, president, head of a department
才能	才能	cáinéng	ability, talent
採取	采取	cǎiqǔ	operate, assume, adopt, accept, strike, take, take up, take over, borrow
彩色	彩色	cǎisè	colour, chromatic, multicolour, colorful
採用	采用	cǎiyòng	invoke, admit, assume, adoptive, use, adopt, select for use, embrace, accept, employment, take, introduce, take up, take_on, take over, take on, borrow, employ, adoption
曾經	曾经	céngjīng	in one case, , one time, formerly, syne, at one time, of all time, once, ever
產生	产生	chǎnshēng	come into being, produce, engender, emerge
長處	长处	chángchu	good aspects, strong points
長城	长城	Chángchéng	impregnable bulwark, the Great Wall, Great Wall
厰	厂	chǎng	factory, mill, plant, works, yard, depot
長期	长期	chángqī	long term, long time, long range (of a forecast)
場合	场合	chǎnghé	conjuncture, situation, event, occasion, social occasion, affair
場所	场所	chǎngsuǒ	site, digging, terrain, locality, point, arena, scene, room, locus, location, locale, stead, scene of action, lieu, amenity, meridian, where, spot, space, land site, place, seat
朝	朝	cháo	abbr. for 朝鮮|朝鲜[Chao2 xian3] Korea, imperial or royal court, government, dynasty, reign of a sovereign or emperor, court or assembly held by a sovereign or emperor, to make a pilgrimage to, facing, towards, morning
吵	吵	chǎo	shout for something
襯衫	衬衫	chènshān	shirt, blouse, CL:件[jian4]
超級	超级	chāojí	super
吵架	吵架	chǎo jià	quarrel, have a row/spat
襯衣	衬衣	chènyī	shirt, CL:件[jian4]
稱為	称为	chēngwéi	call as
成功	成功	chénggōng	succeed
成果	成果	chéngguǒ	product, achievement, outcome, gain, production, fruit, positive result, progeny, job
成就	成就	chéngjiù	achievement, accomplishment, success
成熟	成熟	chéngshú	ripe, mature
成立	成立	chénglì	found, establish, be tenable, hold water
成員	成员	chéngyuán	member
成長	成长	chéngzhǎng	grow up, mature
城	城	chéng	wall, city wall, city, kasbah, town, township, burgh, castle, burg
城市	城市	chéngshì	city, town, CL:座[zuo4]
持續	持续	chíxù	perennate, hang on, carry_over, persist, steady, keep, carry over, keep on, proceed, stretch, carry_on, retain, sustain, persevere, continuity, endure, stay, continue, hang in, hold, maintain, run, span, go on, run for, last, go along, exist, hold on
程度	程度	chéngdù	latitude, rate, degree, point, measure, way, grade, gree, pitch, cut, length, plane, stage, level, extent, scale, notch
初	初	chū	at the beginning of, in the early part of
充滿	充满	chōngmǎn	swarm, be brimming, inhabit, be brimming with, teem, crawl, fill, lard, pullulate with, brim, be permeated with, bathe, be filled with, permeated with, abound in, implement, exuberate, fill up, flow, abound, burst, perfuse, foam, bristle, crackle, inform, pervade, be imbued with, simmer, glut, teem in, permeate, congest, be full of, reek, charge, suffuse, pullulate, overfill, swell
初步	初步	chūbù	initially, preliminarily, tentatively
初級	初级	chūjí	junior, primary
重	重	zhòng	heavy, weighty, important, considerable in amount/value
初中	初中	chūzhōng	junior high school, abbr. for 初級中學|初级中学[chu1 ji2 zhong1 xue2]
除了	除了	chúle	except, besides
處理	处理	chǔlǐ	handle, deal with, dispose of, process
傳	传	chuán	pass (on), hand down, impart, teach, spread, transmit
傳播	传播	chuánbō	disseminate, propagate, spread
傳說	传说	chuánshuō	legend
創新	创新	chuàngxīn	bring forth new ideas, blaze new trails
創造	创造	chuàngzào	create, produce, bring about
傳來	传来	chuánlái	spread, arise, salute, deliver something to here
創作	创作	chuàngzuò	creative work, creation
創業	创业	chuàngyè	start undertaking, do pioneering work
從前	从前	cóngqián	previously, formerly, once upon a time
從來	从来	cónglái	all along, at all times, always
從事	从事	cóngshì	engross, have, join, treat, plow, handle, follow, embark, undertake, attend_to, attack, occupy, absorb, go_into, work, engage, prosecute, go_about, go in for, pursue, be, meddle, embark_on, perform, enter, cover, deal, address, be engaged in, deal with, place, wage
存	存	cún	harbour, keep, deposit (money), gather, harbor, cherish, accumulate, existence, live, leave with, retain, reserve, save, consist, accumulation, preserve, survival, store, survive, check (luggage), collect, deposit, place, bank, check, exist, be in stock, remain on balance
村	村	cūn	village, variant of 村[cun1]
存在	存在	cúnzài	exist, be
錯誤	错误	cuòwù	error, blunder
達到	达到	dá dào	extend to, find, fulfil, compass, encompass, extend, gain, answer, achievement, succeed, fulfill, live_up_to, attainment, strain, bring_up, achieve, get to, touch, strive, make, accomplish, progress to, come, hit, come_out, obtain, reach, attain, clock_up, suffice, do, get, arrive_at
打破	打破	dǎpo	shiver, better, explode, smash, crush, fall apart, discomfit, part, shatter, force, murder, wear, break, bust, drub, wear out
大概	大概	dàgài	chiefly, if not, perchance, approximately, believably, maybe, presumably, plausibly, almost, conceivably, most likely, assumedly, ablings, likely, perhaps, probably, supposedly, ablins, credibly, assumably, belike
打聽	打听	dǎting	to ask about, to make some inquiries, to ask around
大使館	大使馆	dàshǐguǎn	embassy, CL:座[zuo4],個|个[ge4]
大約	大约	dàyuē	about, around, probably, likely
代	代	dài	period, generation
代表	代表	dàibiǎo	representative, delegate
大夫	大夫	dàfū	a senior official in feudal China, physician, senior official, doctor
代表團	代表团	dàibiǎotuán	contingent, delegacy, mission, deputation, delegation
帶動	带动	dài dòng	drive, spur on, bring along
單元	单元	dānyuán	module, unit, unit of teaching materials, residential unit
當初	当初	dāngchū	at that time, originally
帶領	带领	dàilǐng	lead (army/party/etc.), guide
當然	当然	dāngrán	certainly, of course
當地	当地	dāngdì	locality, the place (named/mentioned/etc.)
當中	当中	dāngzhōng	in the middle/center
刀	刀	dāo	knife, sword, blade, sth. shaped like a knife
導演	导演	dǎoyǎn	director
到達	到达	dàodá	find, arrive at, go_into, get_in, go, come, show, hit, strike, arrive, fetch_up, range, show_up, gain, come_to, win, reach, come to, attain, lead, go_down, come_in, arrival, get_at, get to, get, touch, make, come_through, arrive_at, land
得分	得分	dé fēn	score
到底	到底	dàodǐ	to the end, at last, after all
等待	等待	děngdài	wait for, await
底下	底下	dǐxia	under, below, beneath
地區	地区	dìqū	section, country, area, latitude, zone, terrain, parts, locality, sector, province, prefecture, region, district, faubourg
電視臺	电视台	diànshìtái	television station, station, spreader, broadcaster, TV station
電臺	电台	diàntái	transceiver, transmitter-receiver, broadcasting station
電子郵件	电子邮件	diànzǐyóujiàn	email, CL:封[feng1],份[fen4]
調	调	diào	to transfer, to move (troops or cadres), to investigate, to enquire into, accent, view, argument, key (in music), mode (music), tune, tone, melody, to harmonize, to reconcile, to blend, to suit well, to adjust, to regulate, to season (food), to provoke, to incite
電視劇	电视剧	diànshìjù	TV play, soap opera, CL:部[bu4]
調查	调查	diàochá	investigate, look into, survey
訂	订	dìng	subscribe to, agree on, revise, draw up, staple together, book (seats), conclude, order, book, subscribe, make corrections
定期	定期	dìngqī	fixed (of time), periodically, regularly
東部	东部	dōngbù	orient, East, eastward, east
動人	动人	dòngrén	moving, fetch, emotional, attractive, touching
讀者	读者	dúzhě	audience, subscriber, reader
動力	动力	dònglì	driving force, impetus, motivity, (motive) power, wheel, (motive) power/force, agency, vector, dynamics, force, motive_power, momentum, power
短褲	短裤	duǎnkù	short pants, shorts
短處	短处	duǎnchu	shortcoming, defect, fault, one's weak points
斷	断	duàn	give up, cut off, break off, stop, abstain from, judge, snap, break, decide
短期	短期	duǎnqī	short term, short-term
隊員	队员	duìyuán	team member
對待	对待	duìdài	treat, approach, handle
對方	对方	duìfāng	other party, the other party, fellow, party, other side, adversary, other side/party
對象	对象	duìxiàng	boy/girl friend, mate, fair game, boy friend, prey, boy, object, quarry, target, girl friend, catch, match
對手	对手	duìshǒu	mate, competitor, opposite, antagonist, comparative, contender, adversary, opponent, opposition, counterpart, equal, counterworker, rival, match
發表	发表	fābiǎo	voice, enounce, enunciate, publish, free, sound, announce, pronounce, deliver, circulation, put_out, release, issue, vend, circularize, give, give_out, denote, present, circulate, publicize, blazon, promulgate, mouth
頓	顿	dùn	m.[event]
發出	发出	fā chū	voice, send_out, give_forth, send out, exhale, sound, fetch, pass off, shoot, effuse, issue, emanate, raise, give, shed, send/give out, utter, go, escape, proceed, send, give forth, give_off, give off, fall, eradiate, emit, flash, scintillate, issue_forth, give_out, give out, clank, reek, place, breathe
發達	发达	fādá	developed, flourishing
發動	发动	fādòng	start, launch, mobilize, arouse
發明	发明	fāmíng	invention
發生	发生	fāshēng	happen, occur, take place
發送	发送	fāsong	to transmit, to dispatch, to issue (an official document or credential)
發言	发言	fāyán	speak, make statement/speech
發展	发展	fāzhǎn	develop, expand, grow
反復	反复	fǎnfù	repeatedly, backward_and_forward
反應	反应	fǎnyìng	reaction, response, repercussion
反正	反正	fǎnzheng	anyway, anyhow, in any case
範圍	范围	fànwéi	demesne, latitude, shot, compass, extensity, panorama, parameter, boundary, arena, stretch, territory, radius, spectrum, scope, extension, sphere, orbit, circumscription, limits, purview, grasp, extent, region, space, limit, hemisphere, horizon, envelope, bounds, realm, terrain, tether, sphere of influence, range, circuit, domain, precinct, reach, area, length, spread, bailiwick, ambit, con
反對	反对	fǎnduì	to fight against, to oppose, to be opposed to, opposition
防	防	fáng	guard against, guard, prevent, prepare against, defence, resistance, guard/prepare against, resist, defend, provide against
防止	防止	fángzhǐ	estop, guard against, preclude, prevention, inhibit, avoidance, help, cumber, prevent, forbid, prohibit, obviate, restrain, deter, avoid, head_off, debar, guard, help oneself, ward_off, constrain, ward, encumber, avert, ward off, disenable, forfend, shield, countercheck, forestall, keep_from, foreclose
方式	方式	fāngshì	path, plan, pattern, tenor, system, method, manner, style, way, guise, fashion, wise, means, shape, how, embodiment, agency, gate, mode, sort
房東	房东	fángdōng	landlord
訪問	访问	fǎngwèn	visit, call on, interview
放到	放到	fàng dào	Put in
房屋	房屋	fángwū	casa, premises, buildings, digging, houses, housing, tenement, house
費	费	fèi	cost, spend, expend
飛行	飞行	fēixíng	fly
房租	房租	fángzū	rent for a room or house
費用	费用	fèiyong	tax, cost, expense, expenditure, due, rate, exes, outlay, outgo, fee, terms, toll, price, disbursement, fare, expenses, disbursal, retainer, pay, damage, charge, monetary value, consideration, outgoing
分別	分别	fēnbié	separately, respectively
分組	分组	fēn zǔ	divide into groups
分配	分配	fēnpèi	distribute, allot, assign
豐富	丰富	fēngfù	rich, abundant, plentiful
風險	风险	fēngxiǎn	peril, danger, risk, hazard
否定	否定	fǒudìng	negate, deny
服裝	服装	fúzhuāng	turnout, wearing_apparel, clothing, investiture, rigging, costuming, toggery, habilimentation, habiliment, drapery, garb, attire, toilette, frock, costume, dress, investment, garmenture, rig, garment, setout, implement, garniture, getup, outfit
父母	父母	fùmǔ	parental, parents, father and mother, folks
否認	否认	fǒurèn	deny, disavow, repudiation, naysay, denial, gainsay, reject, veto, negate, disclaim, disown, challenge, dispute, renounce, disaffirm, negative, contradict, contravene, repudiate
福	福	fú	felicity, happiness, blessing, good fortune
父親	父亲	fùqin	parent, father, pere, Pa, begetter, governor, abba, male parent, pater, guv
負責	负责	fùzé	preside, be responsible for, see, entail, sponsor, be in charge of, blame, answer, undertake, liable, respond
複印	复印	fùyìn	to photocopy, to duplicate a document
付	付	fù	hand/turn over to, commit to, pay
複雜	复杂	fùzá	complicated, complex
改造	改造	gǎizào	recast, rebuild, re-form, reconstruct, remake, transformation, remould, transmake, reform, transform, remodel, reorganize, retread, remold, remodify, reshape, remoulding, redo, alter, recreate, transmute, make over, refashion, revamp
富	富	fù	be rich in, be full of
改進	改进	gǎijìn	improve
概念	概念	gàiniàn	estimate, conception, view, intention, image, estimation, idea, notion, concept, construct, paradox, approximation, impression
趕	赶	gǎn	run after, pursue
趕到	赶到	gǎndào	leave for, hurry to
趕快	赶快	gǎnkuài	quickly, hastily
趕緊	赶紧	gǎnjǐn	hasten, double-quick, losing no time, hurriedly
敢	敢	gǎn	dare, make bold, have courage to, be sure, have confidence to, venture, have the confidence to, be certain
感冒	感冒	gǎnmào	catch cold
感受	感受	gǎnshòu	perception, sentiment, mood
幹嗎	干吗	gànmá	see 幹嘛|干嘛[gan4 ma2]
感情	感情	gǎnqíng	warmheartedness, reticence, sensation, affection, susceptibility, feeling, feelings, heart, affective, withers, expression, tenderness, emotion, sentiment, fondness, soul, affectionateness, soulfulness, passion
高速	高速	gāosù	great speed, velocity, high speed, high
高速公路	高速公路	gāosùgōnglù	expressway, highway, freeway
告別	告别	gàobié	valedictory, take_leave, part from, leave, parting, say good-bye to, bid farewell to
歌聲	歌声	gēshēng	voice, song, singing, sound of singing, singing voice
歌迷	歌迷	gēmí	lover of song, fan of a singer
歌手	歌手	gēshǒu	warbler, voice, vocalist, singer, bulbul, performer, lark, songster
各	各	gè	det.: each, every
個性	个性	gèxìng	kidney, specific property, personalism, fibre, individuation, personhood, particularity, fiber, character, individual character, self-identity, mentality, idiosyncrasy, spirit, individuality, individualism, selfhood, personality
個人	个人	gèrén	individual person, man_jack, personal, individual (person), man jack, individual, individuality, identity
各位	各位	gèwèi	everybody, all (guests, colleagues etc), all of you
各地	各地	gèdì	in all parts of (a country), various regions
各種	各种	gèzhǒng	every kind of, all kinds of, various kinds
根本	根本	gēnběn	at all, utterly
各自	各自	gèzì	each, respective, severalty, oneself
更加	更加	gèngjiā	(even) more
工程師	工程师	gōngchéngshī	technologist, engineer, applied scientist
工夫	工夫	gōngfu	workmanship, skill, art
工具	工具	gōngjù	stock-in-trade, instrumentality, instrument, ministry, hand_tool, escalator, creature, utensil, material, gear, pawn, lobster-joint, cat's-paw, kit, apparatus, tool, appurtenances, paraphernalia, means, wood, tackle, implement, medium, lever, outfit
工業	工业	gōngyè	industrial, industry
工廠	工厂	gōngchǎng	layout, mill, factory, remuneration, workshop, industrial plant, plant, hacienda, manufactory, works, shop
工資	工资	gōngzī	earning, hire, remuneration, screw, laborage, pay, paycheck, wages, earnings, pay_packet, salary, wage_scale, differential, wage
公布	公布	gōngbù	promulgate, announce, publish
公共	公共	gōnggòng	common, commonly, publicly, public, communal
公開	公开	gōngkāi	bare, air, unclose, publish, come_out, make known to the public, publicize, divulgate, overt, publicise, public, disclosure, make known to public, unfurl, make public
公務員	公务员	gōngwùyuán	jobholder, servant, public_servant, official, government official worker, functionary, government employee, public servant, officeholder, officialdom, officer, orderly, civil servant, government officials
功課	功课	gōngkè	task, schoolwork, homework, preparation, prep, subject, lesson
公民	公民	gōngmín	freeman, citizen, denizen, national, civic, freewoman, commonwealth, burgher, civics
功能	功能	gōngnéng	functional, niche, function, competence, capacity, anatomy
共同	共同	gòngtóng	common, joint
功夫	功夫	gōngfu	workmanship, skill, art
姑娘	姑娘	gūniang	quiff, cummer, gill, calico, girlie, missy, moll, damsel, fille, girl, jill, miss, judy, jeune fille, sheila, jane, lass, colleen, toots, daughter, young girl, lassie
共有	共有	gòngyǒu	to have altogether, in all
古	古	gǔ	ancient, age-old;not following current customs/practice
古代	古代	gǔdài	ancient times, olden times
故鄉	故乡	gùxiāng	country, home, patria, place of birth, native place, hometown, homeland, motherland, birthplace
關係	关系	guānxi	relation, bearing, impact, membership credentials, backdoor connections
關注	关注	guānzhù	follow with interest, pay close attention to
觀察	观察	guānchá	observe, survey, inspect
掛	挂	guà	hang, put up, hitch, ring up
觀看	观看	guānkàn	eye, view, watch, spectate, eyeball
觀念	观念	guānniàn	conception, intension, theory, philosophy, idolum, connotation, idea, sense, presentation, notion, concept, construct, intellection, presentment, thought, notional, conceit
管理	管理	guǎnlǐ	manage, supervise, take care of
觀眾	观众	guānzhòng	onlooker, TV audience, attendance, audience, spectator, viewers, followers, crowd, gallery, viewer, following, house, viewing audience
光明	光明	guāngmíng	bright, promising, openhearted, guileless
廣播	广播	guǎngbō	broadcast, air
管	管	guǎn	run, manage, administer, have charge of, subject to discipline, bother about
光	光	guāng	light, ray, brightness, honor, glory, luster
規定	规定	guīdìng	rules, disciplines, regulations
廣大	广大	guǎngdà	large, wide, vast, ample, large-scale, numerous, wide-spread
國內	国内	guónèi	interior (of country), interior, home, intestine, internal, domestic
規範	规范	guīfàn	constraint, norm
國慶	国庆	Guóqìng	National Day
果然	果然	guǒrán	really, as expected, sure enough
果汁	果汁	guǒzhī	fruit juice
過程	过程	guòchéng	unconscious process, mechanism, process, act, round, course
哈哈	哈哈	hāha	sound of laughter, haha
過去	过去	guò qu	go over, pass by
海關	海关	hǎiguān	chophouse, customhouse, customshouse, custom, haikwan, customs, douane
害怕	害怕	hàipà	dread, be afraid/scared, fearful, frighten, fear, frightened, shrink_from, be afraid, funk, scared, be scared, tremble
好好	好好	hǎohǎo	well, carefully, nicely, properly
行	行	xíng	go, travel, prevail, circulate, be current
好奇	好奇	hàoqí	curious, full of curiosity
合	合	hé	be equal to, amount to
合法	合法	héfǎ	legal, well-formed, rightful, lawful, legitimate
合格	合格	hégé	measure_up, reach standard, measure up, qualify, nail, make it, pass, qualified
合理	合理	hélǐ	plausible, rational, reasonable, legitimate, equitable, sensible
和平	和平	hépíng	mild, peaceful
紅茶	红茶	hóngchá	tea, bohea, black_tea, black tea
紅酒	红酒	hóngjiǔ	Red wine
後果	后果	hòuguǒ	aftereffect, aftermath, consequent, wake, backwash, sequel, consequence, subsequence
後面	后面	hòumian	rear, back, in the rear, latter, behind, rearward, at the back
後年	后年	hòunián	the year after next
互聯網	互联网	hùliánwǎng	Internet
合作	合作	hézuò	cooperate, collaborate, work together
划船	划船	huá chuán	paddle/row boat
互相	互相	hùxiāng	mutual, each other, mutually, one another, reciprocally
華人	华人	huárén	Chinese, Ch. people
化	化	huà	melt, dissolve, thaw, digest, remove, burn up, incinerate, disguise
話劇	话剧	huàjù	stage play, modern drama, CL:臺|台[tai2],部[bu4]
歡樂	欢乐	huānlè	happy, joyous, gay
環	环	huán	ring, link
話題	话题	huàtí	talking_point, theme, gambit, subject of a talk, ground, talk, talking point, topic, chapter, topic of conversation
環保	环保	huánbǎo	environmental protection
環境	环境	huánjìng	circumambiency, environmental, circumstances, environment, entourage, surround, atmosphere, setting, surroundings, ambiance, condition, context, circumstance, surrounding, frame, milieu, ambient, consideration, environs, medium, ambience
會議	会议	huìyì	synod, moot, conference, board, convocation, soviet, congress, talks, indaba, negotiation, junta, group discussion, convention, meeting place, session, council, rendezvous, colloquy, coming together, powwow, seance, meeting, forum, consultation, roll-up, get-together, assembly
會員	会员	huìyuán	member
