曬	晒	shài	air, cold-shoulder, soak up sun, sun-dry, shine on, sun upturned soil
傷害	伤害	shānghài	harm
善於	善于	shànyú	excel, surpass, stand out, be adept in, be good at
善良	善良	shànliáng	good and kind, decent
商務	商务	shāngwù	commercial affairs, commercial, commerce, business
上個月	上个月	shànggèyuè	last month
賞	赏	shǎng	admire, enjoy
上門	上门	shàng mén	to drop in, to visit, to lock a door, (of a shop) to close, to go and live with one's wife's family, in effect becoming a member of her family
上樓	上楼	shànglóu	to go upstairs
燒	烧	shāo	oven broil, roast, burn, broil, run a fever, baking, stew ... in soy sauce, cook, heat, bake, burning, burnt, stew, grill, cooking, have a temperature
設置	设置	shèzhì	set/put up, install
申請	申请	shēnqǐng	apply for
身材	身材	shēncái	stature, figure
設施	设施	shèshī	installation, facilities
深厚	深厚	shēnhòu	deep, profound, solid, deep-seated
身份	身份	shēnfen	state, dignity, station, estate, body, estate of the realm, capacity, status, standing, caste, doctorate, place, identity, condition
身高	身高	shēngāo	height, stature, height (of person)
神祕	神秘	shénmì	mysterious, mystical
失敗	失败	shībài	be defeated, fail, lose
甚至	甚至	shènzhì	even (to the point of), so much so that
神話	神话	shénhuà	fairy story, fairy tale, mythos, mythic, fable, fairytale, myth, mythology
失業	失业	shī yè	lose one's job; be out of work
詩	诗	shī	verse form, poem, canto, verse, rhyme, number, song, poesy, poetry
詩人	诗人	shīrén	muse, rhymist, swan, lark, Parnassus, Maker, minstrel, harmonist, metrist, maker, bulbul, songster, versifier, poet, singer, eisteddfod, bard
失望	失望	shīwàng	become disappointed, lose (hope/faith)
實用	实用	shíyòng	practical, pragmatic, functional
濕	湿	shī	humidify, moisten, humid, damp, dampen, wet
食堂	食堂	shítáng	mess_hall, eatery, hall, buttery, commissariat, (institutional) dining room, mess hall, mess, refectory, dining room, canteen
實施	实施	shíshī	put into effect, implement
使勁	使劲	shǐ jìn	to exert all one's strength
士兵	士兵	shìbīng	rank-and-file soldiers
市區	市区	shìqū	urban area, city proper, row, urban district, downtown, urban_area
似的	似的	shìde	seems as if, rather like, Taiwan pr. [si4 de5]
事物	事物	shìwù	proposition, pigeon, object, thing, affair, un
事先	事先	shìxiān	ahead, beforehand, in advance, in_advance, aforetime, aforehand
是否	是否	shìfǒu	whether or not, is it so or not
試卷	试卷	shìjuàn	examination paper, test paper, CL:份[fen4],張|张[zhang1]
收回	收回	shōu huí	take back, call in, recall, withdraw, countermand
收益	收益	shōuyì	earnings, profit
收穫	收获	shōuhuò	harvest, gains, results
手裡	手里	shǒuli	in hand, (a situation is) in sb's hands
守	守	shǒu	guard, defend, keep watch
手術	手术	shǒushù	operation
手工	手工	shǒugōng	handwork
受不了	受不了	shòubuliǎo	unbearable, unable to endure, can't stand
手套	手套	shǒutào	glove, mitten, CL:雙|双[shuang1],隻|只[zhi1]
首	首	shǒu	m.[general]
售貨員	售货员	shòuhuòyuán	salesperson, CL:個|个[ge4]
舒適	舒适	shūshì	comfortable, cozy
叔叔	叔叔	shūshu	father's younger brother, uncle, uncle (child's address for young males)
熟練	熟练	shúliàn	practiced, proficient, skilled, skillful
暑假	暑假	shǔjià	summer vacation, CL:個|个[ge4]
樹林	树林	shùlín	forest, motte, woods, wood, planting, grove, timberland, woodland, hurst, timber
數據	数据	shùjù	data
樹葉	树叶	shùyè	leaves, foliage, leafage, leaf, leave, leaves (of trees)
數碼	数码	shùmǎ	number, numerals, figures, digital, amount, numerical code
刷	刷	shuā	to brush, to paint, to daub, to paste up, to skip class (of students), to fire from a job, to select
刷牙	刷牙	shuā yá	to brush one's teeth
刷子	刷子	shuāzi	brush, scrub, CL:把[ba3]
帥	帅	shuài	surname Shuai, handsome, graceful, smart, commander in chief, (coll.) cool!, sweet!
帥哥	帅哥	shuàigē	handsome guy, lady-killer, handsome (form of address)
睡著	睡着	shuìzháo	asleep, fall_asleep, go_off, nod off, drift off, doze off, fall asleep, dope off, flake, drowse off, conk, dormant, flake out, drop off
率先	率先	shuàixiān	take lead/initiative
說不定	说不定	shuōbudìng	perhaps, maybe
說服	说服	shuō fú	persuade, talk sb. over
似乎	似乎	sìhū	it seems, quasi, apparently, seemingly, as if
順序	顺序	shùnxù	system, method, taxis, gradation, consecution, succession, order, ranking, rota, sequence, orderliness, turn
松樹	松树	sōngshù	pine, pine tree, CL:棵[ke1]
思考	思考	sīkǎo	ponder over, reflect on
松	松	sōng	crisp, loose, light and flaky, slack, loosen, relax, unbend, soft, not hard up
塑料袋	塑料袋	sùliàodài	plastic bag
酸	酸	suān	sick at heart, grieved, distressed, aching, tingling
塑料	塑料	sùliào	plastics, CL:種|种[zhong3]
酸奶	酸奶	suānnǎi	yogurt
隨手	随手	suíshǒu	conveniently, without extra trouble, while doing it, in passing
孫子	孙子	sūnzi	son's son, grandson
孫女	孙女	sūnnü	son's daughter, granddaughter
縮短	缩短	suō duǎn	shorten, curtail, cut down
臺階	台阶	táijiē	steps, flight of steps, step (over obstacle), fig. way out of an embarrassing situation, bench (geology)
縮小	缩小	suō xiǎo	recede, dwindle away, narrow, foreshorten, shrinkage, narrow down, abridge, minify, reduction, puncture, compress, specialize, scale down, dwindle, deflate, minish, take in, reduce, lessen, shorten, diminish, dwindle down, shrink, subside, deescalate, retract
臺上	台上	táishàng	on stage
套餐	套餐	tàocān	set meal, product or service package (e.g. for a cell phone subscription)
躺	躺	tǎng	couch, lie, lean back, recline
特殊	特殊	tèshū	exceptional, special, particular; peculiar, distinctive
特徵	特征	tèzhēng	impress, trait, hallmark, cachet, stamp, characteristic, speciality, cast, feature, characteristic marks, features, artistic style, touch, trademark, earmark, particularity, nature, genius, imprint, lineament, mold, shtick, distinction, specificity, physiognomy, idiom, signature, character, salience, diagnosis, syndrome, stigma, stylemark, signalment
提醒	提醒	tí xǐng	remind, warn, alert to
特價	特价	tèjià	special price
提供	提供	tígōng	feed, offer, put_up, afford, proffer, set_up, capitalize, bring_forward, sponsor, extend, ply, provision, sustain, equip, supply, cough_up, bear, render, furnish, cater, billet, provide
體重	体重	tǐzhòng	body weight, beef, (body) weight, avoirdupois, weight
體操	体操	tǐcāo	jerk, physical exertion, workout, exercise, physical_exercise, gymnastic, calisthenics, exercising, gymnastics, physical exercise, gym
體檢	体检	tǐjiǎn	abbr. for 體格檢查|体格检查[ti3 ge2 jian3 cha2]
替代	替代	tìdài	replace, supervene upon, replacement, supersede, substitute for, alternate, substitute, supersession, displace, supplant
替	替	tì	for, on behalf of
天真	天真	tiānzhēn	naive, innocent
填空	填空	tián kòng	to fill a job vacancy, to fill in a blank (e.g. on questionnaire or exam paper)
填	填	tián	writing, fill in, stuff, write, fill, close, charge, fill up
挑	挑	tiāo	pluck, provoking, stir up, choose, incite, instigation, lance, shoulder, push sth. up, selection, carry on both ends of shoulder pole, push ... up with a pole or stick, choice, defy, prick, raise, instigate, poke, provocation, plunk, select, carry on the shoulder with a pole, push/poke sth. up, poke sth. up, pick, push, provoke
挑選	挑选	tiāoxuǎn	choose, select
調皮	调皮	tiáopí	naughty, mischievous, unruly
貼	贴	tiē	paste, glue, stick to
挑戰	挑战	tiǎo zhàn	a challenge to battle/contest
停下	停下	tíngxià	to stop
挺	挺	tǐng	very, rather, quite
通知書	通知书	tōngzhīshū	Notice
童話	童话	tónghuà	fairy story, fairy tale, fairy-tale, children's stories, fairytale, fairy tales
同情	同情	tóngqíng	sympathize with
統計	统计	tǒngjì	statistics
童年	童年	tóngnián	childhood
統一	统一	tǒngyī	unify, unite, integrate
投	投	tóu	heave, agree with, throw, drop, mail, join, toss, go to, cater to, lodge, send, put into, fit in with, flip, peck, pitch, hurtle, betoss, project, deliver, stay, sky, post, cast, delivery, throw into, throw oneself into, hurl, fling, poll, vote
痛快	痛快	tòngkuai	delighted, to one's heart's content, straightforward, also pr. [tong4 kuai5]
投訴	投诉	tóusù	complaint, to complain, to register a complaint (esp. as a customer)
投入	投入	tóurù	throw/put into
透	透	tòu	to penetrate, to pass through, thoroughly, completely, transparent, to appear, to show
投資	投资	tóuzī	investment
途中	途中	túzhōng	en route
圖案	图案	túàn	miniature, device, pattern, illumination, emblem, embossment, design, imprint, cutout, designing, type
推遲	推迟	tuīchí	to postpone, to put off, to defer
土地	土地	tǔdi	country, acre, terra, soil, premise, realm, territory, dirt, local god of the land, farming, earth, ground, kingdom, holding, agrarian, solid ground, benefice, esplees, tract, village god, glebe, terra firma, land, dry land
透明	透明	tòumíng	diaphanous, see-through, crystalline, transparent
推銷	推销	tuīxiāo	promote sale of, peddle
襪子	袜子	wàzi	socks, stockings, CL:隻|只[zhi1],對|对[dui4],雙|双[shuang1]
脫	脱	tuō	cast/come off, shed, take off, escape from
外匯	外汇	wàihuì	foreign exchange
外交官	外交官	wàijiāoguān	diplomat
外套	外套	wàitào	stragulum, overclothes, outerwear, pall, surcoat, overcoat, loose coat, greatcoat, manta, outer garment, topcoat, coat, bolero, lagging, benny
晚點	晚点	wǎn diǎn	(of trains etc) late, delayed, behind schedule, light dinner
彎	弯	wān	to bend, bent, a bend, a turn (in the road etc), CL:道[dao4]
萬一	万一	wànyī	conj.: just in case, if by any chance
王	王	wáng	Rex, ameer, king, prince, emeer, monarch, shah, emir, amir, Surname, sovereign, Wang
網絡	网络	wǎngluò	Internet, network (computing, telecommunications, transport etc)
微笑	微笑	wēixiào	smile
網址	网址	wǎngzhǐ	website, web address, URL
圍巾	围巾	wéijīn	scarf, shawl, CL:條|条[tiao2]
微信	微信	Wēixìn	Weixin or WeChat (mobile text and voice messaging service developed by Tencent 騰訊|腾讯[Teng2 xun4])
維持	维持	wéichí	keep, preserve
維護	维护	wéihù	safeguard, defend, uphold
維修	维修	wéixiū	keep in (good) repair, maintain
尾巴	尾巴	wěiba	appendage, a person shadowing sb., stern, tail-like part, servile adherent, tail
未必	未必	wèibì	may_not, not necessarily, may not
未來	未来	wèilái	future, tomorrow, CL:個|个[ge4], approaching, coming, pending
位於	位于	wèiyú	be situated, situated, locate, precede, lie, come, nestle, subsist, underlie, sit, be located, skirt, rank
位置	位置	wèizhi	positioning, site, stand, stance, about-face, lie, locality, spatial relation, setting, situs, locus, slot, ubiety, station, location, emplacement, ubication, situation, niche, positional, position, place, seat
喂	喂	wèi	hello, hey
味兒	味儿	wèir5	taste
穩	稳	wěn	firm, stable, steady, staid, sedate, sure, certain
穩定	稳定	wěndìng	stable, steady
無	无	wú	not have, there is not
無法	无法	wúfǎ	nohow, unable to, unable, cannot
無聊	无聊	wúliáo	bored, boring, senseless, silly, stupid
無論	无论	wúlùn	conj.: no matter what/how/etc., regardless
問候	问候	wènhòu	to give one's respects, to send a greeting
無所謂	无所谓	wúsuǒwèi	not deserve the name of, be indifferent, cannot be designated as, not matter, can't be considered as
無數	无数	wúshù	countlessness, thousand, limitlessness, infinitude, boundlessness, trillions, millions, myriad, innumerableness, unboundedness, billions, zillions, jillions, host, countless, legion, det.: innumerable, incalculability, million, infiniteness, innumerability, immensity, umpteen
無限	无限	wúxiàn	infinite, limitless
五顏六色	五颜六色	wǔyán-liùsè	multi-colored, every color under the sun
西瓜	西瓜	xīgua	water melon, watermelon
誤會	误会	wùhuì	misunderstanding
吸	吸	xī	drop, absorption, absorb, draw to oneself, sip, breathe in, attraction, suck, suck up, sup, draw_in, puff, drink, inhale, attract, inhaust
吸管	吸管	xīguǎn	(drinking) straw, pipette, eyedropper, snorkel, CL:支[zhi1]
吸收	吸收	xīshōu	absorb, suck up, assimilate, recruit
吸煙	吸烟	xī yān	to smoke
吸引	吸引	xīyǐn	engross, arrest, appeal, fascinate, attraction, fetch, draw, transfix, pull in, entrance, pull, enamour, spellbind, enamor, capture, trance, captivate, call, grip, fascination, absorb, bewitch, tempt, becharm, speak_to, fix, engage, catch, rivet, enchant, beguile, charm, seduce, take, enwrap, magnetize, draw in, attract
喜愛	喜爱	xǐài	like, love, be fond of
系統	系统	xìtǒng	lineage, filiation, scheme, pedigree, system, formation, superstructure, programme, organization, succession, tract, system of rules, organisation, program
系列	系列	xìliè	succession, set, spectrum, course, train, series
細	细	xì	fine, exquisite, minute, in small particles, meticulous, thin and soft, thin, careful, light, trifling, slender, delicate, detailed
細節	细节	xìjié	circumstance, minutiae, nicety, minutia, speciality, item, detail, particulars, punctilio, particular, point, specific, respect, regard, details
細緻	细致	xìzhì	careful, meticulous, painstaking
下降	下降	xiàjiàng	descend, go/come down, drop, fall, decline
下個月	下个月	xiàgèyuè	next month
下樓	下楼	xiàlóu	Go downstairs
夏季	夏季	xiàjì	summer
下載	下载	xiàzài	to download, also pr. [xia4 zai4]
鮮	鲜	xiān	fish, old variant of 鮮|鲜[xian3], fish, old variant of 鮮|鲜[xian1]
鮮花	鲜花	xiānhuā	flower, fresh flowers, CL:朵[duo3]
鮮明	鲜明	xiānmíng	bright (of color), distinct, distinctive
鹹	咸	xián	surname Xian, salted, salty, stingy, miserly
顯著	显著	xiǎnzhù	outstand, striking, noticeable, remarkable, appear, marked, notable, outstanding, stand_out
縣	县	xiàn	county
限制	限制	xiànzhì	restrictiveness
相處	相处	xiāngchǔ	get along (with one another)
相反	相反	xiāngfǎn	offending, adverse, opposite, converse, opposite, contrary, oppose, reverse
箱	箱	xiāng	m.[container]
箱子	箱子	xiāngzi	suitcase, chest, box, case, trunk, CL:隻|只[zhi1],個|个[ge4]
想念	想念	xiǎngniàn	imagine, long to see again, remember with longing, think_of, miss, yearn
想象	想象	xiǎngxiàng	to imagine, to fancy, CL:個|个[ge4]
項目	项目	xiàngmù	event, head, item, particular, article, point, specific, entry, listing, clause, project
項	项	xiàng	m.[general]
相片	相片	xiàngpiàn	exposure, print, semblance, likeness, photo, photograph, photographic print
銷售	销售	xiāoshòu	sell, market
消化	消化	xiāohuà	digest
小吃	小吃	xiǎochī	snack, refreshments, CL:家[jia1]
小伙子	小伙子	xiǎohuǒzi	young man, young guy, lad, youngster, CL:個|个[ge4]
小型	小型	xiǎoxíng	spyglass, miniature, small-sized, bar, small-scale, pettiness
效率	效率	xiàolǜ	sufficiency, effectualness, effectuality, productiveness, usefulness, efficiency, effectivity, effectiveness
些	些	xiē	m.[proximation]
心理	心理	xīnlǐ	mental_state, psychology, mentality
新郎	新郎	xīnláng	groom, bridegroom
新娘	新娘	xīnniáng	bride
新鮮	新鲜	xīnxian	freshen, novel, fresh, new, strange
新型	新型	xīnxíng	pattern, novelty, of new type
興奮	兴奋	xīngfèn	excited
形容	形容	xíngróng	characterize, description, describe
形勢	形势	xíngshì	circumstances, situation, terrain, CL:個|个[ge4]
型	型	xíng	mold, type, style, model
型號	型号	xínghào	model number
醒	醒	xǐng	waken, come to, wake up, sober up, be clear in mind, regain consciousness, wake, be awake, awaken, arouse, come alive, awake, be striking to the eye
興趣	兴趣	xìngqù	relish, appetite, zestfulness, dish, cup of tea, pastime, hobby, interest, gusto, bag, avocation, zest
性質	性质	xìngzhì	kidney, attribute, fibre, description, affection, temper, nature, self, mold, temperament, property, composition, character, hair, bent, kind, disposition, habitude, meridian, dimension, quality, note, sort
胸部	胸部	xiōngbù	chest, breast, thorax
兄弟	兄弟	xiōngdi	brothers
修理	修理	xiūlǐ	repair, mend, fix
選擇	选择	xuǎnzé	select, opt
學年	学年	xuénián	school/academic year
學分	学分	xuéfēn	point, semester hour, course credit, credit
學時	学时	xuéshí	class hour, period
學問	学问	xuéwen	lear, ology, lore, knowledge, learning, acquirement, learnedness, cognition, erudition, letter, eruditeness, scholarship
學術	学术	xuéshù	ology, academic, systematic learning, science, learning
尋找	寻找	xúnzhǎo	comb, locate, quest, search, scout, chase, reconnoiter, look_around, look_for, look, look for, find_out, pick, reconnoitre, prospect, hunt, seek, rummage, shop
牙	牙	yá	ivory, cuspid, fang, broker, tooth-like thing, tusk, tooth
迅速	迅速	xùnsù	fast, speedy, rapid, prompt
亞運會	亚运会	Yàyùnhuì	Asian Games
牙刷	牙刷	yáshuā	toothbrush, CL:把[ba3]
呀	呀	ya	particle: replacing 啊 when preceding word ends in a, e, i, o, or (y)u; used in direct address and exclamation; indicating obviousness/impatience/suggestion; used for confirmation
延長	延长	yáncháng	lengthen, prolong, extend
延期	延期	yán qī	to delay, to extend, to postpone, to defer
嚴格	严格	yángé	rigorously enforce, rigorous, tight, grim, strict
嚴	严	yán	surname Yan, tight (closely sealed), stern, strict, rigorous, severe, father
延續	延续	yánxù	continue, go on, last
嚴重	严重	yánzhòng	serious, significant, acute, critical, severe, grave
研究	研究	yánjiū	study, research
研究生	研究生	yánjiūshēng	don, postgraduate, grad student, grad, graduate student, student, graduate_student
研製	研制	yánzhì	to manufacture, to develop
鹽	盐	yán	salt
眼鏡	眼镜	yǎnjìng	cheater, lorgnon, spectacles, specs, glasses, spectacle, barnacles, eyeglasses, barnacle, eyeglass, glass
眼淚	眼泪	yǎnlèi	tear, teardrop, tears, eyedrop, waterworks
演講	演讲	yǎnjiǎng	lecture, speech
陽臺	阳台	yángtái	veranda, pergola, patio, terrace, mirador, trysting place, balcony, gallery, piazza, gazebo, deck, verandah
腰	腰	yāo	isthmus, bend, haunch, middle, strategic pass, cingulum, reins, loin, pocket, small of the back, strait, waist of a garment, middle part, waist
眼裡	眼里	yǎnli	In the eyes
養成	养成	yǎngchéng	to cultivate, to raise, to form (a habit), to acquire
藥物	药物	yàowù	healer, pharmic, medicine, druggery, curative, drug, pharmaceuticals, medicines, medicaments, medicinal, medicament, pharmaceutical, medication, remedy, drugs
搖	摇	yáo	rock, agitate, wigwag, row, pan, swing, shake, wave, scull, turn
要	要	yào	want, need, must, should
業餘	业余	yèyú	unpaid, dilettante, amateur, recreational
醫療	医疗	yīliáo	treat, cure
醫學	医学	yīxué	medicine, practice of medicine, medical science, leechcraft, physic, iatrology, medical
依靠	依靠	yīkào	rely/depend on
一律	一律	yīlǜ	equally, without exception
一致	一致	yīzhì	symphonize, coheiress, identical, quadrate, accord, coincide, equate, homologize, answer, comport, concur, consist, unanimous, chime_in, agree, jibe, unite, square, correspond, consort
葉子	叶子	yèzi	foliage, frond, leafage, leaf, leave
依然	依然	yīrán	notwithstanding, natheless, withal, even so, yet, nonetheless, nevertheless, all the same, however, still, as before
一再	一再	yīzài	repeatedly, again and again, time and again, over_and_over
移動	移动	yídòng	move, shift
移	移	yí	removal, alteration, transform, shift, remove, movement, alter, change, move
遺產	遗产	yíchǎn	heritage, legacy, inheritance, bequest, CL:筆|笔[bi3]
移民	移民	yímín	emigrant/immigrant
遺傳	遗传	yíchuán	bequeath, pass on to next generation
疑問	疑问	yíwèn	interrogation, enquiry, question, interrogatory, demand, dubiousness, inquiry, interrogative, interrogative mood, doubtfulness, query, quaere, doubt
以及	以及	yǐjí	conj.: as well as, along with, and
以內	以内	yǐnèi	within, less than
一般來說	一般来说	yībānláishuō	generally speaking
義務	义务	yìwù	duty, obligation, volunteer duty
議論	议论	yìlùn	debate, discuss
引	引	yǐn	quote, cite
引導	引导	yǐndǎo	guide, lead
引起	引起	yǐnqǐ	elicit, beget, causation, give rise to, incite, pique, engender, bring_on, trigger, fire, compel, kick_up, superindividual, draw, spawn, invite, touch_off, occasion, lead, bring_about, procure, touch off, raise, enkindle, give, poke, produce, capture, generate, stir, arouse, excite, put forward, provoke, breed, bring, conjure up, grip, create, kindle, tempt, set_up, interest, give rise, enga
引進	引进	yǐnjìn	recommend, introduce from elsewhere
應	应	yīng	should, ought to
英勇	英勇	yīngyǒng	heroic, gallant, valiant
營業	营业	yíngyè	do business
影子	影子	yǐngzi	umbra, sign, silhouette, reflection, trace, shadow, vague impression
勇敢	勇敢	yǒnggǎn	brave, courageous
贏得	赢得	yíngdé	nail down, rake_in, carry_off, nail, peg, conquer, try_for, gain, turn, win, garner, claim, earn, carry, capture, take, notch, nobble
用途	用途	yòngtú	purpose, service, help, use, value, mileage, avail
優良	优良	yōuliáng	fine, good
勇氣	勇气	yǒngqì	gameness, pluck, guts, mettle, braveness, grit, heart, moxie, courage, backbone, boldness, pride, gutsiness, nerve, pecker, courageousness, valour, spirit, spunk, gallantry, valor, virtue, audacity, bravery, pluckiness, gumption, sand, gut, valiance
優美	优美	yōuměi	graceful, exquisite
郵局	邮局	yóujú	post office
優秀	优秀	yōuxiù	outstanding, excellent
有勁兒	有劲儿	yǒujìnr5	Strength
有限	有限	yǒuxiàn	limited, finite
有趣	有趣	yǒuqù	merry, fascinating, interesting, fun, amusive, comic, amusing
幼兒園	幼儿园	yòuéryuán	kindergarten, nursery school
於是	于是	yúshì	conj.: thereupon, hence, consequently, as a result
語法	语法	yǔfǎ	phraseology, parlance, language, syntax, locution, sentence structure, grammar, expression, wording, phrasing, phrase structure, diction
玉	玉	yù	jade
語音	语音	yǔyīn	spoken pronunciation of characters, pronunciation, spoken (vs. written) pronunciation of characters, speech sounds, phonetic
預訂	预订	yùdìng	to place an order, to book ahead
玉米	玉米	yùmǐ	corn, maize, CL:粒[li4]
預測	预测	yùcè	calculate, forecast
遇	遇	yù	meet, encounter, treat, receive
遇見	遇见	yù jian	to meet
遇到	遇到	yù dào	come across, run_into, receive, meet with, encounter, run into, meet, befall
原料	原料	yuánliào	making, stuff, feedstock, ingredient, primary, raw_material, fodder, material, staple, raw material
圓	圆	yuán	round, satisfactory, comprehensive
原則	原则	yuánzé	god, rule, formula, regulation, principle, fundamental, axiom, basis, linguistic rule, faith, principium
圓滿	圆满	yuánmǎn	satisfactory
約會	约会	yuēhui	appointment, engagement, date, CL:次[ci4],個|个[ge4], to arrange to meet
月底	月底	yuèdǐ	end of the month
運動會	运动会	yùndònghuì	sports meeting, sport, gymkhana, athletic meeting, fixture, gate, game, sports meet, games, sports_meeting, meet
閱讀	阅读	yuèdú	study, read, peruse
運動員	运动员	yùndòngyuán	athlete, CL:名[ming2],個|个[ge4]
運氣	运气	yùnqi	fortune, luck
運用	运用	yùnyòng	utilize, wield, apply
在乎	在乎	zàihu	care about, take ... to heart, lie in, rest with, worry, care, mind
再三	再三	zàisān	repeatedly, again and again, over and over again, thrice, time and again
贊成	赞成	zànchéng	endorsement, agree with, stand, assent, favor, cotton, uphold, subscribe, support, see, clear, approve, agree, sympathize, second, approve of, jibe, assist, indorse, optional, plump_for, favour, endorse
在於	在于	zàiyú	be at, on, lie, in, depend on, lie_in, rest with, lie in, be determined by, consist_in, consist in
贊賞	赞赏	zànshǎng	to admire, to praise, to appreciate
贊助	赞助	zànzhù	support, assist
造型	造型	zàoxíng	moulding, molding, style, mold, mold-making, fashioning, mould-making, modelling, model
戰鬥	战斗	zhàndòu	to fight, to battle, CL:場|场[chang2],次[ci4]
戰士	战士	zhànshì	fighter, soldier, warrior, CL:個|个[ge4]
戰勝	战胜	zhànshèng	to prevail over, to defeat, to surmount
戰爭	战争	zhànzhēng	war, warfare
丈夫	丈夫	zhàngfu	masterman, man, papa, manliness, mister, goodman, married man, husband, hub, hubby
著	着	zhe	[aspect]
招呼	招呼	zhāohu	take care lest, receive, yoo-hoo, notify, take care of, recognize, say hello to, greet, halloo, speak, notification, come up to, hail, work hard, tell, beckon, get into a fight, address, accost, mind, ask, call
著火	着火	zháo huǒ	to ignite, to burn
著急	着急	zháo jí	worry, feel anxious
召開	召开	zhàokāi	convene, convoke
折	折	zhé	m.[general]
針	针	zhēn	needle, pin, stitch, injection, shot, acupuncture
針對	针对	zhēnduì	in the light of, in connection with
陣	阵	zhèn	m.[event]
爭論	争论	zhēnglùn	to argue, to debate, to contend, argument, contention, controversy, debate, CL:次[ci4],場|场[chang3]
征服	征服	zhēngfú	to conquer, to subdue, to vanquish
政府	政府	zhèngfǔ	sirkar, state, country, nation, governmental, body politic, government, administration, civil order, polity, commonwealth, regime, res publica, land
徵求	征求	zhēngqiú	ask_for, seek, solicit
