制度	制度	zhìdù	ism, organization, dispensation, regimen, machine, regulations, form, system, regime, organisation, economy, institutional, institution
制定	制定	zhìdìng	formulate, draft
製作	制作	zhìzuò	make, manufacture
志願	志愿	zhìyuàn	aspiration, wish, ideal
製造	制造	zhìzào	make, manufacture, engineer, create, fabricate
中部	中部	zhōngbù	central section, middle
中華民族	中华民族	Zhōnghuámínzú	the Chinese nation, Ch. people
鐘	钟	zhōng	timekeeper, timepiece, ticker, carillon, Zhong, time, bell, handleless cup, chime, gong, carillon playing, bell ringing, clock, Surname
終於	终于	zhōngyú	in the last analysis, at long last, at last, lastly, ultimately, all things considered, out, on the whole, at_last, eventually, in the final analysis, finally
種	种	zhǒng	m.[kind]
種子	种子	zhǒngzi	pippin, berry, pip, edible seed, key, spore, seed, canary seed
週圍	周围	zhōuwéi	all around, circumference, circumambience, compass, ambit, periphery, circumambiency, round, surrounding, perimeter, environment, precinct, vicinity, circuit, ambience, around
重大	重大	zhòngdà	great, major, crucial, weighty, whang, fatal, significant, grave
豬	猪	zhū	piggy, porcine, pig, porker, hoggery, Sus scrofa, piggish, hog, piggery, swine
主持	主持	zhǔchí	preside, head, care of, take care of, preside over, chair, minister, sponsor, direct, uphold, direction, take charge/care of, take charge of, moderate, emcee, celebrate, manage, host, mastermind, officiate, stand for, managment, run, take charge, compere
主動	主动	zhǔdòng	on one's own initiative
主張	主张	zhǔzhāng	advocate, stand for, maintain, hold
主意	主意	zhǔyi	idea, plan, decision, definite view
主任	主任	zhǔrèn	head, principal, captain, chair, director, head teacher, chief, chairman, school principal
抓	抓	zhuā	clutch, cop, grab, press-gang, scrape, arrest, hent, catch, pay special attention to, be responsible for, scratch up, take charge of, paw, grasp, scratch, claw, nab, clapperclaw, glom, seize, capture, snatch, prehend, stress
祝	祝	zhù	bless, invoke blessing, express good wishes, wish
注意	注意	zhù yì	pay attention to, take note of
專家	专家	zhuānjiā	guru, pundit, adept, expertise, professional person, specializer, specialist, proficient, whiz, oner, expert, swami, savant, dab, professional, authority, stunner, technician
專門	专门	zhuānmén	special, specialized
抓住	抓住	zhuā zhù	clutch, grip, grab, kep, nail, grapple, get_hold_of, catch, seize hold of, take_hold_of, grip sb.'s attention, cleek, grasp, hold, nab, seize, tackle, capture, snatch, take, take hold of, prehend, catch hold of, glaum, hold on
專題	专题	zhuāntí	special subject/topic
專業	专业	zhuānyè	professional
轉	转	zhuǎn	turn, revolve, rotate
轉變	转变	zhuǎnbiàn	change, transform
狀況	状况	zhuàngkuàng	repair, background, picture, state (of affairs), state of affairs, status, gear, scene, setting, scope, condition, state, circumstance, trimness, context, showing, trim, factor, condition/state (of affairs), situation, shoes, consideration, place
狀態	状态	zhuàngtài	repair, form, lie, state (of affairs), state of affairs, fix, status, going, plight, phase, condition, state, trimness, attitude, trim, shape, situation, posture, position, fettle, mode, predicament
準	准	zhǔn	accurate, exact
資格	资格	zīge	claim, credential, prerequisite, character, capability, qualifications, requirement, qualification, capacity, root/basis part of a character, status, sufficiency, seniority, competence, fitness, competency, condition
追	追	zhuī	reminiscence, to pursue, course, reminisce, trace, chase after, recall, follow, chase, pursue, go after, to chase after, look into, pursuit, heel, chevy, find out, get to the bottom of, seek, run after
資金	资金	zījīn	principal_sum, fund, bankroll, finance, coffer, ante, grubstake, munition, wherewithal, capital, working capital
自從	自从	zìcóng	since
子女	子女	zǐnǚ	sons and daughters, children
自動	自动	zìdòng	automatic
自然	自然	zìran	natural world
自覺	自觉	zìjué	be conscious/aware
自身	自身	zìshēn	self, oneself
縂	总	zǒng	always, invariably, anyway, after all, inevitably, sooner or later
自主	自主	zìzhǔ	be one's own master, take initiative
足夠	足够	zúgòu	fully, enough, last, amply, suffice, sufficiently
總是	总是	zǒngshì	always
組合	组合	zǔhé	make up, compose, unite
足球	足球	zúqiú	soccer, football
作品	作品	zuòpǐn	writing, musical composition, whole kit and caboodle, works (of literature, artwork, kit and caboodle, product, whole works, creation, full treatment, kit and boodle, whole kit and boodle, works (of literature/art), composition, thing, piece of music, workpiece, output, art), written material, opus, whole shebang, whole caboodle, production, whole kit, piece, workmanship, wo
左右	左右	zuǒyòu	left and right
總結	总结	zǒngjié	to sum up, to conclude, summary, résumé, CL:個|个[ge4]
做客	做客	zuò kè	to be a guest or visitor
作者	作者	zuòzhě	composer, author, writer, wright, paragrapher, auteur, paternity