阿拉伯語	阿拉伯语	Ālābóyǔ	Arabic (language)
穆斯林	穆斯林	Mùsīlín	Muslim
拿手	拿手	náshǒu	expert in, good at
幕後	幕后	mùhòu	behind the scenes
幕	幕	mù	m.[event]
吶喊	呐喊	nàhǎn	shout, rallying cry, cheering, to shout
納悶兒	纳闷儿	nàmènr5	puzzled, bewildered, erhua variant of 納悶|纳闷[na4 men4]
哪知道	哪知道	nǎzhīdào	Where to know
納稅	纳税	nà shuì	to pay taxes
納入	纳入	nàrù	take_in, bring ... into, to intake, integrate, to subsume, channel ... into, incorporate, channel into, bring into, to bring into, to fit into
納稅人	纳税人	nàshuìrén	taxpayer
乃至	乃至	nǎizhì	conj.: even, go so far as to
耐	耐	nài	endure, durable, stand, withstand, be able to bear or endure, bear, resistance, resist
耐人尋味	耐人寻味	nàirénxúnwèi	thought-provoking, worth thinking over, to provide food for thought
乃	乃	nǎi	therefore
耐性	耐性	nàixìng	patience, endurance
難處	难处	nánchu	trouble, difficulty, problem
南瓜	南瓜	nángua	pumpkin
難得一見	难得一见	nándéyījiàn	rarely seen
難怪	难怪	nánguài	no wonder
難點	难点	nándiǎn	difficulty
難堪	难堪	nánkān	hard to take, embarrassed
難關	难关	nánguān	difficulty, crisis
難為情	难为情	nánwéiqíng	embarrassed
難以想象	难以想象	nányǐxiǎngxiàng	Unimaginable
難說	难说	nánshuō	Hard to say
撓	挠	náo	to scratch, to thwart, to yield
難以置信	难以置信	nányǐzhìxìn	hard to believe, incredible
惱羞成怒	恼羞成怒	nǎoxiū-chéngnù	to fly into a rage out of humiliation, to be ashamed into anger (idiom)
腦海	脑海	nǎohǎi	brain, mind
鬧事	闹事	nào shì	to cause trouble, to create a disturbance
腦筋	脑筋	nǎojīn	way of thinking, ideas, head, mind, skull, brains
鬧著玩兒	闹着玩儿	nàozhewánr5	to play games, to joke around, to play a joke on sb
內閣	内阁	nèigé	cabinet
內存	内存	nèicún	internal storage, computer memory, random access memory (RAM)
內行	内行	nèiháng	expert, adept, experienced, an expert, a professional
內涵	内涵	nèihán	intension, comprehension, intention, connotation
內幕	内幕	nèimù	inside story, non-public information, behind the scenes, internal
內向	内向	nèixiàng	reserved (personality), introverted, (economics etc) domestic-oriented
嫩	嫩	nèn	old variant of 嫩[nen4], tender, delicate
內需	内需	nèixū	domestic demand
能耗	能耗	nénghào	Energy consumption
能人	能人	néngrén	capable person, Homo habilis, extinct species of upright East African hominid
能源	能源	néngyuán	energy sources, energy, juice, power sources, energy resources, the sources of energy, sources of energy
能耐	能耐	néngnai	ability, capability
泥潭	泥潭	nítán	quagmire
尼龍	尼龙	nílóng	nylon (loanword)
泥土	泥土	nítǔ	dirt, muck, earth, marl, soil, soli, clay, clart
擬定	拟定	nǐdìng	formulate, conjecture
擬	拟	nǐ	intend, plan
匿名	匿名	nìmíng	anonymous
逆	逆	nì	contrary, opposite, backwards, to go against, to oppose, to betray, to rebel
年畫	年画	niánhuà	New Year picture, New Year pictures
年限	年限	niánxiàn	age limit, fixed number of years
年薪	年薪	niánxīn	annual salary
年夜飯	年夜饭	niányèfàn	New Year's Eve family dinner
年邁	年迈	niánmài	old, aged
年終	年终	niánzhōng	end of the year
念念不忘	念念不忘	niànniàn-bùwàng	to keep in mind constantly (idiom)
黏	黏	nián	sticky, glutinous, to adhere, to stick
念書	念书	niàn shū	read, study
念頭	念头	niàntou	thing, purport, spirit, intention, idea, vision, notion, thought, train, intent
釀造	酿造	niàngzào	to brew, to make (wine, vinegar, soybean paste etc) by fermentation
娘	娘	niáng	mother, young lady, (coll.) effeminate, variant of 娘[niang2]
鳥巢	鸟巢	niǎocháo	bird's nest, nickname for Beijing 2008 Olympic stadium
捏	捏	niē	to hold between the thumb and fingers, to pinch, to mold (using the fingers), to hold (lit. in one's hand and fig.), to join together, to fabricate (a story, a report, etc), variant of 捏[nie1]
尿	尿	niào	to urinate, urine, CL:泡[pao1], see 尿[niao4]
凝聚	凝聚	níngjù	condense (of vapor), coalesce, concentrate
凝固	凝固	nínggù	to freeze, to solidify, to congeal, fig. with rapt attention
寧可	宁可	nìngkě	(would) rather, better
擰	拧	níng	to pinch, wring, mistake, to twist, stubborn
寧願	宁愿	nìngyuàn	prefer, (would) rather, better, choose
扭曲	扭曲	niǔqū	distort
扭頭	扭头	niǔ tóu	to turn one's head, to turn around
扭轉	扭转	niǔzhuǎn	turn round/back, reverse, remedy (a situation)
紐帶	纽带	niǔdài	tie, link, bond
紐扣	纽扣	niǔkòu	button
農場	农场	nóngchǎng	rancher, pen, farming, wick, ranch, hacienda, grange, farm, homestead, farmstead, plantation, steading, land
農曆	农历	nónglì	farmer's_calendar, lunar calendar, lunar_calendar
農民工	农民工	nóngmíngōng	migrant workers
濃縮	浓缩	nóngsuō	to concentrate (a liquid), concentration, espresso coffee, abbr. for 意式濃縮咖啡|意式浓缩咖啡
農作物	农作物	nóngzuòwù	(farm) crops
濃郁	浓郁	nóngyù	rich, strong, heavy (fragrance), dense, full-bodied, intense
濃厚	浓厚	nónghòu	thick, strong, dense, rich, pronounced
濃重	浓重	nóngzhòng	dense, thick, strong, rich (colors), heavy (aroma), deep (friendship), profound (effect)
弄虛作假	弄虚作假	nòngxū-zuòjiǎ	to practice fraud (idiom), by trickery
奴隸	奴隶	núlì	slave
暖烘烘	暖烘烘	nuǎnhōnghōng	nice and warm, cosy, heartwarming
虐待	虐待	nüèdài	to mistreat, to maltreat, to abuse, mistreatment, maltreatment
女婿	女婿	nǚxu	daughter's husband, son-in-law
諾言	诺言	nuòyán	promise
哦	哦	ó	particle: used when informing sb. of st. (to draw people's attention); indicating mild imperative/suggestion/exclamation/guess/etc.
挪	挪	nuó	to shift, to move
毆打	殴打	ōudǎ	beat up, come to blows
嘔吐	呕吐	ǒutù	heave, barf, sick, puke, gag, vomit, cat, upchuck, reject, spew, vomitive, disgorge, bring_up, be sick, regorge, heave_up, throw up
拍板	拍板	pāibǎn	clapper-board, auctioneer's hammer, to beat time with clappers
拍賣	拍卖	pāimài	to auction, auction sale, to sell at a reduced price
趴	趴	pā	to lie on one's stomach, to lean forward, resting one's upper body (on a desktop etc), (Taiwan) percent
排放	排放	páifàng	discharge, drain off (gas/etc.)
拍戲	拍戏	pāi xì	to shoot a movie
排練	排练	páiliàn	to rehearse, rehearsal
排斥	排斥	páichì	repel, exclude, reject
徘徊	徘徊	páihuái	perambulate, fluctuate, roll, hesitation, mosey, pace up and down, tarry, divagate, peripatetic, roam, stray, vacillate, linger, hover, rove, cast, pace back and forth, cruise, stravage, dally, maunder, wander, loiter, stroll, stooge, waver, drift, on the prowl, range, swan, hang_around, prowl, vagabond, fluctuation, ramble, hesitate, traik, skulk
派別	派别	pàibié	denomination, group, school, faction, school of thought
牌照	牌照	páizhào	(business) licence, vehicle licence, car registration, licence plate
派遣	派遣	pàiqiǎn	to send (on a mission), to dispatch
攀昇	攀升	pānshēng	to clamber up, (of prices etc) to rise
盤算	盘算	pánsuan	to plot, to scheme, to calculate
盤	盘	pán	m.[event]
判處	判处	pànchǔ	to sentence, to condemn
判定	判定	pàndìng	to judge, to decide, judgment, determination
盼	盼	pàn	hope/long for, expect
判決	判决	pànjué	adjudge
叛逆	叛逆	pànnì	to rebel, to revolt, a rebel
龐大	庞大	pángdà	huge, immense
旁觀	旁观	pángguān	spectator, non-participant
拋	抛	pāo	to throw, to toss, to fling, to cast, to abandon
拋開	抛开	pāokāi	to throw out, to get rid of
刨	刨	páo	variant of 刨[bao4], to dig, to excavate, (coll.) to exclude, not to count, to deduct, to subtract
拋棄	抛弃	pāoqì	dispose, cast aside, toss away, toss, lurch, throw out, put away, reject, abandonment, chuck, ditch, jettison, slough, renounce, flee, throw away, give up, desert, cast out, desolate, doff, chuck_out, fling, jilt, forgo, chuck out, discard, abandon, toss out, cast away, forsake
跑車	跑车	pǎochē	racing bicycle, sporting bicycle, sports car, logging truck, on the job (of a train conductor)
跑道	跑道	pǎodào	track, lane, starting-rail, runway, course, chicane, tract, racetrack, racecourse, raceway
跑龍套	跑龙套	pǎo lóngtào	to play a small role
泡沫	泡沫	pàomò	foam, (soap) bubble, (economic) bubble
陪伴	陪伴	péibàn	to accompany
陪葬	陪葬	péizàng	to be buried with or next to dead person (of deceased's partner, or of funerary objects)
賠錢	赔钱	péi qián	to lose money, to pay for damages
胚胎	胚胎	pēitāi	embryo
佩服	佩服	pèifu	admire
配件	配件	pèijiàn	component, part, fitting, accessory, replacement part
配送	配送	pèisòng	distribution, delivery
配偶	配偶	pèiǒu	spouse
配音	配音	pèi yīn	dubbing (filmmaking)
噴泉	喷泉	pēnquán	fountain
抨擊	抨击	pēngjī	attack (in speech/writing), assail
烹調	烹调	pēngtiáo	to cook, cooking
鵬程萬里	鹏程万里	péngchéng-wànlǐ	the fabled roc flies ten thousand miles (idiom), one's future prospects are brilliant
蓬勃	蓬勃	péngbó	full of vitality, vigorous, rising, flourishing
膨脹	膨胀	péngzhàng	expand, swell, inflate
捧	捧	pěng	hold/carry sth. level in both hands, boost, boast, exalt, flatter
捧場	捧场	pěng chǎng	to cheer on (originally esp. as paid stooge), to root for sb, to sing sb's praises, to flatter
碰釘子	碰钉子	pèng dīngzi	to meet with a rebuff
碰巧	碰巧	pèngqiǎo	by chance, by coincidence, to happen to
碰上	碰上	pèngshàng	to run into, to come upon, to meet
碰撞	碰撞	pèngzhuàng	to collide, collision
批發	批发	pīfā	wholesale, bulk trade, distribution
批判	批判	pīpàn	criticize
劈	劈	pī	to hack, to chop, to split open, (of lightning) to strike, to split in two, to divide
披露	披露	pīlù	to reveal, to publish, to make public, to announce
皮帶	皮带	pídài	strap, leather belt, CL:條|条[tiao2],根[gen1]
疲憊不堪	疲惫不堪	píbèibùkān	Exhausted
疲憊	疲惫	píbèi	beaten, exhausted, tired
疲倦	疲倦	píjuàn	to tire, tired
疲勞	疲劳	píláo	fatigue, wearily, weariness, weary
脾	脾	pí	spleen
匹配	匹配	pǐpèi	to mate or marry, to match, matching, compatible
譬如	譬如	pìrú	for example, such as
媲美	媲美	pìměi	to match, is comparable with
譬如說	譬如说	pìrúshuō	for example, such as
僻靜	僻静	pìjìng	lonely, secluded
偏差	偏差	piānchā	deviation, error
偏方	偏方	piānfāng	folk remedy, home remedy
偏見	偏见	piānjiàn	prejudice
片子	片子	piānzi	a roll of film, film, movie, record, album
偏僻	偏僻	piānpì	remote, desolate, far from the city
偏偏	偏偏	piānpiān	just, but, only
偏向	偏向	piānxiàng	partial towards sth, to prefer, to incline, erroneous tendencies (Leftist or Revisionist deviation)
篇幅	篇幅	piānfu	length (of a piece of writing), space occupied on a printed page
偏遠	偏远	piānyuǎn	remote, faraway
騙人	骗人	piàn rén	to cheat sb, a scam
片段	片段	piànduàn	part, extract, fragment
漂	漂	piào	to float, to drift, to bleach, elegant, polished
飄	飘	piāo	blow about, float, blow/drift about, flutter, wave, blow, drift about
票房	票房	piàofáng	box office
撇	撇	piē	to cast away, to fling aside, to throw, to cast, left-slanting downward brush stroke (calligraphy)
拼搏	拼搏	pīnbó	to struggle, to wrestle
貧富	贫富	pínfù	poor and rich
拼命	拼命	pīn mìng	go all out regardless of danger to one's life, fight desperately, exerting the utmost strength, risk life, make death-defying effort, defy death, risk one's life, with all one's might
貧窮	贫穷	pínqióng	poor, needy
頻頻	频频	pínpín	again and again, repeatedly
品嘗	品尝	pǐncháng	to taste a small amount, to sample
頻率	频率	pínlǜ	relative frequency, frequency, periodicity
品德	品德	pǐndé	moral character
品行	品行	pǐnxíng	behavior, moral conduct
品位	品位	pǐnwèi	rank, grade, quality, (aesthetic) taste
聘用	聘用	pìnyòng	to employ, to hire
乒乓球	乒乓球	pīngpāngqiú	table tennis, ping-pong, table tennis ball, CL:個|个[ge4]
聘	聘	pìn	engage, invite
聘任	聘任	pìnrèn	to appoint (to a position), appointed
平常心	平常心	píngchángxīn	Ordinary heart
平淡	平淡	píngdàn	flat, dull, ordinary, nothing special
平和	平和	pínghé	calm, pacify, composed, moderate, gentle
平價	平价	píngjià	reasonably priced, inexpensive, to keep prices down, (currency exchange) parity
平面	平面	píngmiàn	smooth, planar, planeness, plane, tabulate, level, flatness, two-dimensionality, table, sheet, horizontal surface, flat
平民	平民	píngmín	vulgus, ragtag, commonality, third estate, plebe, populace, civvy, commoner, common people, rabble, the populace, multitude, ceorl, citizen, commonage, commonalty, common person, mister, roturier, plebeian, people, plebs, democracy, commons, the common people, mass, pleb, civilian, common man
平息	平息	píngxī	to settle (a dispute), to quieten down, to suppress
評定	评定	píngdìng	to evaluate, to make one's judgment
評論員	评论员	pínglùnyuán	commentator
平日	平日	píngrì	ordinary day, everyday, ordinarily, usually
評判	评判	píngpàn	to judge (a competition), to appraise
評審	评审	píngshěn	judge, referee, umpire
憑借	凭借	píngjiè	to rely on, to depend on, by means of, thanks to, sth that one relies on
憑著	凭着	píngzhe	Depend
評委	评委	píngwěi	evaluation committee, judging panel, judging panel member, adjudicator, abbr. for 評選委員會委員|评选委员会委员[ping2 xuan3 wei3 yuan2 hui4 wei3 yuan2]
憑證	凭证	píngzhèng	proof, certificate, receipt, voucher
萍水相逢	萍水相逢	píngshuǐ-xiāngféng	strangers coming together by chance (idiom)
瓶頸	瓶颈	píngjǐng	bottleneck
潑冷水	泼冷水	pō lěngshuǐ	lit. to pour cold water on, fig. to dampen one's enthusiasm
迫不及待	迫不及待	pòbùjídài	too impatient to wait
頗	颇	pō	pretty, quite an, very, quite, jolly, fearfully, quite a, molto, middling, considerably, greatly
迫害	迫害	pòhài	to persecute, persecution
破案	破案	pò àn	to solve a case, shabby old table
破除	破除	pòchú	to eliminate, to do away with, to get rid of
破解	破解	pòjiě	to break (a bond, constraint etc), to explain, to unravel, to decipher, to decode
破舊	破旧	pòjiù	shabby
迫使	迫使	pòshǐ	distress, obligate, intrude, exact, haze, enforce, feeze, pressure, tie_down, force, compel, enjoin, flog, insist, condemn, oblige, thrust, impel, necessitate, drive, hurl, sell_up, nail_down, make, corner
破裂	破裂	pòliè	split up, flaw, rip, rend, splinter, part, break away, come_apart, chip off, come apart, bust, broken, break up, separate, chip, fracture, fall apart, split, break_down, crack, rupture, break off, come off, check, break, burst
破碎	破碎	pòsuì	to smash to pieces, to shatter
魄力	魄力	pòlì	courage, daring, boldness, resolution, drive
破滅	破灭	pòmiè	to be shattered, to be annihilated (of hope, illusions etc)
撲面而來	扑面而来	pūmiànérlái	lit. sth hits one in the face, directly in one's face, sth assaults the senses, blatant (advertising), eye catching, (a smell) assaults the nostrils
撲克	扑克	pūkè	poker (game) (loanword), deck of playing cards
鋪路	铺路	pū lù	to pave (with paving stones), to lay a road, to give a present to sb to ensure success
樸實	朴实	pǔshí	plain, simple, guileless, down-to-earth, sincere and honest
菩薩	菩萨	púsà	Buddhist idol, a term applied to a kindhearted person, kindhearted person, Bodhisattva, joss, Buddha, Boddhisatva
樸素	朴素	pǔsù	plain and simple, unadorned, simple living, not frivolous
普通人	普通人	pǔtōngrén	ordinary person, private citizen, people, the person in the street
譜	谱	pǔ	musical notation, table, chart, design, guide
瀑布	瀑布	pùbù	waterfall
七嘴八舌	七嘴八舌	qīzuǐ-bāshé	lively discussion with everybody talking at once
沏	沏	qī	to steep (tea)
凄涼	凄凉	qīliáng	desolate (place)
期盼	期盼	qīpàn	look forward to
欺騙	欺骗	qīpiàn	cheat, dupe
漆	漆	qī	paint, lacquer, CL:道[dao4], to paint (furniture, walls etc)
欺詐	欺诈	qīzhà	to cheat
齊心協力	齐心协力	qíxīn-xiélì	to work with a common purpose (idiom), to make concerted efforts, to pull together, to work as one
其間	其间	qíjiān	in between, within that interval, in the meantime
其後	其后	qíhòu	next, later, after that
奇花異草	奇花异草	qíhuāyìcǎo	very rarely seen, unusual (idiom)
奇跡	奇迹	qíjì	miracle, miraculous, wonder, marvel
歧視	歧视	qíshì	treat with bias, despise
奇特	奇特	qítè	unusual, geezer, queer, exotic, peculiar
祈禱	祈祷	qídǎo	pray
棋	棋	qí	chess, chess-like game, a game of chess, variant of 棋[qi2]
棋子	棋子	qízǐ	chess piece, CL:個|个[ge4],顆|颗[ke1]
旗袍	旗袍	qípáo	Chinese-style dress, cheongsam
旗幟	旗帜	qízhì	flag, stand, banner, colors, standard, colours, pennon, ensign, streamer, national flag, rallying point, signal flag
乞丐	乞丐	qǐgài	beggar
乞討	乞讨	qǐtǎo	to beg, to go begging
豈有此理	岂有此理	qǐyǒu-cǐlǐ	how can this be so? (idiom), preposterous, ridiculous, absurd
乞求	乞求	qǐqiú	to beg
啟蒙	启蒙	qǐ méng	to instruct the young, to initiate, to awake sb from ignorance, to free sb from prejudice or superstition, primer, enlightened, the Enlightenment, Western learning from the late Qing dynasty
啟迪	启迪	qǐdí	to edify, enlightenment
啟示	启示	qǐshì	apocalypse, illumination, revelation
起步	起步	qǐ bù	start (a task)
起草	起草	qǐ cǎo	to make a draft, to draw up (plans)
起程	起程	qǐ chéng	to set out, to leave
起初	起初	qǐchū	initio, ab initio, first, primarily, early, in_the_beginning, originally, at_first, in the beginning, initially, at the start, at first, early on
起勁	起劲	qǐjìn	vigorously, energetically, enthusiastically
起跑線	起跑线	qǐpǎoxiàn	the starting line (of a race), scratch line (in a relay race)
起源	起源	qǐyuán	origin
起伏	起伏	qǐfú	rise and fall, undulate
氣憤	气愤	qìfèn	indignant, furious
氣管	气管	qìguǎn	windpipe, trachea, respiratory tract, air duct, gas pipe
氣餒	气馁	qìněi	to be discouraged
氣泡	气泡	qìpào	bubble, blister (in metal), (of beverages) sparkling, carbonated
氣派	气派	qìpài	imposing manner or style
氣勢	气势	qìshì	air, powder, imposing manner, aura, manner, pith, vigor, atmosphere, vigour, verve, vehemence, fervor, momentum
氣味	气味	qìwèi	tang, wind, odor, savor, aurae, tint, flavor, leavening, savour, flavour, leaven, odour, aura, smatch, tinge, smell, smack, scent, taste
氣息	气息	qìxī	breath, flatus, look, feeling, spirit, smell, snuff, feel, breathing, flavor, tone, taste, flavour
氣魄	气魄	qìpò	spirit, boldness, positive outlook, imposing attitude
氣質	气质	qìzhì	kidney, fibre, charisma, crasis, mettle, humor, temper, predisposition, habit, mould, colour, class, streak, metal, temperament, disposition, strain, habitude, sensitivity, blood, proclivity, karma, gaseity, grain, makings, presence
迄今為止	迄今为止	qìjīnwéizhǐ	so far, up to now, still (not)
契約	契约	qìyuē	legal instrument, charter, bond, bargain, covenant, legal document, compact, stipulation, agreement, instrument, bargaining, pact, obligation, clause, paction, booking, affiance, indenture, promise, article, contract, concordat, official document, deed, handfast
契機	契机	qìjī	moment, critical point, turning, turning point, juncture, moment o turning point, turning/critical point, momentum
迄今	迄今	qìjīn	so far, to date, until now
器材	器材	qìcái	materials, materiel, equipment
器械	器械	qìxiè	apparatus, instrument, equipment, weapon
卡	卡	kǎ	to stop, to block, card, CL:張|张[zhang1],片[pian4], calorie, cassette, (computing) (coll.) slow, to block, to be stuck, to be wedged, customs station, a clip, a fastener, a checkpost, Taiwan pr. [ka3]
掐	掐	qiā	to pick (flowers), to pinch, to nip, to pinch off, to clutch, (slang) to fight
洽談	洽谈	qiàtán	hold trade talk, negotiate
恰到好處	恰到好处	qiàdào-hǎochù	it's just perfect, it's just right
卡子	卡子	qiǎzi	clip, hair fastener, checkpoint
恰恰相反	恰恰相反	qiàqiàxiāngfǎn	Contrary
恰如其分	恰如其分	qiàrú-qífèn	to say or do sth appropriate (idiom)
恰巧	恰巧	qiàqiǎo	fortunately, unexpectedly, by coincidence
千變萬化	千变万化	qiānbiàn-wànhuà	countless changes, constant permutation
千家萬戶	千家万户	qiānjiā-wànhù	every family (idiom)
千方百計	千方百计	qiānfāng-bǎijì	lit. thousand ways, a hundred plans (idiom), by every possible means
千鈞一髮	千钧一发	qiānjūn-yīfà	a thousand pounds hangs by a thread (idiom), imminent peril, a matter of life or death
千軍萬馬	千军万马	qiānjūn-wànmǎ	magnificent army with thousands of men and horses (idiom), impressive display of manpower, all the King's horses and all the King's men
遷就	迁就	qiānjiù	to yield, to adapt to, to accommodate to (sth)
遷	迁	qiān	movement, change, move
遷移	迁移	qiānyí	move, remove, migrate
牽扯	牵扯	qiānchě	to involve, to implicate
牽涉	牵涉	qiānshè	involve, drag in
牽掛	牵挂	qiānguà	to worry about, to be concerned about
牽頭	牵头	qiān tóu	to lead (an animal by the head), to take the lead, to coordinate (a combined operation), to mediate, a go-between (e.g. marriage broker)
鉛	铅	qiān	lead (chemistry)
牽制	牵制	qiānzhì	to control, to curb, to restrict, to impede, to pin down (enemy troops)
謙遜	谦逊	qiānxùn	humble, modest, unpretentious, modesty
簽署	签署	qiānshǔ	sign/initial (a document)
前輩	前辈	qiánbèi	senior, older generation, precursor
前不久	前不久	qiánbùjiǔ	not long ago, not long before
前赴後繼	前赴后继	qiánfù-hòujì	to advance dauntlessly in wave upon wave (idiom)
簽	签	qiān	sign, autograph
前期	前期	qiánqī	preceding period, early stage
前所未有	前所未有	qiánsuǒwèiyǒu	unprecedented
前任	前任	qiánrèn	predecessor
前無古人	前无古人	qiánwúgǔrén	Before no ancient people
前夕	前夕	qiánxī	eve, the day before
前臺	前台	qiántái	stage, proscenium, foreground in politics etc (sometimes derog.), front desk, reception desk, (computing) front-end, foreground
前線	前线	qiánxiàn	front line, military front, workface, cutting edge
前仰後合	前仰后合	qiányǎng-hòuhé	to sway to and fro, to rock back and forth
前者	前者	qiánzhě	predecessor, the former, former
前沿	前沿	qiányán	front-line, forward position, outpost, extending ahead, frontier (of science, technology etc)
虔誠	虔诚	qiánchéng	pious, devout, sincere
鉗子	钳子	qiánzi	pliers, pincers, tongs, forceps, vise, clamp, claw (of a crab etc), CL:把[ba3], (dialect) earring
錢財	钱财	qiáncái	wealth, money
潛能	潜能	qiánnéng	latent, possibility, latent energy, potency, ability, latent ability, ergal, potentiality, latent energy/ability, potential
潛艇	潜艇	qiántǐng	submarine
潛移默化	潜移默化	qiányí-mòhuà	imperceptible influence, to influence secretly
潛在	潜在	qiánzài	potential, latent
潛水	潜水	qiánshuǐ	dive, go under water
譴責	谴责	qiǎnzé	condemn, denounce, censure
欠缺	欠缺	qiànquē	lack, be deficient, be short of
欠條	欠条	qiàntiáo	IOU, certificate of indebtedness
嗆	呛	qiāng	to choke (because of swallowing the wrong way), to irritate the nose, to choke (of smoke, smell etc), pungent, (coll.) (Tw) to shout at sb, to scold, to speak out against sb
歉意	歉意	qiànyì	apology, regret
槍斃	枪毙	qiāngbì	to execute by firing squad, to shoot dead, fig. to discard, to get rid of
強加	强加	qiángjiā	to impose, to force upon
強勁	强劲	qiángjìng	strong, forceful, sturdy, powerful
強項	强项	qiángxiàng	key strength, strong suit, specialty
強硬	强硬	qiángyìng	tough, unyielding, hard-line
強行	强行	qiángxíng	force
腔	腔	qiāng	cavity of body, barrel (e.g. engine cylinder), compartment, tune, accent of speech
強占	强占	qiángzhàn	to occupy by force
強制	强制	qiángzhì	to enforce, enforcement, forcibly, compulsory
搶奪	抢夺	qiǎngduó	to plunder, to pillage, to forcibly take
搶眼	抢眼	qiǎngyǎn	eye-catching
敲邊鼓	敲边鼓	qiāo biāngǔ	to back sb up, to support sb in an argument, (lit. to beat nearby drum)
搶劫	抢劫	qiǎngjié	to rob, looting
敲詐	敲诈	qiāozhà	to rip off, to extort (money), extortion, blackmail
喬裝	乔装	qiáozhuāng	to pretend, to feign, to disguise oneself
瞧不起	瞧不起	qiáobuqǐ	to look down upon, to hold in contempt
竅門	窍门	qiàomén	a trick, an ingenious method, know-how, the knack (of doing sth)
巧合	巧合	qiǎohé	coincidence, coincidental, to coincide
翹	翘	qiào	outstanding, to raise, to stick up, to rise on one end, to tilt
切除	切除	qiēchú	excise, resect
切斷	切断	qiē duàn	sever, shut_off, amputate, disconnect, cut_off, joint, cut off, mutilate, cutting_off, lop, hang_up, interrupt, hang up, guillotine
切割	切割	qiēgē	to cut
撬	撬	qiào	to lift, to pry open, to lever open
且	且	qiě	conj.:
切身	切身	qièshēn	direct, concerning oneself, personal
竊取	窃取	qièqǔ	to steal, to seize
欽佩	钦佩	qīnpèi	to admire, to look up to, to respect sb greatly
侵害	侵害	qīnhài	encroach on (other's rights), violate
侵略	侵略	qīnlüè	invade
侵占	侵占	qīnzhàn	to invade and occupy (territory)
