阿拉伯語	阿拉伯语	Ālābóyǔ	Arabic (language)
特質	特质	tèzhì	attribute, distinctive feature, make-up, particularity, ethos, a speciality, point, lineament, colour, identification, property, distinction, thing, speciality, difference, specialty, character, idiosyncrasy, feeling of identity, distinctiveness, specialness, makeup, spot, dimension, peculiarity, quality
特製	特制	tèzhì	special, unique
藤椅	藤椅	téngyǐ	rattan chair
騰	腾	téng	to soar, to gallop, to prance, to turn over, to vacate, to clear
特邀	特邀	tèyāo	special invitation
梯子	梯子	tīzi	ladder, stepladder
剔除	剔除	tīchú	to reject, to discard, to get rid of
提拔	提拔	tíba	to promote to a higher job, to select for promotion
提名	提名	tí míng	nominate
提煉	提炼	tíliàn	to extract (ore, minerals etc), to refine, to purify, to process
提速	提速	tí sù	to increase the specified cruising speed, to pick up speed, to speed up
提心吊膽	提心吊胆	tíxīn-diàodǎn	(saying) to be very scared and on edge
提議	提议	tíyì	propose, suggest
提早	提早	tízǎo	earlier than planned or expected, in advance, shift to an earlier time
體面	体面	tǐmian	dignity, face (as in 'losing face'), honorable, creditable, pretty
體諒	体谅	tǐliàng	make allowances for
體貼	体贴	tǐtiē	be considerate, be thoughtful
體能	体能	tǐnéng	physical capability, stamina
體系	体系	tǐxì	scheme, setup, system of rules, system, superstructure, cosmos, schema
體溫	体温	tǐwēn	(body) temperature
體制	体制	tǐzhì	frame, organization, system of organization, framework, system, apparatus, framing, organisation
剃	剃	tì	to shave, variant of 剃[ti4]
替換	替换	tìhuàn	to exchange, to replace, to substitute for, to switch
體質	体质	tǐzhì	habit, constitution, crasis, habitus, health, habitude, physique
替身	替身	tìshēn	stand-in, substitute, body double, stuntman, scapegoat, fall guy, to stand in for sb else
天長地久	天长地久	tiāncháng-dìjiǔ	enduring while the world lasts (idiom), eternal
天地	天地	tiāndì	heaven and earth, world, scope, field of activity
天鵝	天鹅	tiāné	swan
天分	天分	tiānfèn	natural gift, talent
天經地義	天经地义	tiānjīng-dìyì	lit. heaven's law and earth's principle (idiom), fig. right and proper, right and unalterable, a matter of course
天平	天平	tiānpíng	scales (to weigh things)
天賦	天赋	tiānfù	gift, innate skill
天橋	天桥	tiānqiáo	Tianqiao district of Ji'nan city 濟南市|济南市[Ji3 nan2 shi4], Shandong, Tianqiao district in Beijing, formerly a center of folk culture, overhead walkway, pedestrian bridge
天生	天生	tiānshēng	inbred, born
天線	天线	tiānxiàn	antenna, mast, connection with high-ranking officials
天使	天使	tiānshǐ	angel
天性	天性	tiānxìng	natural instincts, nature
天主教	天主教	Tiānzhǔjiào	Catholicism
甜美	甜美	tiánměi	sweet, pleasant, happy
甜蜜	甜蜜	tiánmì	sweet, happy
添加	添加	tiānjiā	to add, to increase
填補	填补	tiánbǔ	to fill a gap, to fill in a blank (on a form), to overcome a deficiency
填充	填充	tiánchōng	pad, padding
填寫	填写	tiánxiě	fill in a form
舔	舔	tiǎn	to lick, to lap
甜頭	甜头	tiántou	sweet taste (of power, success etc), benefit
挑剔	挑剔	tiāoti	picky, fussy
條款	条款	tiáokuǎn	title, item, purview, detail, statute title, stipulation, proviso, point, article, provisions, provision, term, clause, condition
條例	条例	tiáolì	rules, regulation, enactment, regulations, ordonnance, ordinance, statute, act, prescription, ordinances
條約	条约	tiáoyuē	accord, understanding, pact, convention, concord, agreement, treaty
調侃	调侃	tiáokǎn	to ridicule, to tease, to mock, idle talk, chitchat
調控	调控	tiáokòng	to regulate, to control
調料	调料	tiáoliào	condiment, seasoning, flavoring
調試	调试	tiáoshì	to debug, to adjust components during testing, debugging
挑起	挑起	tiǎoqǐ	to provoke, to stir up, to incite
挑釁	挑衅	tiǎoxìn	to provoke, provocation
跳槽	跳槽	tiào cáo	to change jobs, job-hopping
跳傘	跳伞	tiàosǎn	to parachute, to bail out, parachute jumping
跳動	跳动	tiàodòng	to throb, to pulse, to bounce, to jiggle, to jump about
跳躍	跳跃	tiàoyuè	to jump, to leap, to bound, to skip
貼切	贴切	tiēqiè	close-fitting, closest (translation)
帖子	帖子	tiězi	card, invitation, message, (forum) post
貼近	贴近	tiējìn	to press close to, to snuggle close, intimate
聽從	听从	tīngcóng	to listen and obey, to comply with, to heed, to hearken
停泊	停泊	tíngbó	to anchor, anchorage, mooring (of a ship)
聽話	听话	tīng huà	to do what one is told, obedient
停電	停电	tíng diàn	power cut
停車位	停车位	tíngchēwèi	parking spot
停頓	停顿	tíngdùn	to halt, to break off, pause (in speech)
停放	停放	tíngfàng	park, place
通暢	通畅	tōngchàng	unobstructed, clear
停業	停业	tíng yè	to cease trading (temporarily or permanently), to close down
通車	通车	tōng chē	be open to traffic, have transport service
通告	通告	tōnggào	to announce, to give notice
通風	通风	tōngfēng	airy, ventilation, to ventilate, to disclose information
通順	通顺	tōngshùn	smooth, clear and coherent
通俗	通俗	tōngsú	pop, common, popular
通緝	通缉	tōngjī	to order the arrest of sb as criminal, to list as wanted
通往	通往	tōngwǎng	to lead to
通通	通通	tōngtōng	all, entire, complete
通宵	通宵	tōngxiāo	all night, throughout the night
通行證	通行证	tōngxíngzhèng	a pass (authorization through a checkpoint), a laissez-passer or safe conduct, to authenticate, to confirm name and password on a website, fig. a condition giving access to benefits (e.g. a diploma as a pass to a career)
同伴	同伴	tóngbàn	associate, friend, associator, chum, gentry, cully, familiar, fellow traveller, accompanist, fellow traveler, stablemate, companion, mate, compeer, peer, pard, bunkie, consociate, fellow, buddy, campmate, comrade
同等	同等	tóngděng	coequal, status, of same rank/status, on an equal footing, on an equal basis, of same class/rank/status, of same class, rank
同感	同感	tónggǎn	(have the) same feeling, similar impression, common feeling
同伙	同伙	tónghuǒ	colleague, co-conspirator, accomplice
同步	同步	tóngbù	synchronize
同類	同类	tónglèi	similar, same type, alike
同盟	同盟	tóngméng	alliance
同年	同年	tóngnián	the same year
同人	同人	tóngrén	colleagues, fellowship (among people)
同志	同志	tóngzhì	brother, pal, chum, crony, coterie, confrere, colleague, frater, tovarisch, compeer, paisano, brotherhood, copemate, brethren, sidekick, fellow, buddy, tavarish, comrade
同舟共濟	同舟共济	tóngzhōu-gòngjì	cross a river in the same boat (idiom), fig. having common interests, obliged to collaborate towards common goals
統籌	统筹	tǒngchóu	plan as a whole
銅	铜	tóng	Cu, cuprum, atomic number 29, copper, verdigris
統統	统统	tǒngtǒng	all, entirely, totally, completely
統治	统治	tǒngzhì	dominate, rule
捅	捅	tǒng	to stab, to poke, to prod, to nudge, to disclose
桶	桶	tǒng	bucket, (trash) can, barrel (of oil etc), CL:個|个[ge4],隻|只[zhi1]
筒	筒	tǒng	tube, cylinder, to encase in sth cylindrical (such as hands in sleeves etc), variant of 筒[tong3]
痛心	痛心	tòngxīn	lacerate, pained, harrowing, grieved, distressed, deplore
偷看	偷看	tōukàn	to peep, to peek, to steal a glance
痛	痛	tòng	ache, pain
偷窺	偷窥	tōukuī	to peep, to peek, to act as voyeur
偷懶	偷懒	tōu lǎn	to goof off, to be lazy
頭頂	头顶	tóudǐng	crown of head, head, crown, top/crown of head, top of head, top, vertex, calvaria, pate, poll
頭部	头部	tóubù	costard, crest, caput, head, nose, top section
頭號	头号	tóuhào	first rate, top rank, number one
頭條	头条	tóutiáo	lead story (on the news)
頭頭是道	头头是道	tóutóu-shìdào	clear and logical
頭暈	头晕	tóu yūn	dizzy
投奔	投奔	tóubèn	to seek shelter, to seek asylum
頭銜	头衔	tóuxián	title, rank, appellation
投稿	投稿	tóu gǎo	to submit articles for publication, to contribute (writing)
投機	投机	tóujī	speculate, be opportunistic
投射	投射	tóushè	to throw (a projectile), to cast (light)
投身	投身	tóushēn	to throw oneself into sth
投降	投降	tóuxiáng	to surrender, surrender
透徹	透彻	tòuchè	penetrating, thorough, incisive
透過	透过	tòuguò	via
透支	透支	tòuzhī	(bank) overdraft
透氣	透气	tòu qì	to flow freely (of air), to ventilate, to breathe (of fabric etc), to take a breath of fresh air, to divulge
凸	凸	tū	to stick out, protruding, convex, male (connector etc), Taiwan pr. [tu2]
凸顯	凸显	tūxiǎn	relieve, to make prominent or effective by contrast
突發	突发	tūfā	burst out or occur suddenly
突破口	突破口	tūpòkǒu	Breakout
禿	秃	tū	bald, blunt
突擊	突击	tūjī	sudden and violent attack, assault, fig. rushed job, concentrated effort to finish a job quickly
圖表	图表	túbiǎo	chart, diagram
圖像	图像	túxiàng	picture, graph, icon, image
突如其來	突如其来	tūrúqílái	to arise abruptly, to arrive suddenly, happening suddenly
圖形	图形	túxíng	motif, delineation, pattern, picture, fig, icon, graphical, graph, design, figure, sketch, construct, diagram, drawing
圖紙	图纸	túzhǐ	blueprint, drawing, design plans, graph paper
塗	涂	tú	to apply (paint etc), to smear, to daub, to blot out, to scribble, to scrawl, (literary) mud, street, variant of 途[tu2], surname Tu
徒步	徒步	túbù	to be on foot
屠殺	屠杀	túshā	to massacre, massacre, bloodbath, carnage
土匪	土匪	tǔfěi	bandit
土壤	土壤	tǔrǎng	soil
土生土長	土生土长	tǔshēng-tǔzhǎng	locally born and bred, indigenous, home-grown
團聚	团聚	tuánjù	to reunite, to have a reunion
團伙	团伙	tuánhuǒ	(criminal) gang, gang member, accomplice, crony
團員	团员	tuányuán	member (of delegation/organization/etc.)
推測	推测	tuīcè	infer, conjecture, guess
團圓	团圆	tuányuán	to have a reunion
推斷	推断	tuīduàn	to infer, to deduce, to predict, to extrapolate
推翻	推翻	tuī fān	overturn, topple, repudiate, reverse
推辭	推辞	tuīcí	to decline (an appointment, invitation etc)
推薦	推荐	tuījiàn	recommend
推理	推理	tuīlǐ	reasoning, speculative, inference
推敲	推敲	tuīqiāo	to think over
推卸	推卸	tuīxiè	to avoid (esp. responsibility), to shift (the blame), to pass the buck
推算	推算	tuīsuàn	to calculate, to reckon, to extrapolate (in calculation)
推選	推选	tuīxuǎn	to elect, to choose, to nominate
推移	推移	tuīyí	(of time) to elapse or pass, (of a situation) to develop or evolve
頹廢	颓废	tuífèi	decadent, dispirited, depressed, dejected
退回	退回	tuì huí	to return (an item), to send back, to go back
退卻	退却	tuìquè	to retreat, to shrink back
退讓	退让	tuìràng	to move aside, to get out of the way, to back down, to concede
退學	退学	tuì xué	to quit school
退休金	退休金	tuìxiūjīn	retirement pay, pension
退縮	退缩	tuìsuō	to shrink back, to cower
退役	退役	tuì yì	to retire from the military, sport etc, to demobilize, to decommission, retired from use
屯	屯	tún	to station (soldiers), to store up, village, difficult, stingy
拖累	拖累	tuōlěi	to encumber, to be a burden on, to implicate
拖欠	拖欠	tuōqiàn	in arrears, behind in payments, to default on one's debts
託付	托付	tuōfù	to entrust
拖延	拖延	tuōyán	delay, put off
脫節	脱节	tuō jié	to come apart
脫口而出	脱口而出	tuōkǒuérchū	to blurt out, to let slip (an indiscreet remark)
脫身	脱身	tuō shēn	to get away, to escape (from obligations), to free oneself, to disengage
脫落	脱落	tuōluò	to drop off, to come off, to lose (hair etc), to omit (a character when writing)
脫穎而出	脱颖而出	tuōyǐngérchū	stand out, leap out, come to the fore, jump out, jump, show itself
馱	驮	tuó	to carry on one's back, load carried by a pack animal
妥當	妥当	tuǒdang	appropriate, proper, ready
妥善	妥善	tuǒshàn	appropriate, proper
妥	妥	tuǒ	suitable, adequate, ready, settled
妥協	妥协	tuǒxié	come to terms, compromise
拓寬	拓宽	tuòkuān	broaden
唾液	唾液	tuòyè	saliva
拓展	拓展	tuòzhǎn	expand
挖掘	挖掘	wājué	excavate, unearth
瓦	瓦	wǎ	roof tile, abbr. for 瓦特[wa3 te4], watt (loan)
挖苦	挖苦	wāku	to speak sarcastically, to make cutting remarks
歪	歪	wāi	askew, at a crooked angle, devious, noxious, (coll.) to lie on one's side, to sprain (one's ankle) (Tw)
歪曲	歪曲	wāiqū	to distort, to misrepresent
外表	外表	wàibiǎo	shell, outward appearance, outwall, mess, presentation, resemblance, externality, semblance, guise, visual aspect, outwardness, exterior, rind, showing, look, superficies, likeness, mien, appearance, vizard, surface, garment, external, getup
外公	外公	wàigōng	maternal grandfather
外行	外行	wàiháng	layman, amateur
外號	外号	wàihào	nickname
外籍	外籍	wàijí	foreign nationality
外貿	外贸	wàimào	foreign trade
外貌	外貌	wàimào	profile, appearance
外企	外企	wàiqǐ	foreign enterprise, company established in mainland China with direct investment from foreign entities or from investors in Taiwan, Macao or Hong Kong, abbr. for 外資企業|外资企业
外星人	外星人	wàixīngrén	space alien, extraterrestrial
外形	外形	wàixíng	figure, shape, external form, contour
外婆	外婆	wàipó	granny, maternal grandmother, grandma, grandmother
丸	丸	wán	ball, pellet, pill
完備	完备	wánbèi	perfect
外援	外援	wàiyuán	external help, foreign aid
完蛋	完蛋	wán dàn	(coll.) to be done for
完畢	完毕	wánbì	end, conclude, complete, completion, finish
完好	完好	wánhǎo	intact, in good condition
玩耍	玩耍	wánshuǎ	to play (as children do), to amuse oneself
玩意兒	玩意儿	wányìr5	toy, plaything, thing, act, trick (in a performance, stage show, acrobatics etc), erhua variant of 玩意[wan2 yi4]
頑固	顽固	wángù	stubborn, obstinate
挽回	挽回	wǎn huí	retrieval, recover, retrieve, save, redeem, deliver
挽	挽	wǎn	variant of 挽[wan3], to draw (a cart), to lament the dead
挽救	挽救	wǎnjiù	to save, to remedy, to rescue
晚間	晚间	wǎnjiān	(in the) evening, night, in the evening, evening, (at) night, at night
晚期	晚期	wǎnqī	later period, end stage, terminal
萬分	万分	wànfēn	very much, extremely, one ten thousandth part
惋惜	惋惜	wǎnxī	to regret, to feel that it is a great pity, to feel sorry for sb
萬古長青	万古长青	wàngǔ-chángqīng	remain fresh, last forever, eternal
萬能	万能	wànnéng	omnipotent, all-purpose, universal
晚年	晚年	wǎnnián	one's later years
萬無一失	万无一失	wànwúyīshī	surefire, absolutely safe (idiom)
萬萬	万万	wànwàn	absolutely, wholly
汪洋	汪洋	wāngyáng	vast body of water, CL:片[pian4]
亡羊補牢	亡羊补牢	wángyáng-bǔláo	lit. to mend the pen after sheep are lost (idiom), fig. to act belatedly, better late than never, to lock the stable door after the horse has bolted
王國	王国	wángguó	kingdom, realm, domain
網點	网点	wǎngdiǎn	node in a network, branch, website
網民	网民	wǎngmín	web user, netizen
往常	往常	wǎngcháng	habitually (in the past), as one used to do formerly, as it used to be
往返	往返	wǎngfǎn	to go back and forth, to go to and fro, round trip
王牌	王牌	wángpái	trump card
往事	往事	wǎngshì	past, the past, past events
妄想	妄想	wàngxiǎng	to attempt vainly, a vain attempt, delusion
往日	往日	wǎngrì	in former days
忘掉	忘掉	wàng diào	to forget
忘不了	忘不了	wàngbùliǎo	cannot forget
旺季	旺季	wàngjì	busy season, peak period, see also 淡季[dan4 ji4]
旺盛	旺盛	wàngshèng	vigorous, prosperous, exuberant
望	望	wàng	gaze into distance, observe
旺	旺	wàng	prosperous, flourishing, (of flowers) blooming, (of fire) roaring
危及	危及	wēijí	to endanger, to jeopardize, a danger (to life, national security etc)
望遠鏡	望远镜	wàngyuǎnjìng	telescope
危急	危急	wēijí	critical, desperate (situation)
威風	威风	wēifēng	might, awe-inspiring authority, impressive
威懾	威慑	wēishè	to cower by military force, deterrence
威力	威力	wēilì	world power, superpower, major power, rod, great power, prowess, tooth, might, power
威信	威信	wēixìn	Weixin county in Zhaotong 昭通[Zhao1 tong1], Yunnan, prestige, reputation, trust, credit with the people
微不足道	微不足道	wēibùzúdào	negligible, insignificant
微觀	微观	wēiguān	micro-, sub-atomic
微妙	微妙	wēimiào	subtle
微型	微型	wēixíng	miniature, micro-, tiny
微弱	微弱	wēiruò	faint, feeble, weak
為人	为人	wéirén	to conduct oneself, behavior, conduct, personal character, for sb, for others' interest
違約	违约	wéi yuē	to break a promise, to violate an agreement, to default (on a loan or contract)
違章	违章	wéi zhāng	to break the rules, to violate regulations
違背	违背	wéibèi	violate, sin, go_against, infringe, go against, violation, belie, transgress, contravene, disobey, breach, break, run counter to
圍牆	围墙	wéiqiáng	enclosing wall
唯	唯	wéi	only, alone, but
唯獨	唯独	wéidú	only, just (i.e. it is only that...), all except, unique
偽造	伪造	wěizào	to forge, to fake, to counterfeit
偽裝	伪装	wěizhuāng	to pretend to be (asleep etc), to disguise oneself as, pretense, disguise, (military) to camouflage, camouflage
尾聲	尾声	wěishēng	coda, epilogue, end
尾氣	尾气	wěiqì	exhaust (i.e. waste gas from engine), emissions
緯度	纬度	wěidù	latitude
委婉	委婉	wěiwǎn	tactful, euphemistic, (of voice etc) suave, soft
委屈	委屈	wěiqu	feel wronged, be obstructed (in career), inconvenience (sb.)
委員	委员	wěiyuán	commissar, committee man, committee, committee member, commissioner, committeeman, delegate, board member, commissary
委員會	委员会	wěiyuánhuì	board, soviet, commission, committee, court, citizens committee, mission, delegacy, deputation, delegation, council
萎縮	萎缩	wěisuō	wither, shrivel, shrink, sag, atrophy
未	未	wèi	or not (at end of sentence), have not yet, or not, not
衛視	卫视	wèishì	satellite TV, abbr. of 衛星電視|卫星电视
未成年人	未成年人	wèichéngniánrén	minor (i.e. person under 18)
未經	未经	wèijīng	not having undergone, without (having gone though a certain process)
未免	未免	wèimiǎn	unavoidably, can't help, really, rather
未知數	未知数	wèizhīshù	unknown quantity
味精	味精	wèijīng	monosodium glutamate (MSG)
位子	位子	wèizi	seat, place
畏懼	畏惧	wèijù	to fear, to dread, foreboding
畏縮	畏缩	wèisuō	to cower, to flinch, to quail, to recoil
喂養	喂养	wèiyǎng	to feed (a child, domestic animal etc), to keep, to raise (an animal)
慰勞	慰劳	wèiláo	to show appreciation (by kind words, small gifts etc), to comfort
胃口	胃口	wèikou	appetite, liking
溫度計	温度计	wēndùjì	thermometer, thermograph
溫柔	温柔	wēnróu	gentle and soft
溫泉	温泉	wēnquán	hot_spring, watering_place, thermae, thermal spring, hot spring
溫習	温习	wēnxí	to review (a lesson etc)
溫室	温室	wēnshì	greenhouse
溫馨	温馨	wēnxīn	warm and fragrant
文	文	wén	surname Wen, language, culture, writing, formal, literary, gentle, (old) classifier for coins, Kangxi radical 67
瘟疫	瘟疫	wēnyì	epidemic, plague, pestilence, diseased
文具	文具	wénjù	stationery, item of stationery (pen, pencil, eraser, pencil sharpener etc)
文科	文科	wénkē	liberal arts, humanities
文憑	文凭	wénpíng	diploma
文盲	文盲	wénmáng	illiterate
文人	文人	wénrén	man of letters, scholar, literati, civilian (vs. military)
文獻	文献	wénxiàn	document, bibliography, data related to a country's history, bibliographic, literature, data, data/documents related to a country's history/culture/etc., documents related to a country's culture, documents related to a country's history, culture, etc.
文雅	文雅	wényǎ	elegant, refined
聞名	闻名	wénmíng	known, famous, know sb. by repute, be familiar with sb.'s name, well-known, famed
蚊帳	蚊帐	wénzhàng	mosquito net, CL:頂|顶[ding3]
文物	文物	wénwù	historical relics, cultural objects, artifact, historical relic, cultural relic, cultural/historical objects/relics, cultural, historical objects, relics
蚊子	蚊子	wénzi	culex, mosquito, punkie
吻	吻	wěn	kiss, to kiss, mouth, variant of 吻[wen3]
吻合	吻合	wěnhé	to be a good fit, to be identical with, to adjust oneself to, to fit in
紊亂	紊乱	wěnluàn	disorder, chaos
穩固	稳固	wěngù	stable, steady, firm, to stabilize
穩健	稳健	wěnjiàn	firm, stable and steady
穩重	稳重	wěnzhòng	steady, earnest, staid
穩妥	稳妥	wěntuǒ	dependable
問卷	问卷	wènjuàn	questionnaire
窩	窝	wō	nest, pit or hollow on the human body, lair, den, place, to harbor or shelter, to hold in check, to bend, classifier for litters and broods
問世	问世	wènshì	to be published, to come out
臥	卧	wò	to lie, to crouch
污穢	污秽	wūhuì	nasty, sordid, filthy
巫婆	巫婆	wūpó	witch, sorceress, female shaman
嗚咽	呜咽	wūyè	to sob, to whimper
無比	无比	wúbǐ	unparalleled, matchless
屋頂	屋顶	wūdǐng	roofing, rigging, rooftree, cap, roof top, house top, rooftop, attic, roof, housetop
無不	无不	wúbù	without exception, invariably
無償	无偿	wúcháng	free, no charge, at no cost
無敵	无敌	wúdí	unequalled, without rival, a paragon
無惡不作	无恶不作	wúè-bùzuò	not to shrink from any crime (idiom), to commit any imaginable misdeed
無非	无非	wúfēi	nothing but, than, simply, only
無辜	无辜	wúgū	innocent, innocence, not guilty (law)
無關緊要	无关紧要	wúguān-jǐnyào	indifferent, insignificant
無故	无故	wúgù	without cause or reason
無話可說	无话可说	wúhuàkěshuō	to have nothing to say (idiom)
無家可歸	无家可归	wújiā-kěguī	homeless
無濟於事	无济于事	wújì-yúshì	to no avail, of no use
無精打採	无精打采	wújīng-dǎcǎi	dispirited and downcast (idiom), listless, in low spirits, washed out
無可奉告	无可奉告	wúkě-fènggào	(idiom) 'no comment'
無可厚非	无可厚非	wúkě-hòufēi	see 未可厚非[wei4 ke3 hou4 fei1]
無理	无理	wúlǐ	irrational, unreasonable
無可奈何	无可奈何	wúkě-nàihé	have no way out, have no alternative, abbr. to 無奈|无奈[wu2 nai4]
無力	无力	wúlì	powerless, feel weak, lack strength, incapable
無論如何	无论如何	wúlùnrúhé	disregarding, aught, in any event, anyway, in any case, ought, at any rate, no matter what happens, irrespective, no matter, however, leastwise, anyhow, anywise, irregardless, leastways, whatever may come, disregardless, no matter what, regardless, come hell or high water, in_any_case
無能為力	无能为力	wúnéngwéilì	impotent (idiom), powerless, helpless
無情	无情	wúqíng	merciless, harden, heartless, ruthless
無情無義	无情无义	wúqíngwúyì	completely lacking any feeling or sense of justice (idiom), cold and ruthless
無窮	无穷	wúqióng	infinite, endless, inexhaustible
無私	无私	wúsī	selfless, unselfish, disinterested, altruistic
無所事事	无所事事	wúsuǒshìshì	to have nothing to do, to idle one's time away (idiom)
無所作為	无所作为	wúsuǒzuòwéi	attempting nothing and accomplishing nothing (idiom), without any initiative or drive, feckless
無條件	无条件	wútiáojiàn	unconditional
無微不至	无微不至	wúwēi-bùzhì	in every possible way (idiom), meticulous
無能	无能	wúnéng	incompetent, incapable
無線	无线	wúxiàn	wireless
無線電	无线电	wúxiàndiàn	radio
無形	无形	wúxíng	invisible
無形中	无形中	wúxíngzhōng	imperceptibly, virtually
無須	无须	wúxū	need not, not obliged to, not necessarily
無意	无意	wúyì	have no intention, not be inclined to, have no intention to
無憂無慮	无忧无虑	wúyōu-wúlǜ	carefree and without worries (idiom)
無緣	无缘	wúyuán	to have no opportunity, no way (of doing sth), no chance, no connection, not placed (in a competition), (in pop lyrics) no chance of love, no place to be together etc
無足輕重	无足轻重	wúzúqīngzhòng	insignificant
五花八門	五花八门	wǔhuā-bāmén	myriad, all kinds of, all sorts of
無知	无知	wúzhī	ignorant, stupid
五星級	五星级	wǔxīngjí	five-star (hotel)
武力	武力	wǔlì	military unit, armory, armoury, armed force, saber, arsenal, military force, armed strength, armed might, force, bayonet, force of arms
武裝	武装	wǔzhuāng	arm
捂	捂	wǔ	to enclose, to cover with the hand (one's eyes, nose or ears), to cover up (an affair), contrary, to contradict
侮辱	侮辱	wǔrǔ	to insult, to humiliate, dishonor
舞廳	舞厅	wǔtīng	dance hall, ballroom, CL:間|间[jian1]
務必	务必	wùbì	by_any_means, always, must, should, be
務實	务实	wùshí	deal with concrete matters relating to work, try to be practical/pragmatic, pragmatic, try to be pragmatic, try to be practical, deal with concrete matters
勿	勿	wù	do not
物證	物证	wùzhèng	material evidence
物流	物流	wùliú	distribution (business), logistics
物體	物体	wùtǐ	object, body, thrust, substance, matter, physical object
誤差	误差	wùchā	difference, error, inaccuracy
誤導	误导	wùdǎo	to mislead, to misguide, misleading
物資	物资	wùzī	goods, supplies
誤區	误区	wùqū	mistaken ideas, misconceptions, the error of one's ways
霧	雾	wù	(soft) rime
吸納	吸纳	xīnà	to take in, to absorb, to admit, to accept
吸取	吸取	xīqǔ	to absorb, to draw (a lesson, insight etc), to assimilate
