阿拉伯語	阿拉伯语	Ālābóyǔ	Arabic (language)
哎	哎	āi	dissatisfaction, of surprise, swounds, warning
哀求	哀求	āiqiú	to entreat, to implore, to plead
哎呀	哎呀	āiyā	jeez, of wonder, alas, wirra, swounds, lummy, shock, admiration
挨家挨戶	挨家挨户	āijiā-āihù	to go from house to house, house-to-house (search)
艾滋病	艾滋病	àizībìng	AIDS (loanword)
癌	癌	ái	tumor, sarcoma, leukemia, cancerous, melanoma, malignant tumor, cancer, malignancy, neoplasm, carcinoma
癌癥	癌症	áizhèng	carcinomatosis, cancer
愛不釋手	爱不释手	àibùshìshǒu	to love sth too much to part with it (idiom), to fondle admiringly
唉	唉	āi	mild exclamation/sigh, Gosh!, My!
愛理不理	爱理不理	àilǐbùlǐ	to look cold and indifferent, standoffish
愛面子	爱面子	ài miànzi	to save face, to worry about losing face, proud of one's reputation, sensitive about losing prestige, sense of propriety
愛惜	爱惜	àixī	cherish, treasure
礙事	碍事	ài shì	(usu used in the negative) to be of importance or to matter, to be in the way, to be a hindrance
安定	安定	āndìng	stabilize
安眠藥	安眠药	ānmiányào	sleeping pill, CL:粒[li4]
安撫	安抚	ānfǔ	to placate, to pacify, to appease
安穩	安稳	ānwěn	smooth and steady
安寧	安宁	ānníng	peaceful, tranquil, calm, composed, free from worry
按鍵	按键	ànjiàn	button or key (on a device), keystroke, CL:個|个[ge4], to press a button
按理說	按理说	ànlǐshuō	it is reasonable to say that...
安逸	安逸	ānyì	easy and comfortable, easy
安心	安心	ānxīn	reassured, disburden, set one's mind at rest, feel at ease, reassuring, keep one's mind on sth., be relieved
案件	案件	ànjiàn	a police case, law case, case (of law/etc.), a legal case, case
暗地裡	暗地里	àndìli	secretly, inwardly, on the sly
暗中	暗中	ànzhōng	in the dark, in secret, on the sly, surreptitiously
按說	按说	ànshuō	in the ordinary course of events, ordinarily, normally
凹	凹	āo	depressed, sunken, indented, concave, female (connector etc), variant of 窪|洼[wa1], (used in names)
昂貴	昂贵	ángguì	cost, costly, expensive
熬	熬	áo	to boil, to simmer, to cook on a slow fire, to extract by heating, to decoct, to endure
傲	傲	ào	proud, arrogant, to despise, unyielding, to defy
暗殺	暗杀	ànshā	to assassinate
熬夜	熬夜	áo yè	to stay up late or all night
奧祕	奥秘	àomì	secret, mystery
傲慢	傲慢	àomàn	arrogant, haughty
八卦	八卦	bāguà	the eight divinatory trigrams of the Book of Changes 易經|易经[Yi4 jing1], gossip, gossipy
巴不得	巴不得	bābude	(coll.) to be eager for, to long for, to look forward to
奧運會	奥运会	Àoyùnhuì	abbr. for 奧林匹克運動會|奥林匹克运动会, Olympic Games, the Olympics
扒	扒	bā	to peel, to skin, to tear, to pull down, to cling to (sth on which one is climbing), to dig, to rake up, to steal, to braise, to crawl
芭蕾	芭蕾	bālěi	ballet (loanword)
把柄	把柄	bǎbǐng	handle, (fig.) information that can be used against sb
把關	把关	bǎ guān	to guard a pass, to check on sth
把手	把手	bǎshou	handle, grip, knob
罷免	罢免	bàmiǎn	to remove sb from their post, to dismiss
靶子	靶子	bǎzi	target
壩	坝	bà	dam, dike, embankment, CL:條|条[tiao2]
罷休	罢休	bàxiū	to give up, to abandon (a goal etc), to let sth go, forget it, let the matter drop
掰	掰	bāi	to break off or break open sth with one's hands, (fig.) to break off (a relationship)
白白	白白	báibái	in vain, to no purpose, for nothing, white
霸占	霸占	bàzhàn	to occupy by force, to seize, to dominate
百分比	百分比	bǎifēnbǐ	percent, per centum, pct, percentage, percent(age)
百科全書	百科全书	bǎikēquánshū	encyclopedia, CL:本[ben3],集[ji2]
柏樹	柏树	bǎishù	cypress tree, Taiwan pr. [bo2 shu4]
百合	百合	bǎihé	lily
擺放	摆放	bǎifàng	to set up, to arrange, to lay out
擺設	摆设	bǎishe	furnish and decorate (room)
擺平	摆平	bǎi píng	to be fair, to be impartial, to settle (a matter etc)
拜會	拜会	bàihuì	pay sb. a visit
拜年	拜年	bài nián	to pay a New Year call, to wish sb a Happy New Year
拜託	拜托	bàituō	to request sb to do sth, please!
扳	扳	bān	to pull, to turn (sth) around, to turn around (a situation), to recoup, variant of 攀[pan1]
拜見	拜见	bàijiàn	to pay a formal visit, to call to pay respects, to meet one's senior or superior
頒發	颁发	bānfā	issue, promulgate, award
頒獎	颁奖	bān jiǎng	present reward/honor
頒布	颁布	bānbù	to issue, to proclaim, to enact (laws, decrees etc)
斑點	斑点	bāndiǎn	spot, stain, speckle
搬遷	搬迁	bānqiān	to move, to relocate, removal
辦不到	办不到	bànbudào	impossible, can't be done, no can do, unable to accomplish
半邊天	半边天	bànbiāntiān	half the sky, women of the new society, womenfolk
板塊	板块	bǎnkuài	block, slab, tectonic plate, continental plate
半場	半场	bànchǎng	half of a game or contest, half-court
半島	半岛	bàndǎo	peninsula
半路	半路	bànlù	halfway, midway, on the way
半數	半数	bànshù	half, half (the number), det.: half
半途而廢	半途而废	bàntúérfèi	to give up halfway (idiom), leave sth unfinished
半信半疑	半信半疑	bànxìn-bànyí	half doubting, dubious, skeptical
半真半假	半真半假	bànzhēn-bànjiǎ	(idiom) half true and half false
伴	伴	bàn	accompany
扮	扮	bàn	to disguise oneself as, to dress up, to play (a role), to put on (an expression)
伴侶	伴侣	bànlǚ	companion, mate, helpmate, coachfellow, familiar, partner, fere, company
伴隨	伴随	bànsuí	accompany, follow
伴奏	伴奏	bànzòu	accompany (with musical instruments)
幫手	帮手	bāngshou	helper, assistant
綁	绑	bǎng	bind, tie, bind sb.'s hands behind him, truss up
拌	拌	bàn	to mix, to mix in, to toss (a salad)
綁架	绑架	bǎngjià	to kidnap, to abduct, to hijack, a kidnapping, abduction, staking
榜樣	榜样	bǎngyàng	example, model, CL:個|个[ge4]
包袱	包袱	bāofu	cloth wrapper, bundle wrapped in cloth, burden, millstone round one's neck, punch line (in cross-talk)
棒球	棒球	bàngqiú	no-hitter, apple, grounder, baseball game, homer, change-up, baseball, extra innings, curve, ball game, horsehide, infielder
磅	磅	bàng	see 磅秤 scale, platform balance, (loanword) pound (unit of weight, about 454 grams)
包容	包容	bāoróng	forgive, pardon, contain
包扎	包扎	bāozā	to wrap up, to pack, to bind up (a wound)
剝	剥	bō	to peel, to skin, to shell, to shuck, to peel, to skin, to flay, to shuck
煲	煲	bāo	to cook slowly over a low flame, pot, saucepan
飽和	饱和	bǎohé	saturation
飽滿	饱满	bǎomǎn	full, plump
寶藏	宝藏	bǎozàng	precious (mineral) deposits, (budd.) the treasure of Buddha's law
保管	保管	bǎoguǎn	to hold in safekeeping, to have in one's care, to guarantee, certainly, surely, custodian, curator
保姆	保姆	bǎomǔ	nanny, housekeeper
寶庫	宝库	bǎokù	treasure-house, treasury, treasure-trove (often fig., book of treasured wisdom)
保暖	保暖	bǎo nuǎn	to stay warm, to protect against the cold
保鮮	保鲜	bǎo xiān	Preservation
保修	保修	bǎoxiū	to promise to keep sth in good repair, guarantee, warranty
保佑	保佑	bǎoyòu	to bless and protect, blessing
保障	保障	bǎozhàng	ensure, guarantee, safeguard
保質期	保质期	bǎozhìqī	date of use (on foodstuffs), best before date
保重	保重	bǎozhòng	to take care of oneself
報	报	bào	newspaper, periodical, bulletin, telegram
堡壘	堡垒	bǎolěi	fort
報仇	报仇	bào chóu	to take revenge, to avenge
報酬	报酬	bàochou	emolument, reward, fee, recompense, earnings, gratuity, requital, retribution, price, harvest, remuneration, quittance, pay, consideration, salary, compensation, honorarium, payment, meed, gratification, wage, guerdon
報廢	报废	bào fèi	to scrap, to be written off
報社	报社	bàoshè	newspaper (i.e. a company), CL:家[jia1]
報亭	报亭	bàotíng	kiosk, newsstand
報復	报复	bàofu	to make reprisals, to retaliate, revenge, retaliation
報銷	报销	bào xiāo	to submit an expense account, to apply for reimbursement, to write off, to wipe out
抱負	抱负	bàofù	aspiration, ambition
豹	豹	bào	leopard, panther
暴風驟雨	暴风骤雨	bàofēng-zhòuyǔ	violent wind and rainstorm, hurricane, tempest
暴利	暴利	bàolì	sudden huge profits
暴躁	暴躁	bàozào	irascible, irritable, violent
曝光	曝光	bào guāng	expose
爆冷門	爆冷门	bàolěngmén	an upset (esp. in sports), unexpected turn of events, to pull off a coup, a breakthrough
爆竹	爆竹	bàozhú	firecracker
悲哀	悲哀	bēiāi	grieved, sorrowful
爆滿	爆满	bàomǎn	filled to capacity (of theater, stadium, gymnasium etc)
悲觀	悲观	bēiguān	pessimistic
悲歡離合	悲欢离合	bēihuān-líhé	joys and sorrows, partings and reunions, the vicissitudes of life
卑鄙	卑鄙	bēibǐ	base, mean, contemptible, despicable
悲痛	悲痛	bēitòng	grieved, sorrowful
碑	碑	bēi	a monument, an upright stone tablet, stele, CL:塊|块[kuai4],面[mian4]
貝殼	贝壳	bèiké	cowrie, shell, cameo, conch, seashell, valve, clamshell
備課	备课	bèi kè	(of a teacher) to prepare lessons
備受	备受	bèishòu	fully experience (good or bad)
背面	背面	bèimiàn	the back, the reverse side, the wrong side
備用	备用	bèiyòng	reserve, spare, alternate, backup
背誦	背诵	bèisòng	to recite, to repeat from memory
背叛	背叛	bèipàn	to betray
被捕	被捕	bèibǔ	to be arrested, under arrest
奔赴	奔赴	bēnfù	to rush to, to hurry to
奔波	奔波	bēnbō	rush about, be busy running about
本分	本分	běnfèn	(to play) one's part, one's role, one's duty, (to stay within) one's bounds, dutiful, keeping to one's role
本能	本能	běnnéng	whim, appetence, vagary, instinct, instinctive, native ability, inherent aptitude, impulse, caprice, faculty
本錢	本钱	běnqián	principal, capital
本性	本性	běnxìng	natural instincts, nature, inherent quality
本著	本着	běnzhe	based on..., in conformance with.., taking as one's main principle
本意	本意	běnyì	original idea, real intention, etymon
奔	奔	bēn	hurry, rush, be getting on for, head for, flee, run, run quickly, approach, hasten, be getting close to, go straight towards
笨蛋	笨蛋	bèndàn	fool, idiot
笨重	笨重	bènzhòng	heavy, cumbersome, unwieldy
崩潰	崩溃	bēngkuì	collapse, fall apart
繃帶	绷带	bēngdài	bandage (loanword)
繃	绷	běng	to stretch, taut, to tie, to bind, to have a taut face
本色	本色	běnsè	inherent qualities, natural qualities, distinctive character, true qualities, natural color
逼近	逼近	bījìn	press on towards, approach
蹦	蹦	bèng	to jump, to bounce, to hop
逼迫	逼迫	bīpò	to force, to compel, to coerce
比比皆是	比比皆是	bǐbǐ-jiēshì	can be found everywhere
逼真	逼真	bīzhēn	lifelike, true to life, distinctly, clearly
鼻涕	鼻涕	bítì	nasal mucus, snivel
比不上	比不上	bǐbùshàng	not compare with
比起	比起	bǐqǐ	compared with
比試	比试	bǐshi	to have a competition, to measure with one's hand or arm, to make a gesture of measuring
比喻	比喻	bǐyù	metaphor, analogy
鄙視	鄙视	bǐshì	to despise, to disdain, to look down upon
必不可少	必不可少	bìbùkěshǎo	absolutely necessary, indispensable, essential
必定	必定	bìdìng	inevitably, sure, for sure, by all means, needs, necessarily, sure enough, sure as shooting, be sure to, surely, certainly, of necessity, for certain
碧綠	碧绿	bìlǜ	dark green
弊病	弊病	bìbìng	malady, evil, malpractice, drawback, disadvantage
弊端	弊端	bìduān	malpractice, abuse, corrupt practice
避難	避难	bì nàn	refuge, to take refuge, to seek asylum (political etc)
壁畫	壁画	bìhuà	mural (painting), fresco
避暑	避暑	bì shǔ	to be away for the summer holidays, to spend a holiday at a summer resort, to prevent sunstroke
邊界	边界	biānjiè	confine, margin, bounds, marchland, boundary, demarcation line, demarcation, borderline, precinct, skirt, frontier, list, borderland, delimitation, butting, bound, boundary line, perimeter, outskirts, coast, march, line, border, mete, limit, skirting, edge
邊疆	边疆	biānjiāng	border area, borderland, frontier, frontier region
邊遠	边远	biānyuǎn	far from the center, remote, outlying
編劇	编剧	biānjù	to write a play, scenario, dramatist, screenwriter
編號	编号	biānhào	to number, numbering, serial number
編寫	编写	biānxiě	to compile
編造	编造	biānzào	to compile, to draw up, to fabricate, to invent, to concoct, to make up, to cook up
編排	编排	biānpái	to arrange, to lay out
鞭策	鞭策	biāncè	to spur on, to urge on, to encourage sb (e.g. to make progress)
鞭炮	鞭炮	biānpào	firecrackers, string of small firecrackers, CL:枚[mei2]
變革	变革	biàngé	change, revolution
貶值	贬值	biǎn zhí	to become devaluated, to devaluate, to depreciate
變遷	变迁	biànqiān	vicissitudinary, change
變異	变异	biànyì	variation
變幻莫測	变幻莫测	biànhuànmòcè	to change unpredictably, unpredictable, erratic, treacherous
便道	便道	biàndào	pavement, sidewalk, shortcut, makeshift road
變質	变质	biànzhì	to degenerate, to go bad, to deteriorate, metamorphosis
便飯	便饭	biànfàn	an ordinary meal, simple home cooking
便利店	便利店	biànlìdiàn	convenience store
便捷	便捷	biànjié	convenient and fast
辨別	辨别	biànbié	to differentiate, to distinguish, to discriminate
遍布	遍布	biànbù	to cover the whole (area), to be found throughout
辨認	辨认	biànrèn	to recognize, to identify
辯	辩	biàn	to dispute, to debate, to argue, to discuss
辯護	辩护	biànhù	to speak in defense of, to argue in favor of, to defend, to plead
辮子	辫子	biànzi	plait, braid, pigtail, a mistake or shortcoming that may be exploited by an opponent, handle, CL:根[gen1],條|条[tiao2]
辯解	辩解	biànjiě	to explain, to justify, to defend (a point of view etc), to provide an explanation, to try to defend oneself
標榜	标榜	biāobǎng	excessively praise, parade, glorify, advertisement, boast, boost, advertise, flaunt
標	标	biāo	mark, sign, label, to mark with a symbol, label, lettering etc, to bear (a brand name, registration number etc), prize, award, bid, target, quota, (old) the topmost branches of a tree, visible symptom, classifier for military units
標本	标本	biāoběn	example, representative, pattern, specimen, root cause and symptoms of disease, sample, model
標簽	标签	biāoqiān	mark, ticket, gummed label, tab, markup, sticker, label, tally, tag
標示	标示	biāoshì	label
標語	标语	biāoyǔ	written slogan, placard, CL:幅[fu2],張|张[zhang1],條|条[tiao2]
飆升	飙升	biāoshēng	to rise rapidly, to soar
標致	标致	biāozhi	Peugeot, beautiful (of woman), pretty
表白	表白	biǎobái	to explain oneself, to express, to reveal one's thoughts or feelings, declaration, confession
表決	表决	biǎojué	(decide by) vote
表述	表述	biǎoshù	to formulate, enunciation, to explain sth precisely
表率	表率	biǎoshuài	example, model
表彰	表彰	biǎozhāng	to honor, to commend, to cite (in dispatches)
憋	憋	biē	to choke, to stifle, to restrain, to hold back, to hold in (urine), to hold (one's breath)
別具匠心	别具匠心	biéjù-jiàngxīn	Unique
別看	别看	biékàn	Don't look at
表態	表态	biǎo tài	to declare one's position, to say where one stands
別墅	别墅	biéshù	villa
別說	别说	biéshuō	Don't say
別提了	别提了	biétíle	say no more, don't bring it up, drop the subject
別扭	别扭	bièniu	awkward, difficult, uncomfortable, not agreeing, at loggerheads, gauche
別致	别致	biézhì	unusual, unique, variant of 別緻|别致[bie2 zhi4]
彬彬有禮	彬彬有礼	bīnbīn-yǒulǐ	refined and courteous, urbane
繽紛	缤纷	bīnfēn	vast and various, rich and diverse
冰棍兒	冰棍儿	bīnggùnr5	ice lolly, popsicle
濱海	滨海	bīnhǎi	Binhai (place name), Binhai New District, subprovincial district of Tianjin, Binhai county in Yancheng 鹽城|盐城[Yan2 cheng2], Jiangsu, fictitious city Binhai in political satire, coastal, bordering the sea
丙	丙	bǐng	third of the ten Heavenly Stems 十天干[shi2 tian1 gan1], third in order, letter 'C' or roman 'III' in list 'A, B, C', or 'I, II, III' etc, ancient Chinese compass point: 165°, propyl
秉承	秉承	bǐngchéng	to take orders, to receive commands, to carry on (a tradition)
冰山	冰山	bīngshān	iceberg, CL:座[zuo4]
併購	并购	bìnggòu	merge into
並列	并列	bìngliè	appose, collocate, stand side by side, be juxtaposed, juxtapose
並非	并非	bìngfēi	really isn't
病床	病床	bìngchuáng	hospital bed, sickbed
並行	并行	bìngxíng	to proceed in parallel, side by side (of two processes, developments, thoughts etc)
撥	拨	bō	move with hand/foot/stick/etc., turn, stir, poke
病癥	病症	bìngzhèng	disease, illness
撥款	拨款	bōkuǎn	to allocate funds, appropriation
波及	波及	bōjí	affect, spread to
撥通	拨通	bōtōng	Dial
波瀾	波澜	bōlán	billows, great waves (fig. of a story with great momentum)
波折	波折	bōzhé	twists and turns
剝奪	剥夺	bōduó	to deprive, to expropriate, to strip (sb of his property)
波濤	波涛	bōtāo	great waves, billows
伯伯	伯伯	bóbo	uncle-in-law, father's elder brother, uncle
剝削	剥削	bōxuē	to exploit, exploitation
伯母	伯母	bómǔ	wife of father's elder brother, aunt, (polite form of address for a woman who is about the age of one's mother), CL:個|个[ge4]
駁回	驳回	bóhuí	to reject, to turn down, to overrule
脖子	脖子	bózi	cervix, neck
伯父	伯父	bófù	father's elder brother, term of respect for older man, CL:個|个[ge4]
搏鬥	搏斗	bódòu	to wrestle, to fight, to struggle
不見得	不见得	bùjiànde	not likely, not necessarily/likely, likely, unlikely, not necessarily
不定	不定	bùdìng	uncertain, indeterminate, indefinite, undetermined
不慎	不慎	bùshèn	incautious, inattentive
不利於	不利于	bù lìyú	is harmful to
不算	不算	bùsuàn	Not count
不像話	不像话	bù xiànghuà	unreasonable, shocking, outrageous
不屑	不屑	bùxiè	to disdain to do sth, to think sth not worth doing, to feel it beneath one's dignity
不適	不适	bùshì	unwell, indisposed
不亞於	不亚于	bùyàyú	no less than, not inferior to
不亦樂乎	不亦乐乎	bùyìlèhū	lit. isn't that a joy? (quote from Confucius), fig. (jocularly) extremely, awfully
不懈	不懈	bùxiè	untiring, unremitting, indefatigable
不翼而飛	不翼而飞	bùyìérfēi	to disappear without trace, to vanish all of a sudden, to spread fast, to spread like wildfire
不正之風	不正之风	bùzhèngzhīfēng	unhealthy tendency
補給	补给	bǔjǐ	supply, replenishment, to replenish
不用說	不用说	bùyòngshuō	Needless to say
捕捉	捕捉	bǔzhuō	seizure, seize, tackle, capture, snare, nobble, get, catch
哺育	哺育	bǔyù	to feed, to nurture, to foster
不恥下問	不耻下问	bùchǐ-xiàwèn	not feel ashamed to ask and learn from one's subordinates
不辭而別	不辞而别	bùcíérbié	to leave without saying good-bye
補救	补救	bǔjiù	to remedy
不得而知	不得而知	bùdéérzhī	unknown, unable to find out
不妨	不妨	bùfáng	there is no harm in, might as well
不得已	不得已	bùdéyǐ	to act against one's will, to have no alternative but to, to have to, to have no choice, must
不服氣	不服气	bùfúqì	Uncomfortable
不假思索	不假思索	bùjiǎ-sīsuǒ	to act without taking time to think (idiom), to react instantly, to fire from the hip
不解	不解	bùjiě	not understand
不經意	不经意	bùjīngyì	not paying attention, carelessly, by accident
不景氣	不景气	bù jǐngqì	depressive, in depression, in depressing state, recession
不堪	不堪	bùkān	can't bear/stand
不服	不服	bùfú	not to accept sth, to want to have sth overruled or changed, to refuse to obey or comply, to refuse to accept as final, to remain unconvinced by, not to give in to
不可思議	不可思议	bùkě-sīyì	inconceivable (idiom), unimaginable, unfathomable
不可避免	不可避免	bùkěbìmiǎn	unavoidably
不肯	不肯	bù kěn	Refuse
不理	不理	bùlǐ	to refuse to acknowledge, to pay no attention to, to take no notice of, to ignore
不了了之	不了了之	bùliǎo-liǎozhī	to settle a matter by leaving it unsettled, to end up with nothing definite
不難	不难	bù nán	Not difficult
不平	不平	bùpíng	dissatisfaction
不起眼	不起眼	bùqǐyǎn	unremarkable, nothing out of the ordinary
不如說	不如说	bùrú shuō	rather say
不同尋常	不同寻常	bùtóngxúncháng	unusual
不為人知	不为人知	bùwéirénzhī	not known to anyone, secret, unknown
不惜	不惜	bùxī	not stint, not hesitate (to do sth.)
不容	不容	bùróng	must not, cannot, to not allow, cannot tolerate
不相上下	不相上下	bùxiāngshàngxià	equally matched, about the same
不已	不已	bùyǐ	incessantly, endlessly
不宜	不宜	bùyí	be unsuitable
不以為然	不以为然	bùyǐwéirán	disagree, not approve of, acceptable, object to, consider sth. not so, take exception to, right
不由自主	不由自主	bùyóu-zìzhǔ	can't help, involuntarily (idiom)
不予	不予	bùyǔ	to withhold, to refuse
不由得	不由得	bùyóude	can't help, cannot but
不約而同	不约而同	bùyuēértóng	happen to coincide, coincidentally do sth.
不知	不知	bùzhī	not to know, unaware, unknowingly, fig. not to admit (defeat, hardships, tiredness etc)
不知不覺	不知不觉	bùzhī-bùjué	unconsciously, unaware
不准	不准	bùzhǔn	not to allow, to forbid, to prohibit
布局	布局	bùjú	arrangement, composition, layout, opening (chess jargon)
步入	步入	bùrù	go into, walk into
步驟	步骤	bùzhòu	process, instance, demarche, method, measure, approach, procedure, place, step, move
部件	部件	bùjiàn	part, component
步伐	步伐	bùfá	pace, (measured) step, march
部署	部署	bùshǔ	dispose, deploy
猜謎	猜谜	cāi mí	Guess
猜想	猜想	cāixiǎng	to guess, to conjecture, to suppose, to suspect
財經	财经	cáijīng	finance and economics
財力	财力	cáilì	financial resources
財務	财务	cáiwù	finance, financial affairs, financial
才華	才华	cáihuá	literary talent, artistic talent, literary, literacy, flair, literary/artistic talent
財政	财政	cáizhèng	finance
裁	裁	cái	to cut out (as a dress), to cut, to trim, to reduce, to diminish, to cut back (e.g. on staff), decision, judgment
財物	财物	cáiwù	property, belongings
裁定	裁定	cáidìng	ruling
採	采	cǎi	pick, gather
裁決	裁决	cáijué	ruling, adjudication
採礦	采矿	cǎi kuàng	mining
彩虹	彩虹	cǎihóng	rainbow, CL:道[dao4]
彩電	彩电	cǎidiàn	color TV
彩霞	彩霞	cǎixiá	clouds tinged with sunset hues
菜市場	菜市场	càishìchǎng	food market
採集	采集	cǎijí	oyster, collect, gather, pick up and put together
參見	参见	cānjiàn	to refer to, see also, confer (cf.), to pay respect to
參謀	参谋	cānmóu	staff officer, to give advice
參軍	参军	cān jūn	to join the army
餐桌	餐桌	cānzhuō	dining table, dinner table
參照	参照	cānzhào	to consult a reference, to refer to (another document)
殘留	残留	cánliú	to remain, left over, surplus, remnant
殘缺	残缺	cánquē	badly damaged, shattered
殘	残	cán	to destroy, to spoil, to ruin, to injure, cruel, oppressive, savage, brutal, incomplete, disabled, to remain, to survive, remnant, surplus
殘忍	残忍	cánrěn	cruel, mean, merciless, ruthless
慚愧	惭愧	cánkuì	ashamed
慘痛	惨痛	cǎntòng	bitter, painful, deeply distressed
慘重	惨重	cǎnzhòng	disastrous
慘白	惨白	cǎnbái	deathly pale
蒼蠅	苍蝇	cāngying	housefly, CL:隻|只[zhi1]
滄桑	沧桑	cāngsāng	great changes, abbr. of 滄海桑田|沧海桑田[cang1 hai3 sang1 tian2]
艙	舱	cāng	cabin, the hold of a ship or airplane
燦爛	灿烂	cànlàn	brilliant, glitter, splendid, resplend, resplendent, magnificent
藏品	藏品	cángpǐn	museum piece, collector's item, precious object
藏匿	藏匿	cángnì	to cover up, to conceal, to go into hiding
藏身	藏身	cángshēn	to hide, to go into hiding, to take refuge
操心	操心	cāo xīn	to worry about
操勞	操劳	cāoláo	to work hard, to look after
操控	操控	cāokòng	to control, to manipulate
槽	槽	cáo	trough, manger, groove, channel, (Tw) (computing) hard drive
草案	草案	cǎoàn	ground plan, plan, blueprint, a protocol, skeleton, a draft plan, a draft, sketch, rough, an outline, draft
草坪	草坪	cǎopíng	lawn
側面	侧面	cèmiàn	lateral side, side, aspect, profile
側重	侧重	cèzhòng	to place particular emphasis on
測算	测算	cèsuàn	to take measurements and calculate
測驗	测验	cèyàn	test
層出不窮	层出不穷	céngchū-bùqióng	more and more emerge, innumerable succession, breeding like flies (idiom)
蹭	蹭	cèng	to rub against, to walk slowly, to freeload (colloquial)
差錯	差错	chācuò	mistake, slip-up, fault, error (in data transmission), accident, mishap
差額	差额	chāé	balance (financial), discrepancy (in a sum or quota), difference
插手	插手	chā shǒu	to get involved in, to meddle, interference
插圖	插图	chātú	illustration
插嘴	插嘴	chā zuǐ	to interrupt (sb talking), to butt in, to cut into a conversation
茶道	茶道	chádào	Japanese tea ceremony, sado
茶館兒	茶馆儿	cháguǎnr5	a teashop
查處	查处	cháchǔ	to investigate and handle (a criminal case)
查明	查明	chámíng	to investigate and find out, to ascertain
查找	查找	cházhǎo	to search for, to look up
察覺	察觉	chájué	realize, be aware
察看	察看	chákàn	to watch, to look carefully at
詫異	诧异	chàyì	flabbergasted, astonished
