阿拉伯語	阿拉伯语	Ālābóyǔ	Arabic (language)
灌輸	灌输	guànshū	to imbue with, to inculcate, to instill into, to teach, to impart, to channel water to another place
罐	罐	guàn	can, jar, pot, variant of 罐[guan4]
罐頭	罐头	guàntou	tin, can, canned goods
光彩	光彩	guāngcǎi	luster, splendor, radiance, brilliance
光碟	光碟	guāngdié	compact disk, compact disc, CD ROM, compact_disk, CD
光顧	光顾	guānggù	to visit (as a customer)
光滑	光滑	guānghua	glossy, sleek, smooth
光環	光环	guānghuán	halo, ring of light
光纜	光缆	guānglǎn	optical cable
光芒	光芒	guāngmáng	ray_of_light, rays of light, brilliant ray, radiance
光明磊落	光明磊落	guāngmíng-lěiluò	open and candid (idiom), straightforward and upright
光澤	光泽	guāngzé	Guangze county in Nanping 南平[Nan2 ping2] Fujian, luster, gloss
廣義	广义	guǎngyì	broad sense
歸根到底	归根到底	guīgēndàodǐ	after all, in the final analysis, ultimately
歸還	归还	guīhuán	to return sth, to revert
歸結	归结	guījié	to sum up, to conclude, in a nutshell, the end (of a story)
歸來	归来	guīlái	come back, be back, return, go back to
歸納	归纳	guīnà	sum up, conclude, induce
歸屬	归属	guīshǔ	belong to
歸宿	归宿	guīsù	place to return to, home, final destination, ending
龜	龟	guī	tortoise, turtle
規格	规格	guīgé	quality requirements, requirement, specification, standard, spec, criterion, measure, touchstone, specifications
規矩	规矩	guīju	rule, custom
閨女	闺女	guīnü	maiden, unmarried woman, daughter
瑰寶	瑰宝	guībǎo	gem, (fig.) rare and valuable item, gem, treasure
軌跡	轨迹	guǐjì	track, orbit, trail, locus
櫃檯	柜台	guìtái	sales counter, front desk, bar, (of markets, medicines etc) OTC (over-the-counter), variant of 櫃檯|柜台[gui4 tai2]
貴賓	贵宾	guìbīn	honored guest, VIP, visiting fireman, visitant, honoured guest, distinguished guest, visiting_fireman, honored/distinguished guest, honored
貴重	贵重	guìzhòng	precious
貴族	贵族	guìzú	baron, aristocratism, atheling, nobleman, jarl, grandee, raja, aristocracy, patrician, blue blood, lord, magnifico, noble, aristocrat, baronage, peer, mogul, nobility, patricianhood, peerage, sirdar, amir, nobles
桂花	桂花	guìhuā	osmanthus flowers, Osmanthus fragrans
滾動	滚动	gǔndòng	to roll, (to do sth) in a loop, to scroll (computing), to progressively expand (economics), to rumble (of thunder)
棍	棍	gùn	stick, rod, truncheon
棍子	棍子	gùnzi	stick, rod
國寶	国宝	guóbǎo	national treasure
國防	国防	guófáng	national defence, national defense
國畫	国画	guóhuà	trad. Ch. painting
國徽	国徽	guóhuī	national emblem, coat of arms
國情	国情	guóqíng	current state of a country, national conditions, (US) State of the Union
國土	国土	guótǔ	territorial dominion, state, country, colony, soil, nation, realm, soli, province, territory, mandate, dominion, land
國學	国学	guóxué	Chinese national culture, studies of ancient Chinese civilization, the Imperial College (history)
國有	国有	guóyǒu	belong to the state, nationalized, state-owned
果斷	果断	guǒduàn	firm, decisive
果園	果园	guǒyuán	arbour, garden, orchard
果真	果真	guǒzhēn	really, as expected
裹	裹	guǒ	to bind, to wrap, a bundle, a parcel
過半	过半	guòbàn	over fifty percent, more than half
過不去	过不去	guòbuqù	to make life difficult for, to embarrass, unable to make it through
過錯	过错	guòcuò	mistake, fault, responsibility (for a fault)
過關	过关	guò guān	reach standard, pass a barrier, reach a standard, pass test, pass barrier, pass, go through ordeal, pass a test, go through an ordeal
過道	过道	guòdào	passageway, corridor, aisle
過獎	过奖	guòjiǎng	to overpraise, to flatter
過節	过节	guò jié	to celebrate a festival, after the celebrations (i.e. once the festival is over)
過境	过境	guò jìng	to pass through a country's territory, transit
過濾	过滤	guòlǜ	to filter, filter
過期	过期	guò qī	to be overdue, to exceed the time limit, to expire (as in expiration date)
過剩	过剩	guòshèng	surplus, excess
過失	过失	guòshī	error, fault, (law) negligence, delinquency
過日子	过日子	guò rìzi	live, get along, practice economy
過頭	过头	guòtóu	to overdo it, to overstep the limit, excessively, above one's head, overhead
過往	过往	guòwǎng	to come and go, to have friendly relations with, in the past, previous
過意不去	过意不去	guòyìbùqù	to feel very apologetic
過癮	过瘾	guò yǐn	to satisfy a craving, to get a kick out of sth, gratifying, immensely enjoyable, satisfying, fulfilling
過硬	过硬	guòyìng	to have perfect mastery of sth, to be up to the mark
過早	过早	guòzǎo	premature, untimely
海岸	海岸	hǎiàn	seashore, coastal, seaside, tidewater, seacoast, shore, coast, staith, rivage, seaboard, sea, beach
海拔	海拔	hǎibá	natural elevation, ALT, height above sea level, altitude, sea_level, height, EL, above sea level, sea level, elevation
海濱	海滨	hǎibīn	shore, seaside
海盜	海盗	hǎidào	pirate
海量	海量	hǎiliàng	huge volume
海綿	海绵	hǎimián	sponge (zoology), sponge (piece of absorbent material, either natural or made from plastic etc), foam rubber
海面	海面	hǎimiàn	offing, sea surface, offshore, sea level, rim
海內外	海内外	hǎinèiwài	domestic and international, at home and abroad
海灘	海滩	hǎitān	seabeach, seaside, sea beach, foreshore, beach
海峽	海峡	hǎixiá	narrow, channel, straits, gullet, sound, strait, gut
海嘯	海啸	hǎixiào	tsunami
海域	海域	hǎiyù	water, waters, maritime space, sea area
海運	海运	hǎiyùn	sea transportation, ocean shipping
海藻	海藻	hǎizǎo	seaweed, marine alga, kelp
駭人聽聞	骇人听闻	hàirén-tīngwén	shocking, horrifying, atrocious, terrible
害蟲	害虫	hàichóng	injurious insect, pest
害臊	害臊	hài sào	to be bashful, to feel ashamed
害羞	害羞	hài xiū	be shy, bashful, coy, be bashful, shy, blush
酣暢	酣畅	hānchàng	unrestrained, cheerful lack of inhibition, esp. for drinking or sleeping, to drink with abandon
酣睡	酣睡	hānshuì	to sleep soundly, to fall into a deep sleep
含糊	含糊	hánhu	ambiguous, vague, careless, perfunctory
含蓄	含蓄	hánxù	to contain, to hold, (of a person or style etc) reserved, restrained, (of words, writings) full of hidden meaning, implicit, veiled (criticism)
函授	函授	hánshòu	to teach by correspondence
涵蓋	涵盖	hángài	cover, include
涵義	涵义	hányì	content, meaning, connotation, implication
罕見	罕见	hǎnjiàn	rare, rarely seen
汗水	汗水	hànshuǐ	sweat, perspiration
旱	旱	hàn	drought
旱災	旱灾	hànzāi	drought
焊	焊	hàn	to weld, to solder, variant of 焊[han4]
捍衛	捍卫	hànwèi	to defend, to uphold, to safeguard
行家	行家	hángjia	connoisseur, expert, veteran
行列	行列	hángliè	parade, procession, ranks, waiting line, cortege, promenade, row, single file, Indian file, column, queue, lineup, file, rank
行情	行情	hángqíng	prices, quotation, (market) quotations, market, price, quotations
航海	航海	hánghǎi	sailing, navigation, voyage by sea
航天	航天	hángtiān	space flight
航天員	航天员	hángtiānyuán	astronaut
航運	航运	hángyùn	shipping, transport
航行	航行	hángxíng	sail, fly
毫不	毫不	hàobù	nohow, not at all, no, no more, none, nowise, nothing
毫不猶豫	毫不犹豫	háobù yóuyù	without the slightest hesitation
毫無	毫无	háowú	completely lack
豪華	豪华	háohuá	luxurious, sumptuous
好歹	好歹	hǎodǎi	good and bad, most unfortunate occurrence, in any case, whatever
好比	好比	hǎobǐ	like, may be likened to, be just like, can be compared to
好感	好感	hǎogǎn	good opinion, favorable impression
好壞	好坏	hǎo-huài	good or bad, good and bad, standard, quality
好家伙	好家伙	hǎojiāhuo	my God!, oh boy!, man!
好評	好评	hǎopíng	reputation, high opinion, favorable comment, conceit, favorable review, esteem
好說	好说	hǎoshuō	easy to deal with, not a problem, (polite answer) you flatter me
好笑	好笑	hǎoxiào	laughable, funny
好心	好心	hǎoxīn	kindness, good intentions
好心人	好心人	hǎoxīnrén	Good people
好意	好意	hǎoyì	good intention, kindness
好在	好在	hǎozài	luckily, fortunately
號稱	号称	hàochēng	be known as, claim to be
好客	好客	hàokè	hospitality, to treat guests well, to enjoy having guests, hospitable, friendly
好奇心	好奇心	hàoqíxīn	interest in sth, curiosity, inquisitive
耗	耗	hào	to waste, to spend, to consume, to squander, news, (coll.) to delay, to dilly-dally
耗費	耗费	hàofèi	to waste, to spend, to consume, to squander
耗時	耗时	hàoshí	time-consuming, to take a period of (x amount of time)
浩劫	浩劫	hàojié	calamity, catastrophe, apocalypse
呵護	呵护	hēhù	to bless, to cherish, to take good care of, to conserve
禾苗	禾苗	hémiáo	seedling (of rice or other grain), CL:棵[ke1]
合唱	合唱	héchàng	choir, do a chorus, sing in a chorus, chorus, descant
合伙	合伙	héhuǒ	to act jointly, to form a partnership
合乎	合乎	héhū	conform with/to, accord, tally with, correspond to, accord with, conform_to, conform with, conform to, accord/tally with, to
合計	合计	héji	to add up the total, to figure what sth amounts to, to consider
合情合理	合情合理	héqíng-hélǐ	reasonable and fair (idiom)
合影	合影	héyǐng	to take a joint photo, group photo
合資	合资	hézī	joint venture, collect money, pool capital, raise funds, enter into partnership
合作社	合作社	hézuòshè	cooperative, cooperation, co-op, artel
何必	何必	hébì	why must...?, there is no need
何處	何处	héchù	where
何苦	何苦	hékǔ	why bother?, is it worth the trouble?
何況	何况	hékuàng	conj.: much less, let alone, all the more
何時	何时	héshí	when
和藹	和蔼	héǎi	kindly, nice, amiable
和解	和解	héjiě	become reconciled
和睦	和睦	hémù	peaceful relations, harmonious
和平共處	和平共处	hépínggòngchǔ	peaceful coexistence of nations, societies etc
和氣	和气	héqi	friendly, polite, amiable
和尚	和尚	héshang	bonze, talapoin, monk, Bhikku, Buddhist monk
河流	河流	héliú	freshet, rivers, river
河畔	河畔	hépàn	riverside, river plain
荷花	荷花	héhuā	lotus
核	核	hé	pit, nuclear, nucleus, nut, sth. resembling a fruit stone, stone, core, nucleolus, hilum, kernel
核電站	核电站	hédiànzhàn	nuclear power plant
核對	核对	héduì	to check, to verify, to audit, to examine
核能	核能	hénéng	nuclear energy
核桃	核桃	hétao	walnut, CL:個|个[ge4],棵[ke1]
核實	核实	héshí	to verify, to check
核武器	核武器	héwǔqì	nuclear weapon
賀信	贺信	hèxìn	Congratulate
賀電	贺电	hèdiàn	congratulatory telegram
喝彩	喝彩	hè cǎi	to acclaim, to cheer
赫然	赫然	hèrán	with astonishment, with a shock, awe-inspiringly, impressively, furiously (angry)
鶴立雞群	鹤立鸡群	hèlì-jīqún	a crane in a flock of chicken (idiom), way above the common, manifestly superior
黑客	黑客	hēikè	hacker (computing) (loanword)
黑馬	黑马	hēimǎ	dark horse, fig. unexpected winner
黑白	黑白	hēibái	black and white, right and wrong, good and bad
黑手	黑手	hēishǒu	Blackman
黑心	黑心	hēixīn	ruthless and lacking in conscience, vicious mind full of hatred and jealousy, black core (flaw in pottery)
嘿	嘿	hēi	hey!
痕跡	痕迹	hénjì	spark, taint, scrape, show, imprint, trace, vestige, spoor, sign, track, nick, mark, print, scar, scratch, scent, ash, vestigial, trail, impression
恨不得	恨不得	hènbude	wishing one could do sth, to hate to be unable, itching to do sth
哼	哼	hēng	humph!
橫七豎八	横七竖八	héngqī-shùbā	in disorder, at sixes and sevens (idiom)
橫向	横向	héngxiàng	horizontal, orthogonal, perpendicular, lateral, crosswise
橫	横	héng	horizontal, across, (horizontal character stroke), harsh and unreasonable, unexpected
轟	轰	hōng	explosion, bang, boom, rumble, to attack, to shoo away, to expel
轟動	轰动	hōngdòng	to cause a sensation, to create a stir in (a place), commotion, controversy
轟炸	轰炸	hōngzhà	bomb
哄	哄	hōng	roar of laughter (onom.), hubbub, to roar (as a crowd), to deceive, to coax, to amuse (a child), tumult, uproar, commotion, disturbance
哄堂大笑	哄堂大笑	hōngtáng-dàxiào	the whole room roaring with laughter (idiom)
烘乾	烘干	hōng gān	to dry over a stove
烘托	烘托	hōngtuō	background (of a painting), backdrop, a foil (to set off something to advantage), to offset (something to advantage)
弘揚	弘扬	hóngyáng	to enhance, to promote, to enrich
紅燈	红灯	hóngdēng	red light
紅火	红火	hónghuo	prosperous
紅撲撲	红扑扑	hóngpūpū	red, rosy, flushed
紅潤	红润	hóngrùn	ruddy, rosy, florid
紅薯	红薯	hóngshǔ	sweet potato
紅眼	红眼	hóngyǎn	Red eye
宏觀	宏观	hóngguān	macro-, macroscopic, holistic
宏偉	宏伟	hóngwěi	grand, imposing, magnificent
洪亮	洪亮	hóngliàng	loud and clear, resonant
喉嚨	喉咙	hóulong	throat
吼	吼	hǒu	to roar, to howl, to shriek, roar or howl of an animal, bellow of rage
後備	后备	hòubèi	reserve, backup
後備箱	后备箱	hòubèixiāng	trunk, boot (of a car)
後代	后代	hòudài	descendant, posterity, descendants, later generations, ages, limb, later ages, get, descendent, later periods, offspring, later periods in history, progeny
後盾	后盾	hòudùn	support, backing
後顧之憂	后顾之忧	hòugùzhīyōu	fears of trouble in the rear (idiom), family worries (obstructing freedom of action), worries about the future consequences, often in negative expressions, meaning 'no worries about anything'
後期	后期	hòuqī	late stage, later period
後勤	后勤	hòuqín	logistics
後人	后人	hòurén	posperity, descendants, posterity, later generations
後臺	后台	hòutái	backstage area, behind-the-scenes supporter, (computing) back-end, background
後退	后退	hòutuì	to recoil, to draw back, to fall back, to retreat
後續	后续	hòuxù	follow up
後遺癥	后遗症	hòuyízhèng	aftereffect, hangover, sequela, sequelae
後裔	后裔	hòuyì	descendant
後者	后者	hòuzhě	latter, the latter
厚道	厚道	hòudao	kind and honest, generous, sincere
厚度	厚度	hòudù	thickness
候選人	候选人	hòuxuǎnrén	aspirant, nominee, campaigner, candidate, candidate (for election)
呼風喚雨	呼风唤雨	hūfēng-huànyǔ	to call the wind and summon the rain (idiom), to exercise magical powers, fig. to stir up troubles
呼喚	呼唤	hūhuàn	to call out (a name etc), to shout
呼救	呼救	hūjiù	to call for help
呼聲	呼声	hūshēng	a shout, fig. opinion or demand, esp. expressed by a group
呼應	呼应	hūyìng	to conform (with), to echo, to correlate well, (linguistics) agreement
呼吁	呼吁	hūyù	to call on (sb to do sth), to appeal (to), an appeal
忽高忽低	忽高忽低	hūgāohūdī	I suddenly
忽悠	忽悠	hūyou	to rock, to sway, to flicker (e.g. of lights reflected on water), to flutter (e.g. of a flag), to trick sb into doing sth, to dupe, to con
胡鬧	胡闹	húnào	to act willfully and make a scene, to make trouble
胡說	胡说	húshuō	to talk nonsense, drivel
胡思亂想	胡思乱想	húsī-luànxiǎng	to indulge in flights of fancy (idiom), to let one's imagination run wild
湖泊	湖泊	húpō	lake
糊	糊	hū	congee, making a living, paste, cream
糊塗	糊涂	hútu	muddled, silly, confused
互補	互补	hùbǔ	complementary, to complement each other
互訪	互访	hùfǎng	exchange visits
互信	互信	hùxìn	mutual trust
互助	互助	hùzhù	Huzhu Tuzu autonomous county in Haidong prefecture 海東地區|海东地区[Hai3 dong1 di4 qu1], Qinghai, to help each other
護理	护理	hùlǐ	nursing
花瓣	花瓣	huābàn	petal, CL:片[pian4]
花卉	花卉	huāhuì	flowers and plants
花紋	花纹	huāwén	decorative design
花樣	花样	huāyàng	pattern, variety
華麗	华丽	huálì	magnificent, gorgeous
划算	划算	huásuàn	to calculate, to weigh (pros and cons), to view as profitable, worthwhile, value for money, cost-effective
華僑	华侨	huáqiáo	overseas Chinese
華裔	华裔	huáyì	foreign citizen of Ch. origin
嘩變	哗变	huábiàn	mutiny, rebellion
嘩然	哗然	huárán	in uproar, commotion, causing a storm of protest, tumultuous, variant of 嘩然|哗然[hua2 ran2]
滑冰	滑冰	huá bīng	to skate, skating
滑稽	滑稽	huáji	comical, funny, amusing, old pr. [gu3 ji1], huaji, a form of comedy performance popular in Shanghai, Jiangsu and Zhejiang
滑梯	滑梯	huátī	(children's) sliding board, a slide
滑雪	滑雪	huá xuě	to ski, skiing
化肥	化肥	huàféi	fertilizer
化身	化身	huàshēn	incarnation, reincarnation, embodiment (of abstract idea), personification
化纖	化纤	huàxiān	synthetic fiber
化險為夷	化险为夷	huàxiǎn-wéiyí	to turn peril into safety (idiom), to avert disaster
化驗	化验	huàyàn	laboratory test, chemical experiment, assay
化妝	化妆	huà zhuāng	make_up, bepaint, masquerade, put on make-up, make up, apply makeup, titivate
劃時代	划时代	huàshídài	epoch-marking
畫冊	画册	huàcè	picture album
畫龍點睛	画龙点睛	huàlóng-diǎnjīng	to paint a dragon and dot in the eyes (idiom), fig. to add the vital finishing touch, the crucial point that brings the subject to life, a few words to clinch the point
畫蛇添足	画蛇添足	huàshé-tiānzú	lit. draw legs on a snake (idiom), fig. to ruin the effect by adding sth superfluous, to overdo it
畫展	画展	huàzhǎn	art/paintings exhibition, art_exhibition, exhibition of paintings, art exhibition, art, paintings exhibition
話費	话费	huàfèi	call charge
話筒	话筒	huàtǒng	microphone, (telephone) receiver, handset
話語	话语	huàyǔ	utterance, discourse, word, speech, spoken language, endearment, remark
懷抱	怀抱	huáibào	ambition, embrace
懷舊	怀旧	huáijiù	fond remembrance of times past, nostalgia
懷裡	怀里	huáilǐ	embrace, bosom
懷孕	怀孕	huái yùn	gravid, expect, in a family way, with child, pregnant, be pregnant, gestate, impregnate, carry, bear, carry to term, be expecting, conceive
懷著	怀着	huáizhe	Be with
槐樹	槐树	huáishù	locust tree (Sophora japonica)
壞事	坏事	huàishì	rascality, evildoing, misdoing, villainy, roguery, bad thing, malfeasance, evil deed, caper
歡呼	欢呼	huānhū	to cheer for, to acclaim
歡聚	欢聚	huānjù	to get together socially, to celebrate, party, celebration
歡快	欢快	huānkuài	cheerful and lighthearted, lively
歡聲笑語	欢声笑语	huānshēng-xiàoyǔ	Laughter
還款	还款	huán kuǎn	repayment, to pay back money
還原	还原	huán yuán	to restore to the original state, to reconstruct (an event), reduction (chemistry)
環球	环球	huánqiú	around the world, worldwide
環繞	环绕	huánrào	circle, environ, encincture, encirclement, hoop, surround, cincture, gird, circumvolute, sphere, skirt, encircle, circumfluent, enwreathe, revolve around, border, girdle, girth, enring, rim
緩	缓	huǎn	slow, unhurried, sluggish, gradual, not tense, relaxed, to postpone, to defer, to stall, to stave off, to revive, to recuperate
緩和	缓和	huǎnhé	relax, ease up, mitigate, appease
緩緩	缓缓	huǎnhuǎn	postpone, postponement, little by little, slowly, put off, gradually, delay
幻覺	幻觉	huànjué	illusion, hallucination, figment of one's imagination
幻影	幻影	huànyǐng	phantom, mirage
換成	换成	huànchéng	change to
緩慢	缓慢	huǎnmàn	largo, slow
換位	换位	huàn wèi	transposition
換言之	换言之	huànyánzhī	in other words
換取	换取	huànqǔ	get in return, buy, exchange ... for, barter ... for, exchange sth. for, exchange
患	患	huàn	contract (an illness)
喚起	唤起	huànqǐ	arouse, call, recall
患病	患病	huàn bìng	to fall ill
患有	患有	huànyǒu	to contract (an illness), to be afflicted with, to suffer from
煥發	焕发	huànfā	to shine, to glow, to irradiate, to flash
荒誕	荒诞	huāngdàn	beyond belief, incredible, preposterous, fantastic
荒	荒	huāng	desolate, shortage, scarce, out of practice, absurd, uncultivated, to neglect
荒涼	荒凉	huāngliáng	desolate
慌亂	慌乱	huāngluàn	frenetic, hurried
荒謬	荒谬	huāngmiù	absurd, preposterous
慌張	慌张	huāngzhang	confused, flustered
皇宮	皇宫	huánggōng	imperial palace
皇室	皇室	huángshì	imperial family/house, royalty, imperial house, royal_family, imperial family, royal house, royal line, house, royal family
皇上	皇上	huángshang	the emperor, Your majesty the emperor, His imperial majesty
皇后	皇后	huánghòu	kaiserin, queen consort, queen, empress, queen_consort, Kaiserin
恍然大悟	恍然大悟	huǎngrán-dàwù	to suddenly realize, to suddenly see the light
晃	晃	huǎng	to dazzle, to flash past, to sway, to shake, to wander about
黃昏	黄昏	huánghūn	dusk, evening, nightfall
謊言	谎言	huǎngyán	lie
謊話	谎话	huǎnghuà	lie
灰	灰	huī	ash, dust
灰塵	灰尘	huīchén	dust
晃蕩	晃荡	huàngdang	to rock, to sway, to shake
揮	挥	huī	to wave, to brandish, to command, to conduct, to scatter, to disperse
灰心	灰心	huī xīn	to lose heart, to be discouraged
輝煌	辉煌	huīhuáng	glorious, effulgent, brilliant
回扣	回扣	huíkòu	brokerage, a commission paid to a middleman, euphemism for a bribe, a kickback
回饋	回馈	huíkuì	reward, feedback
回落	回落	huíluò	to fall back, to return to low level after a rise (in water level, price etc)
迴首	回首	huíshǒu	to turn around, to look back, to recollect
回升	回升	huíshēng	rise again (after a fall), pick up
回味	回味	huíwèi	to reflect on, to ponder over, aftertaste
回歸	回归	huíguī	reunification, return, regressive, regress
回想	回想	huíxiǎng	look_back, retrospect, recur, recollection, cut back, think back, echo, remember, reflect, recollect, recall, recapture, go back, flash_back, commemorate, retroject, retrace, flash back
回憶錄	回忆录	huíyìlù	memoir
悔恨	悔恨	huǐhèn	remorse, repentance
毀壞	毁坏	huǐhuài	to damage, to devastate, to vandalize, damage, destruction
匯合	汇合	huìhé	confluence, to converge, to join, to fuse, fusion
彙集	汇集	huìjí	to collect, to compile, to converge
毀滅	毁灭	huǐmiè	to perish, to ruin, to destroy
會場	会场	huìchǎng	assembly_hall, fraternity house, conference, assembly hall, conference/assembly hall, theater, meeting-place, chapterhouse, meeting place, venue, conference hall, frat house
會面	会面	huì miàn	to meet with, meeting
會聚	汇聚	huìjù	convergence, to come together
會晤	会晤	huìwù	to meet, meeting, conference
會意	会意	huìyì	combined ideogram (one of the Six Methods 六書|六书[liu4 shu1] of forming Chinese characters), Chinese character that combines the meanings of existing elements, also known as joint ideogram or associative compounds, to comprehend without being told explicitly, to cotton on, knowing (smile, glance etc)
會診	会诊	huì zhěn	consultation (medical), to meet for diagnosis, (by extension) consultation of different specialists
繪聲繪色	绘声绘色	huìshēng-huìsè	vivid and colorful (idiom), true to life, lively and realistic
賄賂	贿赂	huìlù	to bribe, a bribe
婚紗	婚纱	hūnshā	gown, wedding dress
婚姻	婚姻	hūnyīn	connubiality, wedlock, marital, union, marriage, married couple, matrimonial, match, man and wife, matrimony
渾身	浑身	húnshēn	all over, from head to foot
魂	魂	hún	soul, spirit, immortal soul, i.e. that can be detached from the body
昏迷	昏迷	hūnmí	to lose consciousness, to be in a coma, stupor, coma, stunned, disoriented
混凝土	混凝土	hùnníngtǔ	concrete
混淆	混淆	hùnxiáo	to obscure, to confuse, to mix up, to blur, to mislead
混濁	混浊	hùnzhuó	turbid, muddy, dirty
豁	豁	huō	to play Chinese finger-guessing game, opening, stake all, sacrifice, crack, slit, clear, open, exempt (from), liberal-minded
豁出去	豁出去	huō chuqu	to throw caution to the wind, to press one's luck, to go for broke
活該	活该	huógāi	(coll.) serve sb right, deservedly, ought, should
活期	活期	huóqī	(banking) current (account), checking (account), demand (deposit etc)
活兒	活儿	huór5	work, (lots of) things to do
火暴	火暴	huǒbào	fiery (temper), popular, flourishing, prosperous, lively, variant of 火爆[huo3 bao4]
火鍋	火锅	huǒguō	hotpot
火候	火候	huǒhou	heat control, maturity, crucial moment
火花	火花	huǒhuā	spark, sparkle
火炬	火炬	huǒjù	a torch, CL:把[ba3]
火辣辣	火辣辣	huǒlàlà	painful heat, scorching, painful heat, rude and forthright, provocative, hot, sexy
火熱	火热	huǒrè	fiery, burning, fervent, ardent, passionate
火山	火山	huǒshān	volcano
火速	火速	huǒsù	at top speed, at a tremendous lick
火焰	火焰	huǒyàn	blaze, flame
火藥	火药	huǒyào	gunpowder
伙食	伙食	huǒshi	food, meals
或多或少	或多或少	huòduōhuòshǎo	more or less
貨幣	货币	huòbì	coinage, mintage, tin, coin, currency, specie, monetary, money, metal money, piece
貨車	货车	huòchē	truck, van, freight wagon
貨物	货物	huòwù	portage, freight, hotshot, shipment, transit, payload, lading, load, commodity, traffic, salework, shipload, bale, consignment, ware, store, cargo, goods, loading, article, merchandise, invoice, charge, freightage
貨運	货运	huòyùn	freight transport, cargo, transported goods
獲勝	获胜	huò shèng	triumphant, triumph, beat, win victory, be victorious, conquer, gain, prevail, win
獲悉	获悉	huòxī	have, understand, get_onto, learn, learn (of an event)
禍害	祸害	huòhai	disaster, harm, scourge, bad person, to damage, to harm, to wreck
霍亂	霍乱	huòluàn	cholera
